"4146946"	"en_IND_tindia_int"	"2014-12-31 02:01:10"	"Palestinian draft resolution fails in UN council, US votes against"	"UN"
"4153382"	"en_IND_tindia_int"	"2014-12-31 18:01:17"	"Palestinians mull next move after UN statehood rebuff"	"UN"
"4166362"	"en_IND_tindia_int"	"2015-01-02 17:23:46"	"2014 deadliest year in Iraq since 2006-07: UN"	"UN"
"4184754"	"en_IND_tindia_int"	"2015-01-05 03:16:28"	"Palestine seeks to re-submit statehood bid to UN"	"UN"
"4200304"	"en_IND_tindia_int"	"2015-01-06 14:16:46"	"School attacks killed 160 Syrian children: UN"	"UN"
"4220219"	"en_IND_tindia_int"	"2015-01-08 04:17:03"	"Ebola fight has coordination problem, says new UN mission chief"	"UN"
"4239113"	"en_IND_tindia_int"	"2015-01-09 16:17:20"	"Nigeria unrest sends 7,300 fleeing to Chad: UN"	"UN"
"4247084"	"en_IND_tindia_int"	"2015-01-10 14:17:30"	"UN to host new Libya peace talks in Geneva next week"	"UN"
"4318451"	"en_IND_tindia_int"	"2015-01-15 00:55:45"	"Cuba, EU agree new talks in March: European sources"	"EU"
"4399792"	"en_IND_tindia_int"	"2015-01-19 01:58:52"	"Mali government, UN declare country Ebola-free"	"UN"
"4406115"	"en_IND_tindia_int"	"2015-01-19 09:58:57"	"Terror attacks overshadow EU foreign ministers meeting"	"EU"
"4421017"	"en_IND_tindia_int"	"2015-01-20 00:59:04"	"EU calls for anti-terror alliance with Arab countries"	"EU"
"4462905"	"en_IND_tindia_int"	"2015-01-27 12:02:22"	"UAE airlines halt Baghdad flights after shooting"	"AU"
"4462907"	"en_IND_tindia_int"	"2015-01-27 12:02:22"	"UN halts Gaza house repairs saying donors failed to pay up"	"UN"
"4481133"	"en_IND_tindia_int"	"2015-01-29 12:09:32"	"EU parliament president to meet with new Greek gov't"	"EU"
"4483280"	"en_IND_tindia_int"	"2015-01-29 14:09:33"	"UN warns Ebola epidemic 'not yet contained'"	"UN"
"4497653"	"en_IND_tindia_int"	"2015-01-30 03:09:44"	"Pak opposes India’s permanent UNSC membership"	"UN"
"4498514"	"en_IND_tindia_int"	"2015-01-30 04:09:45"	"EU expands Russia sanctions as new Ukraine talks loom"	"EU"
"4525445"	"en_IND_tindia_int"	"2015-01-31 10:10:00"	"UN chief asks Pakistan to step up efforts to combat terror"	"UN"
"4537433"	"en_IND_tindia_int"	"2015-02-01 01:10:08"	"Greece seeks EU allies on debt but Germany holds firm"	"EU"
"4547878"	"en_IND_tindia_int"	"2015-02-01 15:10:14"	"UN says violence in Iraq kills at least 1,375 in January"	"UN"
"4547880"	"en_IND_tindia_int"	"2015-02-01 15:10:14"	"EU must stop 'spasmodic' moves on Russia: Minister"	"EU"
"4547881"	"en_IND_tindia_int"	"2015-02-01 15:10:14"	"EU must stop 'spasmodic' moves on Russia: Greece"	"EU"
"4557015"	"en_IND_tindia_int"	"2015-02-02 02:10:55"	"UN council condemns 'heinous' Japanese hostage murder"	"UN"
"4591588"	"en_IND_tindia_int"	"2015-02-03 14:11:11"	"Serbia, Croatia didn't commit genocide in 1990s: Top UN court"	"UN"
"4650605"	"en_IND_tindia_int"	"2015-02-06 00:11:37"	"UN: ISIS burying kids alive in Iraq"	"UN"
"4651449"	"en_IND_tindia_int"	"2015-02-06 01:11:37"	"NATO beefs up response force to face Russia, Islamic threats"	"NATO"
"4673601"	"en_IND_tindia_int"	"2015-02-07 00:11:47"	"UAE likely to resume fights in US-led coalition against IS soon: US"	"AU"
"4688396"	"en_IND_tindia_int"	"2015-02-07 19:11:56"	"UAE sending F-16 fighters to Jordan to strike ISIS"	"AU"
"4735411"	"en_IND_tindia_int"	"2015-02-10 01:49:01"	"Girls face rising violence in fight for education: UN"	"UN"
"4781508"	"en_IND_tindia_int"	"2015-02-12 01:10:40"	"Greece in bailout showdown with EU"	"EU"
"4794268"	"en_IND_tindia_int"	"2015-02-12 14:10:44"	"Lanka appeals to UN to delay war crimes probe"	"UN"
"4795438"	"en_IND_tindia_int"	"2015-02-12 15:10:45"	"China backs bigger role for India, Brazil at UNSC"	"UN"
"4795440"	"en_IND_tindia_int"	"2015-02-12 15:10:45"	"Foreign troops kill seven ex-rebels in C Africa: UN"	"UN"
"4802054"	"en_IND_tindia_int"	"2015-02-12 21:10:48"	"EU leaders debate new anti-terror measures"	"EU"
"4812810"	"en_IND_tindia_int"	"2015-02-13 09:10:53"	"India's permanent UNSC seat unacceptable, Nawaz Sharif tells Barack Obama"	"UN"
"4830190"	"en_IND_tindia_int"	"2015-02-14 03:11:03"	"‘India doesn’t deserve permanent UNSC seat’"	"UN"
"4836245"	"en_IND_tindia_int"	"2015-02-14 11:11:06"	"UN ends support for Congo military offensive against rebels"	"UN"
"4858661"	"en_IND_tindia_int"	"2015-02-15 15:11:20"	"Jordan jails Brotherhood official for 18 months for criticising UAE"	"AU"
"4904323"	"en_IND_tindia_int"	"2015-02-17 16:11:42"	"Egypt pushes for UN-backed intervention against Libya jihadists"	"UN"
"4918468"	"en_IND_tindia_int"	"2015-02-18 07:11:49"	"Iraq envoy to UN: Islamic State might be harvesting organs"	"UN"
"4944902"	"en_IND_tindia_int"	"2015-02-19 10:12:00"	"ISIS trafficking human organs; UN investigates"	"UN"
"5044676"	"en_IND_tindia_int"	"2015-02-24 02:02:47"	"Russia and US spar over global crises at UN meeting"	"UN"
"5113746"	"en_IND_tindia_int"	"2015-02-27 01:33:10"	"Syria refugee crisis nears 'dangerous turning point':UN"	"UN"
"5144269"	"en_IND_tindia_int"	"2015-02-28 17:29:14"	"Reprieve for Sri Lanka as UN rights council defers report on violations till Sept 15"	"UN"
"5160673"	"en_IND_tindia_int"	"2015-03-01 14:55:41"	"UN fears hundreds of children kidnapped in South Sudan"	"UN"
"5178067"	"en_IND_tindia_int"	"2015-03-02 10:55:51"	"Over 6,000 killed in 'merciless devastation' in Ukraine: UN"	"UN"
"5182221"	"en_IND_tindia_int"	"2015-03-02 14:55:53"	"Kerry defends Israel before UN rights panel"	"UN"
"5182220"	"en_IND_tindia_int"	"2015-03-02 14:55:53"	"Over 6,000 killed in Ukraine conflict: UN"	"UN"
"5274660"	"en_IND_tindia_int"	"2015-03-06 13:40:18"	"EU slaps new sanctions on Syria regime backers"	"EU"
"5301370"	"en_IND_tindia_int"	"2015-03-07 20:40:34"	"Libyan Islamist leader backs UN talks, but tensions high"	"UN"
"5308619"	"en_IND_tindia_int"	"2015-03-08 06:40:39"	"UN calls for swift justice after 'heinous' Mali attack"	"UN"
"5314986"	"en_IND_tindia_int"	"2015-03-08 14:40:42"	"European Commission chief Juncker calls for EU army"	"EU"
"5321673"	"en_IND_tindia_int"	"2015-03-08 22:40:47"	"Militants attack UN as Mali hunts jihadist nightclub killers"	"UN"
"5355926"	"en_IND_tindia_int"	"2015-03-10 10:41:05"	"As race for UN chief begins, new campaigns demand a woman"	"UN"
"5360397"	"en_IND_tindia_int"	"2015-03-10 14:41:07"	"Jordan's King Abdullah urges EU to fight ""Islamophobia"""	"EU"
"5426565"	"en_IND_tindia_int"	"2015-03-13 08:32:46"	"Talks under way on ending UN sanctions on Iran"	"UN"
"5487045"	"en_IND_tindia_int"	"2015-03-16 07:33:29"	"India ranks 28 on UN's Disaster Risk and Age Index"	"UN"
"5497722"	"en_IND_tindia_int"	"2015-03-16 17:33:36"	"UN chief urges Japan, China, South Korea to reconcile"	"UN"
"5548398"	"en_IND_tindia_int"	"2015-03-18 18:34:56"	"Kim Jong-un's slave army: UN to probe claims of 20,000 North Korean 'bonded labourers' shipped around the world"	"UN"
"5579245"	"en_IND_tindia_int"	"2015-03-20 00:39:58"	"White House: US 'to reevaluate' backing for Israel at UN"	"UN"
"5580113"	"en_IND_tindia_int"	"2015-03-20 01:39:59"	"EU leaders dampen Greek hopes for bailout relief"	"EU"
"5604006"	"en_IND_tindia_int"	"2015-03-21 01:40:34"	"UN commission blames Israel for plight of Palestinian women"	"UN"
"5623731"	"en_IND_tindia_int"	"2015-03-22 02:40:49"	"UN security council to hold emergency meeting on Yemen"	"UN"
"5636295"	"en_IND_tindia_int"	"2015-03-22 18:41:05"	"South Sudan rebels free 250 child soldiers: UN"	"UN"
"5653417"	"en_IND_tindia_int"	"2015-03-23 17:19:42"	"Israel 'boycotts' UN rights council session on Gaza war"	"UN"
"5668516"	"en_IND_tindia_int"	"2015-03-24 08:20:10"	"UN watchdog says progress limited on Iran nuclear inquiry"	"UN"
"5759506"	"en_IND_tindia_int"	"2015-03-28 00:21:00"	"France presses at UN for Islamic State to face world court"	"UN"
"5772703"	"en_IND_tindia_int"	"2015-03-28 17:21:07"	"UN staff evacuated from Yemen capital: aid workers"	"UN"
"5784531"	"en_IND_tindia_int"	"2015-03-29 10:21:15"	"Diplomats, UN staff flee Yemen"	"UN"
"5877944"	"en_IND_tindia_int"	"2015-04-02 11:21:58"	"UAE sandstorm disrupts air traffic in Dubai"	"AU"
"5896510"	"en_IND_tindia_int"	"2015-04-03 06:22:42"	"519 dead in two weeks of Yemen fighting: UN"	"UN"
"5931506"	"en_IND_tindia_int"	"2015-04-05 02:23:03"	"EU aware of German air safety lapses' before deadly Alps crash"	"EU"
"5970979"	"en_IND_tindia_int"	"2015-04-07 03:23:25"	"UN Security Council demands aid access to Yarmuk camp in Syria"	"UN"
"5974954"	"en_IND_tindia_int"	"2015-04-07 08:23:28"	"Waving cash, Putin sows EU divisions in an effort to break sanctions"	"EU"
"5995949"	"en_IND_tindia_int"	"2015-04-08 06:23:38"	"Obama reiterates support for India as UNSC member"	"UN"
"6046981"	"en_IND_tindia_int"	"2015-04-10 13:24:05"	"PM Modi: India values UNESCO but progress won’t be judged by cold statistics"	"UN"
"6059013"	"en_IND_tindia_int"	"2015-04-11 02:24:11"	"Saudis say UN could vote soon on Yemen sanctions resolution"	"UN"
"6070810"	"en_IND_tindia_int"	"2015-04-11 18:24:19"	"UAE warns Pakistan it could pay 'heavy price for ambiguous stand' on Yemen crisis"	"AU"
"6070811"	"en_IND_tindia_int"	"2015-04-11 18:24:19"	"UNESCO keeps close watch on Taj Mahal's conservation"	"UN"
"6122252"	"en_IND_tindia_int"	"2015-04-14 08:36:53"	"UN report: 2014 saw extremists use of rape, sexual slavery"	"UN"
"6128334"	"en_IND_tindia_int"	"2015-04-14 14:36:56"	"UN asks Kenya to rethink closure of Somali refugee camp"	"UN"
"6133865"	"en_IND_tindia_int"	"2015-04-14 19:36:58"	"Cameron to support India's permament representation in UN Security Council"	"UN"
"6147329"	"en_IND_tindia_int"	"2015-04-15 10:37:05"	"Millions of Middle East children out of school, UN warns"	"UN"
"6165884"	"en_IND_tindia_int"	"2015-04-16 05:37:14"	"UN peace envoy to Yemen resigns"	"UN"
"6187396"	"en_IND_tindia_int"	"2015-04-17 03:37:23"	"'Yemen is in flames', says UN chief Ban Ki-moon, calls for immediate cease-fire"	"UN"
"6187395"	"en_IND_tindia_int"	"2015-04-17 03:37:23"	"'Yemen is in flames', says UN chief Ban Ki-moon, calls for immediate ceasefire"	"UN"
"6191441"	"en_IND_tindia_int"	"2015-04-17 08:37:25"	"Syria gas attack video moves UN Security Council envoys to tears"	"UN"
"6243095"	"en_IND_tindia_int"	"2015-04-19 22:37:55"	"Hundreds drown off Libya, EU leaders forced to reconsider migrant crisis"	"EU"
"6247829"	"en_IND_tindia_int"	"2015-04-20 04:37:58"	"India 5th biggest generator of e-waste in 2014: UN report"	"UN"
"6250392"	"en_IND_tindia_int"	"2015-04-20 07:37:59"	"Hundreds drown off Libya, EU reviews migrant crisis"	"EU"
"6256683"	"en_IND_tindia_int"	"2015-04-20 13:38:02"	"'Disgrace': EU under media fire after new migrant horror"	"EU"
"6258911"	"en_IND_tindia_int"	"2015-04-20 15:38:03"	"'No more excuses', EU warns as another migrant boat sinks"	"EU"
"6272485"	"en_IND_tindia_int"	"2015-04-21 05:38:09"	"EU needs tough border control after boat tragedy: Australia"	"EU"
"6274295"	"en_IND_tindia_int"	"2015-04-21 07:38:09"	"Migrant shipwreck: Captain, crew member arrested as UN says 800 dead"	"UN"
"6282917"	"en_IND_tindia_int"	"2015-04-21 15:38:13"	"Over 114,000 flee fighting in Iraq's Ramadi area: UN"	"UN"
"6308180"	"en_IND_tindia_int"	"2015-04-22 17:06:16"	"EU under pressure as full horror of migrant disaster emerges"	"EU"
"6326052"	"en_IND_tindia_int"	"2015-04-23 12:06:28"	"EU leaders face calls to take swift action on Med migrants"	"EU"
"6326051"	"en_IND_tindia_int"	"2015-04-23 12:06:28"	"EU leaders face calls to take swift action on Mediterranea migrants"	"EU"
"6327042"	"en_IND_tindia_int"	"2015-04-23 13:06:29"	"EU leaders face calls to take swift action on Mediterranean migrants"	"EU"
"6332511"	"en_IND_tindia_int"	"2015-04-23 18:06:31"	"EU leaders to pledge rescue for migrants, but no fix for problem"	"EU"
"6341364"	"en_IND_tindia_int"	"2015-04-24 03:06:36"	"EU leaders commit ships, aid to address migrant crisis"	"EU"
"6345389"	"en_IND_tindia_int"	"2015-04-24 08:06:38"	"EU triples migrant rescue fundings"	"EU"
"6363584"	"en_IND_tindia_int"	"2015-04-25 02:06:46"	"UN: High civilian toll in Yemen conflict; at least 550 dead"	"UN"
"6388012"	"en_IND_tindia_int"	"2015-04-26 09:07:01"	"UN to mount major relief effort in Nepal: Ban Ki-moon"	"UN"
"6418015"	"en_IND_tindia_int"	"2015-04-27 19:42:45"	"UNESCO to assess damage of world heritage sites in Nepal"	"UN"
"6437712"	"en_IND_tindia_int"	"2015-04-28 15:43:00"	"Over 50,000 pregnant women affected in quake: UN"	"UN"
"6443492"	"en_IND_tindia_int"	"2015-04-28 20:43:02"	"UN: More than 300,000 driven from homes in Yemen's conflict"	"UN"
"6474525"	"en_IND_tindia_int"	"2015-04-30 03:43:17"	"EU top court says banning homosexuals from giving blood may be justified"	"EU"
"6488817"	"en_IND_tindia_int"	"2015-04-30 17:43:23"	"EU humanitarian chief sounds warning on Iraq"	"EU"
"6507327"	"en_IND_tindia_int"	"2015-05-01 14:43:33"	"One thousand Europeans missing after Nepal quake: EU ambassador to Nepal"	"EU"
"6509148"	"en_IND_tindia_int"	"2015-05-01 16:43:34"	"Up to 1,000 Europeans missing after Nepal quake: EU envoy says"	"EU"
"6526695"	"en_IND_tindia_int"	"2015-05-02 14:43:45"	"Relief goods for Nepal quake victims held up at customs: UN"	"UN"
"6527530"	"en_IND_tindia_int"	"2015-05-02 15:43:45"	"Relief goods for Nepal quake victims held up at customs: UN"	"UN"
"6560353"	"en_IND_tindia_int"	"2015-05-04 08:44:04"	"Airliner diverted to UAE airbase after blast warning"	"AU"
"6704566"	"en_IND_tindia_int"	"2015-05-10 18:45:16"	"Four fresh tremors hit Nepal, UN revises aid appeal"	"UN"
"6745105"	"en_IND_tindia_int"	"2015-05-12 13:45:38"	"Britain refuses to participate in EU migrant resettlement plan"	"EU"
"6788621"	"en_IND_tindia_int"	"2015-05-14 08:45:58"	"Five reasons why Britain could be sleepwalking to an EU exit"	"EU"
"6830577"	"en_IND_tindia_int"	"2015-05-16 03:46:17"	"Luxembourg PM first gay EU leader to marry"	"EU"
"6868734"	"en_IND_tindia_int"	"2015-05-18 03:46:39"	"UN chief voices growing concern over migrant crisis"	"UN"
"6886864"	"en_IND_tindia_int"	"2015-05-18 21:46:46"	"UN chief concerned at death sentence for Egypt's Morsi"	"UN"
"6899782"	"en_IND_tindia_int"	"2015-05-19 19:27:12"	"1,850 killed, over 500,000 displaced in Yemen: UN"	"UN"
"6907749"	"en_IND_tindia_int"	"2015-05-20 02:27:19"	"UN to explore new Mideast peace effort with Israel"	"UN"
"6908593"	"en_IND_tindia_int"	"2015-05-20 03:27:20"	"UN chief Ban Ki-moon says North Korea retracts approval for visit"	"UN"
"6962420"	"en_IND_tindia_int"	"2015-05-22 11:00:21"	"EU, Ukraine sign $2 billion loan deal at Eastern summit"	"EU"
"6968909"	"en_IND_tindia_int"	"2015-05-22 17:00:28"	"55,000 have fled IS-captured Ramadi since mid-May: UN"	"UN"
"6971119"	"en_IND_tindia_int"	"2015-05-22 19:00:29"	"Cholera infects 3,000 Burundian refugees, UN calls for help"	"UN"
"7006928"	"en_IND_tindia_int"	"2015-05-24 16:00:53"	"ISIS sexually brutalizing captured women, UN expert says"	"UN"
"7019108"	"en_IND_tindia_int"	"2015-05-25 07:17:50"	"UN peace talks on Yemen postponed: official"	"UN"
"7028785"	"en_IND_tindia_int"	"2015-05-25 17:17:55"	"UK bars EU citizens to vote in upcomong historic referendum"	"EU"
"7044323"	"en_IND_tindia_int"	"2015-05-26 10:18:03"	"Militants kill UN soldier in Mali's capital"	"UN"
"7069047"	"en_IND_tindia_int"	"2015-05-27 11:21:07"	"Pak asks EU to relax travel restrictions"	"EU"
"7085798"	"en_IND_tindia_int"	"2015-05-28 03:21:15"	"About 200m fewer hungry people than in 1990: UN"	"UN"
"7122125"	"en_IND_tindia_int"	"2015-05-29 16:21:32"	"85,000 flee Ramadi since Islamic State capture: UN"	"UN"
"7134528"	"en_IND_tindia_int"	"2015-05-30 06:21:39"	"Australia welcomes UN call on Great Barrier Reef"	"UN"
"7139238"	"en_IND_tindia_int"	"2015-05-30 12:21:41"	"Child sex abuse claims shake UN as revelations continue"	"UN"
"7149892"	"en_IND_tindia_int"	"2015-05-31 02:00:50"	"Probes of child abuse in Central African Republic should intensify: UN rights chief"	"UN"
"7170294"	"en_IND_tindia_int"	"2015-06-01 04:01:16"	"UN envoy decries Syria regime raids as dozens killed"	"UN"
"7188804"	"en_IND_tindia_int"	"2015-06-01 23:01:23"	"Israel says UN grants Hamas-linked group NGO status"	"UN"
"7245459"	"en_IND_tindia_int"	"2015-06-04 10:01:50"	"UN appeals for $497 million of humanitarian aid for Iraq"	"UN"
"7284246"	"en_IND_tindia_int"	"2015-06-06 02:56:05"	"Kathmandu Valley to enter UN's 'heritage in danger' list"	"UN"
"7299029"	"en_IND_tindia_int"	"2015-06-06 21:56:13"	"Gambia expels top EU diplomat"	"EU"
"7322236"	"en_IND_tindia_int"	"2015-06-08 02:56:29"	"UN to host new rounds of Libya talks in Morocco"	"UN"
"7327896"	"en_IND_tindia_int"	"2015-06-08 09:56:32"	"EU: No Iran nuclear deal without UN probe of past"	"UN"
"7327896"	"en_IND_tindia_int"	"2015-06-08 09:56:32"	"EU: No Iran nuclear deal without UN probe of past"	"EU"
"7344312"	"en_IND_tindia_int"	"2015-06-09 01:56:39"	"Jihadists' slave markets sell girls at any price: UN envoy"	"UN"
"7364978"	"en_IND_tindia_int"	"2015-06-09 22:56:49"	"UK lawmakers back Cameron's EU referendum plans but debate highlights risks"	"EU"
"7382367"	"en_IND_tindia_int"	"2015-06-10 16:56:57"	"UN peacekeepers sexually abused hundreds in Haiti in exchange for food and medicine: Report"	"UN"
"7486642"	"en_IND_tindia_int"	"2015-06-15 14:33:45"	"UN chief calls for humanitarian pause in Yemen during Ramzan"	"UN"
"7504973"	"en_IND_tindia_int"	"2015-06-16 09:33:54"	"UN not equipped to tackle today's challenges: Report"	"UN"
"7538154"	"en_IND_tindia_int"	"2015-06-17 18:34:09"	"Man faces $68,000 fine for swearing on WhatsApp in UAE"	"AU"
"7564177"	"en_IND_tindia_int"	"2015-06-18 20:34:20"	"Final UN shelter in Gaza closes, many remain homeless"	"UN"
"7581987"	"en_IND_tindia_int"	"2015-06-19 15:34:27"	"Nepal farmers need urgent aid to avert threat of hunger facing one million: UN"	"UN"
"7583080"	"en_IND_tindia_int"	"2015-06-19 16:34:28"	"EU to launch operation against Libya migrant smugglers"	"EU"
"7625274"	"en_IND_tindia_int"	"2015-06-21 21:34:51"	"Yoga Day event draws thousands, including UN chief, to New York's Times Square"	"UN"
"7630670"	"en_IND_tindia_int"	"2015-06-22 04:34:54"	"EU official calls Greek proposal ""good basis for progress"""	"EU"
"7638250"	"en_IND_tindia_int"	"2015-06-22 12:34:57"	"EU extends sanctions on Russia, launches Libya mission"	"EU"
"7640298"	"en_IND_tindia_int"	"2015-06-22 14:34:58"	"Gaza war 2014: Israel, Hamas may have committed war crimes, UN report says"	"UN"
"7641301"	"en_IND_tindia_int"	"2015-06-22 15:34:59"	"EU launches operation against migrant smugglers"	"EU"
"7653701"	"en_IND_tindia_int"	"2015-06-23 04:35:04"	"Extremists have united in new offensive: Afghan UN envoy"	"UN"
"7657375"	"en_IND_tindia_int"	"2015-06-23 08:35:05"	"SCO not to become NATO: Russia"	"NATO"
"7658336"	"en_IND_tindia_int"	"2015-06-23 09:35:06"	"China blocks India's move in UN seeking action against Pakistan on Lakhvi"	"UN"
"7666843"	"en_IND_tindia_int"	"2015-06-23 17:35:09"	"UN opens human rights office in Seoul to monitor N Korea"	"UN"
"7674749"	"en_IND_tindia_int"	"2015-06-24 01:35:13"	"Hungary halts key EU asylum rule, saying 'the boat is full'"	"EU"
"7724687"	"en_IND_tindia_int"	"2015-06-26 05:35:35"	"Greece needs debt deal this weekend, EU leaders warn"	"EU"
"7728353"	"en_IND_tindia_int"	"2015-06-26 09:35:36"	"EU leaders agree to relocate 40,000 migrants"	"EU"
"7732481"	"en_IND_tindia_int"	"2015-06-26 13:35:38"	"Hollande returning to France from EU summit after terror attack: Official"	"EU"
"7747374"	"en_IND_tindia_int"	"2015-06-27 04:35:44"	"UN council told sound of helicopters has Syrians 'watching for death'"	"UN"
"7814126"	"en_IND_tindia_int"	"2015-06-30 11:36:15"	"South Sudan army raped then burnt girls alive: UN"	"UN"
"7816429"	"en_IND_tindia_int"	"2015-06-30 13:36:16"	"South Sudan army raped, then burnt girls alive: UN"	"UN"
