"3220852"	"en_CHN_mopost_int"	"2014-10-09 16:30:15"	"EU narrowly approves plan for new nuclear plant in Britain"	"EU"
"3236193"	"en_CHN_mopost_int"	"2014-10-10 19:31:05"	"UN envoy warns thousands could be massacred in Syrian town of Kobani"	"UN"
"3285125"	"en_CHN_mopost_int"	"2014-10-15 07:28:53"	"Australia says forces sent to Iraq standing idle in UAE over legal status"	"AU"
"3290926"	"en_CHN_mopost_int"	"2014-10-15 16:29:07"	"New Zealand, Turkey, Spain vie for places on UN Security Council"	"UN"
"3303943"	"en_CHN_mopost_int"	"2014-10-16 16:19:35"	"Global response to Ebola is falling short, UN and WHO say"	"UN"
"3313705"	"en_CHN_mopost_int"	"2014-10-17 10:21:47"	"UN's anti-Ebola trust fund massively short of its US$1 billion goal"	"UN"
"3321214"	"en_CHN_mopost_int"	"2014-10-17 22:22:00"	"Syria crisis and authoritarian slide linked to Turkey's failed UN bid"	"UN"
"3338628"	"en_CHN_mopost_int"	"2014-10-19 23:21:33"	"EU ministers meet over Ebola as Oxfam warns epidemic could become 'disaster of our generation'"	"EU"
"3338631"	"en_CHN_mopost_int"	"2014-10-19 23:21:33"	"UN delivers emergency food rations to fight Ebola in Sierra Leone"	"UN"
"3346933"	"en_CHN_mopost_int"	"2014-10-20 16:21:55"	"EU chief warns Cameron cap on immigration would breach EU law"	"EU"
"3372566"	"en_CHN_mopost_int"	"2014-10-22 15:23:07"	"Attempted murder verdict in London hotel thief's hammer attack on UAE sisters"	"AU"
"3388240"	"en_CHN_mopost_int"	"2014-10-23 17:23:53"	"Domestic helpers in UAE tell Human Rights Watch how they’re abused"	"AU"
"3398611"	"en_CHN_mopost_int"	"2014-10-24 13:24:30"	"Cameron interupts EU summit to call for crisis talks over cash demand"	"EU"
"3408441"	"en_CHN_mopost_int"	"2014-10-25 09:25:10"	"“We won’t pay,” furious Cameron tells EU over surprise 2.1-billion-euro bill"	"EU"
"3481175"	"en_CHN_mopost_int"	"2014-10-31 12:04:47"	"UN warns of ‘unprecedented’ number of foreign Islamic State jihadists"	"UN"
"3483659"	"en_CHN_mopost_int"	"2014-10-31 16:04:51"	"Foreign flood filling Islamic State ranks, UN and US intelligence say"	"UN"
"3512006"	"en_CHN_mopost_int"	"2014-11-03 15:07:37"	"Germany warns Britain over limits on immigration from EU members"	"EU"
"3538501"	"en_CHN_mopost_int"	"2014-11-05 15:08:55"	"US will push for targeted UN sanctions over South Sudan conflict"	"UN"
"3564422"	"en_CHN_mopost_int"	"2014-11-07 15:37:24"	"UN Ebola chief hopes epidemic will be beaten by 2015, as infections slow"	"UN"
"3574178"	"en_CHN_mopost_int"	"2014-11-08 15:37:49"	"EU calls for Palestinian state as tensions with Israel soar in Jerusalem"	"EU"
"3644894"	"en_CHN_mopost_int"	"2014-11-14 15:40:36"	"Special UN meeting urges stricter controls over killer robots"	"UN"
"3648098"	"en_CHN_mopost_int"	"2014-11-14 20:40:41"	"EU claims Dutch authorities and Starbucks brewed up a sweet tax deal"	"EU"
"3686904"	"en_CHN_mopost_int"	"2014-11-18 14:44:28"	"UN mourns sudden death of its new Ebola point man in Guinea"	"UN"
"3711910"	"en_CHN_mopost_int"	"2014-11-20 12:45:37"	"Almost 1,000 killed in Ukraine since September truce, says UN"	"UN"
"3714100"	"en_CHN_mopost_int"	"2014-11-20 15:45:41"	"UN body warns that 2070 is the deadline for ending CO2 emissions"	"UN"
"3740732"	"en_CHN_mopost_int"	"2014-11-23 01:47:00"	"No time to lose in battle against Ebola, says UN's Ban Ki-moon"	"UN"
"3741518"	"en_CHN_mopost_int"	"2014-11-23 04:47:04"	"EU learns lessons a year after start of Ukraine crisis"	"EU"
"3760416"	"en_CHN_mopost_int"	"2014-11-24 22:48:12"	"Islamic State recruiting children to fight battles, says UN"	"UN"
"3785311"	"en_CHN_mopost_int"	"2014-11-26 20:57:14"	"UN committee backs digital privacy despite qualms of the 'Five Eyes' nations"	"UN"
"3809595"	"en_CHN_mopost_int"	"2014-11-28 20:50:55"	"Restrict migrant benefits or we'll leave EU: British Prime Minister David Cameron"	"EU"
"3809597"	"en_CHN_mopost_int"	"2014-11-28 20:50:55"	"EU gives France extra 3 months to fix budget"	"EU"
"3826249"	"en_CHN_mopost_int"	"2014-11-30 21:52:13"	"Tough-talking Pole Donald Tusk set to take over as EU president"	"EU"
"3850664"	"en_CHN_mopost_int"	"2014-12-02 21:45:18"	"Saudi woman driver arrested at the UAE border"	"AU"
"3886087"	"en_CHN_mopost_int"	"2014-12-05 16:07:33"	"Migrants want to quit Greece but EU rules mean Athens must make them stay"	"EU"
"3926157"	"en_CHN_mopost_int"	"2014-12-09 14:49:54"	"Negotiators battle over UN pact on global warming"	"UN"
"3938471"	"en_CHN_mopost_int"	"2014-12-10 13:50:30"	"UN chief Ban Ki-moon voices deep concern over pace of climate action"	"UN"
"3973139"	"en_CHN_mopost_int"	"2014-12-13 09:42:08"	"UN climate talks deadlocked over scope of carbon reduction pledges"	"UN"
"4000366"	"en_CHN_mopost_int"	"2014-12-16 03:43:48"	"UN poised to open new inquiry into 1961 Dag Hammarskjold crash"	"UN"
"4065218"	"en_CHN_mopost_int"	"2014-12-22 00:00:01"	"UN Chief Ban Ki-moon tours Ebola-hit states as toll soars over 7,000"	"UN"
"4115673"	"en_CHN_mopost_int"	"2014-12-27 17:08:00"	"UN officials expelled for 'insulting' Sudan"	"UN"
"4146422"	"en_CHN_mopost_int"	"2014-12-31 00:05:30"	"UN General Assembly votes for probe to solve Dag Hammarskjold's death"	"UN"
"4154757"	"en_CHN_mopost_int"	"2014-12-31 21:07:17"	"UN Security Council rejects Palestinian move to end Israeli occupation"	"UN"
"73906"	"en_CHN_mopost_int"	"2014-01-01 16:45:40"	"Jordan assumes UN Security Council chair after Saudi Arabia rejected seat"	"UN"
"95453"	"en_CHN_mopost_int"	"2014-01-05 10:42:44"	"UN peacekeepers toil in South Sudan and Central African Republic"	"UN"
"97115"	"en_CHN_mopost_int"	"2014-01-05 19:42:51"	"Romanian migrant is unlikely star in UK after EU labour restrictions lifted"	"EU"
"117289"	"en_CHN_mopost_int"	"2014-01-08 15:44:45"	"Shezanne Cassim set for release from UAE prison after satirical video term"	"AU"
"163972"	"en_CHN_mopost_int"	"2014-01-15 09:50:30"	"In historic first, Vatican to face UN inquiry on sex abuse cases"	"UN"
"171547"	"en_CHN_mopost_int"	"2014-01-16 05:26:53"	"Religious hatred in Central Africa Republic underestimated, France tells UN"	"UN"
"175607"	"en_CHN_mopost_int"	"2014-01-16 16:26:59"	"EU says citizenship 'not for sale' amid criticism of investor schemes"	"EU"
"192824"	"en_CHN_mopost_int"	"2014-01-19 04:27:51"	"Turkey crisis undermines PM’s high-profile EU visit"	"EU"
"195324"	"en_CHN_mopost_int"	"2014-01-19 16:27:57"	"EU to announce 2030 climate change targets, with compromise possible"	"EU"
"206083"	"en_CHN_mopost_int"	"2014-01-21 04:28:25"	"UN drops Iran from Syria peace talks guest list after US pressure"	"UN"
"210227"	"en_CHN_mopost_int"	"2014-01-21 16:28:29"	"Syria peace talks set to begin after UN withdraws invitation to Iran"	"UN"
"210221"	"en_CHN_mopost_int"	"2014-01-21 16:28:29"	"EU to send troops to tackle 'epic crisis' in Central African Republic"	"EU"
"219133"	"en_CHN_mopost_int"	"2014-01-22 16:29:39"	"UN in urgent appeal for US$400m to fight spread of cholera in Haiti"	"UN"
"223433"	"en_CHN_mopost_int"	"2014-01-23 04:30:18"	"UN calls for tougher force to prevent genocide in the Central Africa Republic"	"UN"
"242317"	"en_CHN_mopost_int"	"2014-01-25 13:31:46"	"Syrian civil war foes meet face to face in UN mediator’s presence at Geneva summit"	"UN"
"259999"	"en_CHN_mopost_int"	"2014-01-28 05:32:54"	"Ukraine’s Yanukovych agrees to scrap anti-protest laws on eve of EU-Russia summit"	"EU"
"277459"	"en_CHN_mopost_int"	"2014-01-30 04:33:14"	"'Ice is breaking' in Syria talks, says UN mediator"	"UN"
"290240"	"en_CHN_mopost_int"	"2014-01-31 18:33:44"	"French president Hollande warns over Cameron's EU plans"	"EU"
"292300"	"en_CHN_mopost_int"	"2014-02-01 01:33:48"	"Former New York mayor Michael Bloomberg named UN climate envoy"	"UN"
"305359"	"en_CHN_mopost_int"	"2014-02-03 14:35:23"	"Corruption costs EU US$162b a year, says European Commission"	"EU"
"305704"	"en_CHN_mopost_int"	"2014-02-03 15:35:23"	"UN World Food Programme scales back projects to feed the hungry"	"UN"
"321487"	"en_CHN_mopost_int"	"2014-02-05 14:36:25"	"UN watchdog slams Vatican’s child abuse record"	"UN"
"321483"	"en_CHN_mopost_int"	"2014-02-05 14:36:25"	"Google closes in on deal in EU antitrust case"	"EU"
"321943"	"en_CHN_mopost_int"	"2014-02-05 15:36:25"	"UN committee demands Vatican action on child sex abuse"	"UN"
"321942"	"en_CHN_mopost_int"	"2014-02-05 15:36:25"	"UN details abuse of children in Syria"	"UN"
"323929"	"en_CHN_mopost_int"	"2014-02-05 20:36:26"	"UN committee demands Vatican action on child sex abuse"	"UN"
"324207"	"en_CHN_mopost_int"	"2014-02-05 21:36:27"	"Google closes in on deal in EU antitrust case"	"EU"
"326665"	"en_CHN_mopost_int"	"2014-02-06 04:36:29"	"Russia says now is not the time for a UN resolution on aid to Syria"	"UN"
"326903"	"en_CHN_mopost_int"	"2014-02-06 05:36:29"	"Now is not the time for a UN resolution on aid to Syria, Russia says"	"UN"
"335745"	"en_CHN_mopost_int"	"2014-02-07 05:21:37"	"American diplomats plan Ukraine's future, slam EU in leaked tapes bound to strain Russian ties"	"EU"
"339570"	"en_CHN_mopost_int"	"2014-02-07 16:21:43"	"UN welcomes deal to free civilians from Syrian city of Homs"	"UN"
"357803"	"en_CHN_mopost_int"	"2014-02-10 14:36:51"	"Swiss face EU backlash over curbs on immigration"	"EU"
"358202"	"en_CHN_mopost_int"	"2014-02-10 15:36:52"	"EU chief accuses British PM Cameron of posturing over immigration"	"EU"
"385350"	"en_CHN_mopost_int"	"2014-02-13 14:40:21"	"Central African Republic bloodshed declared ‘ethnic cleansing’ by the UN"	"UN"
"387013"	"en_CHN_mopost_int"	"2014-02-13 18:40:41"	"EU seeks to limit US government influence over management of web"	"EU"
"391602"	"en_CHN_mopost_int"	"2014-02-14 10:41:45"	"UN council huddles with Russia, China on Syria aid resolution but progress painfully slow"	"UN"
"391892"	"en_CHN_mopost_int"	"2014-02-14 11:41:46"	"Slow progress as UN council meets with Russia, China on Syria aid resolution"	"UN"
"392874"	"en_CHN_mopost_int"	"2014-02-14 14:41:47"	"UN aid chief Valerie Amos urges ‘action on the ground’ in Syria"	"UN"
"403804"	"en_CHN_mopost_int"	"2014-02-16 22:42:43"	"Barroso casts doubt on independent Scotland becoming an EU member"	"EU"
"417381"	"en_CHN_mopost_int"	"2014-02-18 19:44:00"	"British judges defy EU by ruling in favour of whole-life jail terms"	"EU"
"422805"	"en_CHN_mopost_int"	"2014-02-19 13:44:42"	"EU holds Ukraine crisis talks amid calls for sanctions"	"EU"
"423113"	"en_CHN_mopost_int"	"2014-02-19 14:44:43"	"UN chief to push ahead with Syria peace talks after negotiations end"	"UN"
"427449"	"en_CHN_mopost_int"	"2014-02-20 04:46:11"	"New fighting in Central African Republic blocks UN visit"	"UN"
"429637"	"en_CHN_mopost_int"	"2014-02-20 11:46:13"	"Deadly clashes break Ukraine truce as EU envoys cancel meeting"	"EU"
"430004"	"en_CHN_mopost_int"	"2014-02-20 12:46:15"	"Deadly clashes break Ukraine truce as EU envoys cancel meeting"	"EU"
"430778"	"en_CHN_mopost_int"	"2014-02-20 14:46:16"	"Deadly clashes break Ukraine truce as EU set to back sanctions"	"EU"
"431453"	"en_CHN_mopost_int"	"2014-02-20 16:46:17"	"Deadly clashes shatter Ukraine truce as EU set to back sanctions"	"EU"
"434597"	"en_CHN_mopost_int"	"2014-02-21 03:46:24"	"After Ukraine carnage, EU declares sanctions against officials with ‘blood on their hands’"	"EU"
"434856"	"en_CHN_mopost_int"	"2014-02-21 04:46:25"	"UN chief wants 3,000 more troops for Central African Republic"	"UN"
"436532"	"en_CHN_mopost_int"	"2014-02-21 10:46:28"	"Yanukovych reaches deal with Ukrainian opposition after EU declares sanctions"	"EU"
"448791"	"en_CHN_mopost_int"	"2014-02-23 21:48:10"	"UN finally backs resolution calling for aid convoys to be granted access across war-torn Syria"	"UN"
"460171"	"en_CHN_mopost_int"	"2014-02-25 13:48:51"	"EU urges Russian support as Ukraine delays forming new government"	"EU"
"460832"	"en_CHN_mopost_int"	"2014-02-25 15:48:53"	"Iran agrees deal to sell US$195m of arms to Iraq, busting UN embargo"	"UN"
"467681"	"en_CHN_mopost_int"	"2014-02-26 14:49:47"	"David Cameron woos Angela Merkel in bid for German support for EU reform"	"EU"
"467674"	"en_CHN_mopost_int"	"2014-02-26 14:49:47"	"Tens of thousands of Icelanders demand referendum on EU membership"	"EU"
"467984"	"en_CHN_mopost_int"	"2014-02-26 15:49:48"	"Cameron woos Merkel in bid for German support for EU reform"	"EU"
"478534"	"en_CHN_mopost_int"	"2014-02-27 15:09:17"	"Merkel calls for ‘strong UK with strong voice inside EU’"	"EU"
"504988"	"en_CHN_mopost_int"	"2014-03-03 12:19:24"	"EU pushes mediation rather than sanctions against Russia over Ukraine crisis"	"EU"
"506134"	"en_CHN_mopost_int"	"2014-03-03 15:19:25"	"Russian troops flood into Crimea as EU pushes mediation"	"EU"
"522768"	"en_CHN_mopost_int"	"2014-03-05 14:20:38"	"US-Russia talks on Ukraine as EU backs massive aid"	"EU"
"523543"	"en_CHN_mopost_int"	"2014-03-05 16:20:39"	"US-Russia hold talks on Ukraine as EU backs massive aid package"	"EU"
"529589"	"en_CHN_mopost_int"	"2014-03-06 10:20:47"	"EU summit to tackle Ukraine crisis as diplomacy falters"	"EU"
"530215"	"en_CHN_mopost_int"	"2014-03-06 12:20:49"	"Crimea votes to join Russia as EU leaders push Ukraine diplomacy"	"EU"
"534884"	"en_CHN_mopost_int"	"2014-03-07 03:20:57"	"Obama and EU slap first sanctions on Russia over Ukraine crisis"	"EU"
"535371"	"en_CHN_mopost_int"	"2014-03-07 05:22:38"	"Obama and EU slap first sanctions on Russia over Ukraine crisis"	"EU"
"570777"	"en_CHN_mopost_int"	"2014-03-12 04:44:19"	"British referendum on EU unlikely before 2020 if Labour wins power, says Ed Miliband"	"EU"
"572954"	"en_CHN_mopost_int"	"2014-03-12 14:44:32"	"EU poised to ban US use of cheese names in trade deal"	"EU"
"572955"	"en_CHN_mopost_int"	"2014-03-12 14:44:32"	"Half of all lawmakers will be women within 20 years, says UN study"	"UN"
"582189"	"en_CHN_mopost_int"	"2014-03-13 16:37:57"	"Biblical film epic Noah banned from cinemas in Qatar, Bahrain and UAE"	"AU"
"744342"	"en_CHN_mopost_int"	"2014-03-19 18:16:32"	"G8 could expel Russia, says British Prime Minister David Cameron"	"G8"
"744878"	"en_CHN_mopost_int"	"2014-03-19 19:16:33"	"G8 could expel Russia, says British Prime Minister David Cameron"	"G8"
"750495"	"en_CHN_mopost_int"	"2014-03-20 10:16:53"	"EU takes aim at Russia economy as Kiev plans Crimea pullout"	"EU"
"750874"	"en_CHN_mopost_int"	"2014-03-20 11:16:54"	"EU takes aim at Russia economic sanctions as Kiev plans Crimea evacuation"	"EU"
"766371"	"en_CHN_mopost_int"	"2014-03-21 16:17:36"	"UN fears developing nations will spark global shortage of clean water"	"UN"
"800538"	"en_CHN_mopost_int"	"2014-03-25 17:21:13"	"Russia shrugs off its exclusion from G8 over Crimea crisis"	"G8"
"801104"	"en_CHN_mopost_int"	"2014-03-25 18:21:14"	"Russia shrugs off its exclusion from G8 group of leading industrial countries over Crimea crisis"	"G8"
"802439"	"en_CHN_mopost_int"	"2014-03-25 21:21:18"	"Russia shrugs off its exclusion from G8 group of leading industrial countries over Crimea crisis"	"G8"
"817050"	"en_CHN_mopost_int"	"2014-03-27 08:22:04"	"Ukraine predicts ‘yes’ vote at UN on its territorial integrity"	"UN"
"821048"	"en_CHN_mopost_int"	"2014-03-27 15:22:13"	"Obama and EU leaders in show of solidarity over trade in snub to Russia"	"EU"
"826630"	"en_CHN_mopost_int"	"2014-03-28 04:22:29"	"IMF pledges US$18b to bailout Ukraine as UN condemns Russia and Congress backs sanctions"	"UN"
"847515"	"en_CHN_mopost_int"	"2014-03-31 00:23:57"	"Tehran's new UN envoy linked to US embassy hostage crisis"	"UN"
"847520"	"en_CHN_mopost_int"	"2014-03-31 00:23:57"	"UN climate panel warns that global warming will complicate security issues"	"UN"
"850396"	"en_CHN_mopost_int"	"2014-03-31 08:24:07"	"UN warns over world’s food supplies amid climate change"	"UN"
"855019"	"en_CHN_mopost_int"	"2014-03-31 17:24:19"	"UN court rules Japan’s Antarctic whaling not for scientific ends, revokes permit"	"UN"
"864027"	"en_CHN_mopost_int"	"2014-04-01 15:46:44"	"American anger over UN envoy’s links to Iranian hostage crisis"	"UN"
"889441"	"en_CHN_mopost_int"	"2014-04-03 15:48:04"	"Europe’s far right plans to use legislative elections to attack EU"	"EU"
"915568"	"en_CHN_mopost_int"	"2014-04-06 13:49:40"	"Time running out to meet global warming target - UN report"	"UN"
"934528"	"en_CHN_mopost_int"	"2014-04-08 06:33:21"	"UN chief decries murder of Dutch priest in Syria"	"UN"
"938724"	"en_CHN_mopost_int"	"2014-04-08 15:33:31"	"EU survey finds its bees in far better shape than was feared"	"EU"
"940718"	"en_CHN_mopost_int"	"2014-04-08 18:33:34"	"Senate bill would bar Iranian UN envoy tied to hostage-taking from US"	"UN"
"951885"	"en_CHN_mopost_int"	"2014-04-09 17:43:07"	"Far-right Austrian politicians forced to quit EU election campaign"	"EU"
"951879"	"en_CHN_mopost_int"	"2014-04-09 17:43:07"	"US, EU, Russia, Ukraine to meet as unrest in east Ukraine deepens crisis"	"EU"
"963701"	"en_CHN_mopost_int"	"2014-04-10 15:43:38"	"EU peacekeepers in Central African Republic to help stem bloodshed"	"EU"
"965600"	"en_CHN_mopost_int"	"2014-04-10 18:43:42"	"UN approves peacekeepers to stem violence in Central African Republic"	"UN"
"968582"	"en_CHN_mopost_int"	"2014-04-11 00:43:50"	"UN approves peacekeepers to stem violence in Central African Republic"	"UN"
"975726"	"en_CHN_mopost_int"	"2014-04-11 16:44:11"	"Congress votes to bar US entry to Iran’s choice for UN ambassador"	"UN"
"987084"	"en_CHN_mopost_int"	"2014-04-13 00:46:34"	"Iran to take up with UN the US' denial of visa for envoy Hamid Aboutalebi"	"UN"
"990522"	"en_CHN_mopost_int"	"2014-04-13 13:46:51"	"UN climate chief urges ‘bold’ steps to curb carbon emissions"	"UN"
"1002678"	"en_CHN_mopost_int"	"2014-04-14 19:47:31"	"EU threatens Russia with new sanctions amid turmoil in Ukraine"	"EU"
"1025934"	"en_CHN_mopost_int"	"2014-04-16 15:48:29"	"UN experts allege that Chinese arms on way to Mali peacekeepers went missing"	"UN"
"1026741"	"en_CHN_mopost_int"	"2014-04-16 16:48:30"	"UN’s Rashido Manjoo slams Britain's ‘boys’ club sexist culture’"	"UN"
"1106071"	"en_CHN_mopost_int"	"2014-04-18 17:04:59"	"Mob forces way into UN base in South Sudan, opens fire, kills 48 civilians"	"UN"
"1106072"	"en_CHN_mopost_int"	"2014-04-18 17:04:59"	"Experts warn Mers virus may be mutating after sudden spurt in Saudi, UAE"	"AU"
"1340207"	"en_CHN_mopost_int"	"2014-04-22 17:17:10"	"Mauritius eyes UN hearing as step to regaining sovereignty of Diego Garcia"	"UN"
"1341535"	"en_CHN_mopost_int"	"2014-04-22 19:17:14"	"Mauritius eyes UN hearing as step to regaining sovereignty of Chagos islands, including Diego Garcia"	"UN"
"1358879"	"en_CHN_mopost_int"	"2014-04-24 06:19:25"	"UN Security Council members mull South Sudan sanctions as attacks continue"	"UN"
"1364720"	"en_CHN_mopost_int"	"2014-04-24 16:19:38"	"Russia, China block UN sanctions on CAR’s former leader Francois Bozize"	"UN"
"1364724"	"en_CHN_mopost_int"	"2014-04-24 16:19:38"	"World Bank and UN push the potential of jackfruit as food staple"	"UN"
"1364718"	"en_CHN_mopost_int"	"2014-04-24 16:19:38"	"EU wins right to sue Reynolds American for money laundering"	"EU"
"1408452"	"en_CHN_mopost_int"	"2014-04-28 15:21:44"	"PLO plans to join 60 UN bodies, agreements after failed talks"	"UN"
"1420552"	"en_CHN_mopost_int"	"2014-04-29 12:22:12"	"New EU sanctions over Ukraine crisis target Russian army, intelligence chiefs"	"EU"
"1498349"	"en_CHN_mopost_int"	"2014-05-05 18:35:22"	"Vatican tries to limit role in sex abuse cases before UN anti-torture panel"	"UN"
"1522209"	"en_CHN_mopost_int"	"2014-05-07 15:15:18"	"Warlord Joseph Kony in hiding in South Sudan, says UN"	"UN"
"1535910"	"en_CHN_mopost_int"	"2014-05-08 16:15:50"	"EU president Van Rompuy exchanges haiku with Japan’s Abe"	"EU"
"1538289"	"en_CHN_mopost_int"	"2014-05-08 20:15:54"	"Gross violations of human rights committed in South Sudan, says UN"	"UN"
"1545399"	"en_CHN_mopost_int"	"2014-05-09 11:16:11"	"One billion people still defecating in the open, says UN"	"UN"
"1549850"	"en_CHN_mopost_int"	"2014-05-09 18:16:19"	"One billion people still defecate in public despite health risks, says UN"	"UN"
"1583399"	"en_CHN_mopost_int"	"2014-05-13 04:25:02"	"Procurement for Iran’s banned nuclear programme has slowed, UN says"	"UN"
"1585154"	"en_CHN_mopost_int"	"2014-05-13 08:18:02"	"Warlord Joseph Kony hunted in the Central African Republic, UN envoy says"	"UN"
"1589353"	"en_CHN_mopost_int"	"2014-05-13 15:18:10"	"France asks UN to refer Syrian war to International Criminal Court"	"UN"
"1589459"	"en_CHN_mopost_int"	"2014-05-13 15:25:17"	"Norwegian general Kristin Lund is first woman UN peacekeeping commander"	"UN"
"1590736"	"en_CHN_mopost_int"	"2014-05-13 17:18:16"	"Google loses ‘right to be forgotten’ case in EU ruling on data privacy"	"EU"
"1602732"	"en_CHN_mopost_int"	"2014-05-14 15:09:23"	"UN observer at Gaddafi sons’ Tripoli trial accused of black magic"	"UN"
"1602741"	"en_CHN_mopost_int"	"2014-05-14 15:09:23"	"Randy superhero Voteman proves too raunchy for Danes ahead of EU poll"	"EU"
"1602733"	"en_CHN_mopost_int"	"2014-05-14 15:09:23"	"UN mediator Lakhdar Brahimi apologises to Syrian people as he steps down"	"UN"
"1603410"	"en_CHN_mopost_int"	"2014-05-14 16:09:23"	"Poland, Romania warn EU of risk of Ukraine becoming a failed state"	"EU"
"1617056"	"en_CHN_mopost_int"	"2014-05-15 16:10:06"	"US and EU discuss third round of sanctions on Russia over Ukraine"	"EU"
"1627843"	"en_CHN_mopost_int"	"2014-05-16 12:10:30"	"UN monitors warn on human rights in Eastern Ukraine and Crimea"	"UN"
"1632727"	"en_CHN_mopost_int"	"2014-05-16 20:10:39"	"Pro-Russia militia in Ukraine are 'killing and torturing', says UN"	"UN"
"1633660"	"en_CHN_mopost_int"	"2014-05-16 22:10:41"	"EU court's ruling on web search will keep skeletons in the closet"	"EU"
"1702353"	"en_CHN_mopost_int"	"2014-05-22 19:56:16"	"China and Russia veto draft UN Security Council resolution on Syria"	"UN"
"1712990"	"en_CHN_mopost_int"	"2014-05-23 15:56:38"	"UN Security Council says Boko Haram is linked to al-Qaeda"	"UN"
"1712994"	"en_CHN_mopost_int"	"2014-05-23 15:56:38"	"Anti-EU populist Geert Wilders suffers setback, exit poll shows"	"EU"
"1716238"	"en_CHN_mopost_int"	"2014-05-23 20:58:24"	"Anti-EU populist Geert Wilders suffers setback, exit poll shows"	"EU"
"1739630"	"en_CHN_mopost_int"	"2014-05-26 07:57:50"	"Britain’s Ukip rides anti-EU wave to open up lead in European elections"	"EU"
"1744985"	"en_CHN_mopost_int"	"2014-05-26 16:58:01"	"UN replaces millennium poverty plan with sustainable development goals"	"UN"
"1765521"	"en_CHN_mopost_int"	"2014-05-28 06:58:46"	"EU urges Russia to work with new Ukraine leader and 'de-escalate the situation'"	"EU"
"1770224"	"en_CHN_mopost_int"	"2014-05-28 14:58:55"	"Power struggle in EU over Jean-Claude Juncker taking top job"	"EU"
"1816609"	"en_CHN_mopost_int"	"2014-06-01 22:01:27"	"David Cameron reportedly ready to leave EU if Juncker elected chief"	"EU"
"1832539"	"en_CHN_mopost_int"	"2014-06-03 05:18:09"	"West criticises UN draft resolution tabled by Russia calling for Ukraine ceasefire"	"UN"
"1838269"	"en_CHN_mopost_int"	"2014-06-03 15:18:24"	"100,000 victims’ names read in global protest against UN inaction on Syria"	"UN"
"1878996"	"en_CHN_mopost_int"	"2014-06-06 16:17:54"	"Jean-Claude Juncker attacks Britain for opposing bid to head EU"	"EU"
"1922487"	"en_CHN_mopost_int"	"2014-06-10 19:25:45"	"Merkel rebukes Cameron for threat to leave EU over presidency"	"EU"
"1933628"	"en_CHN_mopost_int"	"2014-06-11 17:26:12"	"Rising hate speech in Europe could breed violence, UN rights chief warns"	"UN"
"1945793"	"en_CHN_mopost_int"	"2014-06-12 16:36:52"	"Uganda’s Sam Kutesa elected UN General Assembly president"	"UN"
"1949871"	"en_CHN_mopost_int"	"2014-06-12 23:27:37"	"Uganda's Sam Kutesa elected UN General Assembly president"	"UN"
"1958134"	"en_CHN_mopost_int"	"2014-06-13 16:28:01"	"Russia introduces UN resolution calling for end to violence in Ukraine"	"UN"
"1958136"	"en_CHN_mopost_int"	"2014-06-13 16:28:01"	"African nations making progress in battle to protect elephants, UN says"	"UN"
"2000582"	"en_CHN_mopost_int"	"2014-06-17 17:30:54"	"Jordan's Prince Zeid named UN high commissioner for human rights"	"UN"
"2008826"	"en_CHN_mopost_int"	"2014-06-20 17:47:13"	"UN agency warns Britain over African children kidnapped for voodoo rituals"	"UN"
"2013389"	"en_CHN_mopost_int"	"2014-06-22 00:30:29"	"UN secretary general opposes airstrikes on extremists in Iraq"	"UN"
"2021689"	"en_CHN_mopost_int"	"2014-06-22 21:34:23"	"Israel threatens to expel UN envoy Robert Serry over cash for Gaza"	"UN"
"2071689"	"en_CHN_mopost_int"	"2014-06-26 19:58:22"	"UN chides Iran over juvenile executions"	"UN"
"2078941"	"en_CHN_mopost_int"	"2014-06-27 11:58:49"	"Russia warns Ukraine’s EU deal will have ‘serious consequences’"	"EU"
"2079920"	"en_CHN_mopost_int"	"2014-06-27 13:58:51"	"David Cameron in EU summit showdown over top job for Jean-Claude Juncker"	"EU"
"2081187"	"en_CHN_mopost_int"	"2014-06-27 15:58:54"	"Ukraine seals EU deal that sparked revolution amid warnings from Russia"	"EU"
"2081866"	"en_CHN_mopost_int"	"2014-06-27 16:58:55"	"Ukraine seals EU deal that sparked revolution amid warnings from Russia"	"EU"
"2083798"	"en_CHN_mopost_int"	"2014-06-27 20:00:16"	"Russia threatens retaliation over newly signed Ukraine-EU pact"	"EU"
"2088269"	"en_CHN_mopost_int"	"2014-06-28 08:59:18"	"Juncker named to top EU job in bitter blow for British PM Cameron"	"EU"
"2093585"	"en_CHN_mopost_int"	"2014-06-29 00:00:52"	"Juncker named to top EU job in bitter blow for British PM Cameron"	"EU"
"2093913"	"en_CHN_mopost_int"	"2014-06-29 01:00:57"	"Juncker named to top EU job in bitter blow for British PM Cameron"	"EU"
"2108830"	"en_CHN_mopost_int"	"2014-06-30 16:00:35"	"David Cameron calls to congratulate Juncker, the EU president he didn’t want"	"EU"
"2159659"	"en_CHN_mopost_int"	"2014-07-04 16:02:46"	"UNHCR voices ‘profound concern’ over Australia’s handling of Sri Lankan refugees"	"UN"
"2160255"	"en_CHN_mopost_int"	"2014-07-04 17:02:48"	"UNHCR voices concern over Australia’s handling of Sri Lankan refugees"	"UN"
