"2161485"	"en_CHN_mopost_int"	"2014-07-04 19:05:32"	"UNHCR 'concern' over Australia's handling of Sri Lankan refugees"	"UN"
"2171935"	"en_CHN_mopost_int"	"2014-07-06 00:03:33"	"Ivory trade's role in funding African militants highlighted in UN report"	"UN"
"2212987"	"en_CHN_mopost_int"	"2014-07-09 16:05:34"	"Iraq confirms to UN that ISIL jihadis seized chemical weapons facility"	"UN"
"2212983"	"en_CHN_mopost_int"	"2014-07-09 16:05:34"	"UN reports soaring civilian casualties in Afghanistan as violence deepens"	"UN"
"2247495"	"en_CHN_mopost_int"	"2014-07-15 02:18:41"	"UN has moral responsibility to end Haiti cholera outbreak, Ban says"	"UN"
"2256925"	"en_CHN_mopost_int"	"2014-07-15 15:19:02"	"Tripoli airport attack wrecks 90pc of planes as UN pulls out"	"UN"
"2273175"	"en_CHN_mopost_int"	"2014-07-16 20:19:40"	"Aids can be beaten worldwide by 2030, UN reports says"	"UN"
"2277375"	"en_CHN_mopost_int"	"2014-07-17 05:19:52"	"US, EU stiffen sanctions against Russia over its support for Ukraine separatists"	"EU"
"2306916"	"en_CHN_mopost_int"	"2014-07-19 11:21:17"	"Gaza death toll tops 300 as UN chief heads to Middle East in peace effort"	"UN"
"2308288"	"en_CHN_mopost_int"	"2014-07-19 14:21:21"	"Gaza death toll tops 330 as UN chief heads to Middle East in peace effort"	"UN"
"2311972"	"en_CHN_mopost_int"	"2014-07-19 23:21:30"	"Gaza death toll tops 340 as UN chief heads to Middle East in peace effort"	"UN"
"2313119"	"en_CHN_mopost_int"	"2014-07-20 03:39:31"	"Rebel’s trying to destroy MH17 crash evidence, Kiev says, as UN reveals 80 children were on plane"	"UN"
"2313348"	"en_CHN_mopost_int"	"2014-07-20 04:39:32"	"80 children were on board flight MH17, UN says, as rebels 'attempt to destroy crash evidence'"	"UN"
"2314901"	"en_CHN_mopost_int"	"2014-07-20 10:21:44"	"UN draft resolution calls for access to MH17 crash site in Ukraine"	"UN"
"2342157"	"en_CHN_mopost_int"	"2014-07-22 17:22:56"	"John Kerry and UN chief in Cairo to push for end to Gaza violence"	"UN"
"2342161"	"en_CHN_mopost_int"	"2014-07-22 17:22:56"	"Russia backs UN resolution demanding international access to MH17 crash site"	"UN"
"2368508"	"en_CHN_mopost_int"	"2014-07-24 17:07:22"	"Fifteen killed in Israeli shelling of UN school sheltering Palestinians"	"UN"
"2370845"	"en_CHN_mopost_int"	"2014-07-24 20:07:26"	"Islamic State has ordered female genital mutilation: UN"	"UN"
"2388805"	"en_CHN_mopost_int"	"2014-07-26 11:08:17"	"EU hits Russian intelligence chiefs in new round of sanctions over Ukraine"	"EU"
"2407200"	"en_CHN_mopost_int"	"2014-07-28 12:09:20"	"Downing of flight MH17 ‘may amount to a war crime’: UN"	"UN"
"2407800"	"en_CHN_mopost_int"	"2014-07-28 13:09:21"	"Lull in fighting after UN Security Council calls for immediate Gaza ceasefire"	"UN"
"2408399"	"en_CHN_mopost_int"	"2014-07-28 14:09:22"	"Downing of flight MH17 ‘may amount to a war crime’: UN"	"UN"
"2410285"	"en_CHN_mopost_int"	"2014-07-28 17:09:26"	"Eid brings lull in Gaza fighting as UN Security Council calls for Gaza ceasefire"	"UN"
"2410914"	"en_CHN_mopost_int"	"2014-07-28 18:09:28"	"UN chief says ‘political will’ the main obstacle to ending Gaza conflict"	"UN"
"2432896"	"en_CHN_mopost_int"	"2014-07-30 13:32:07"	"Carnage at UN school as Israeli tanks pound Gaza refugee camp"	"UN"
"2434070"	"en_CHN_mopost_int"	"2014-07-30 15:32:10"	"Task force on airline safety to be formed after MH17 downing, UN body says"	"UN"
"2441841"	"en_CHN_mopost_int"	"2014-07-31 05:32:32"	"Deaths in shelling of Gaza market, school enrage UN as toll in conflict tops 1,360"	"UN"
"2474361"	"en_CHN_mopost_int"	"2014-08-03 01:34:14"	"British Airways boss Willie Walsh calls for UN inventory on missiles"	"UN"
"2477318"	"en_CHN_mopost_int"	"2014-08-03 11:34:27"	"Israel strikes UN school in Gaza as troops start redeploying"	"UN"
"2481249"	"en_CHN_mopost_int"	"2014-08-03 21:34:40"	"Israel strikes UN school in Gaza as troops start redeploying"	"UN"
"2481619"	"en_CHN_mopost_int"	"2014-08-03 22:34:41"	"UK exit from EU a viable option, says report commissioned by Boris Johnson"	"EU"
"2591291"	"en_CHN_mopost_int"	"2014-08-13 12:12:13"	"Time running out for Iraqis besieged by jihadists as UN warns of ‘potential genocide’"	"UN"
"2604705"	"en_CHN_mopost_int"	"2014-08-14 13:12:50"	"UN says Iraq humanitarian crisis ‘at highest level’ in wake of Islamic State onslaught"	"UN"
"2617642"	"en_CHN_mopost_int"	"2014-08-15 15:31:40"	"EU has ‘shot itself in foot’ with Russia sanctions, says Hungarian PM Viktor Orban"	"EU"
"2619996"	"en_CHN_mopost_int"	"2014-08-15 19:31:50"	"UN's nuclear watchdog chief Yukiya Amano to visit Tehran for talks"	"UN"
"2695170"	"en_CHN_mopost_int"	"2014-08-22 13:27:21"	"UN rights chief slams Syria ‘paralysis’ as death toll tops 191,000"	"UN"
"2726605"	"en_CHN_mopost_int"	"2014-08-25 17:29:09"	"Overwhelmed by flood of boatpeople, Italy makes new plea for EU help"	"EU"
"2737772"	"en_CHN_mopost_int"	"2014-08-26 15:29:39"	"UN condemns abuse of Tanzania’s albino children"	"UN"
"2749901"	"en_CHN_mopost_int"	"2014-08-27 13:32:39"	"UN accuses Islamic State, Syrian government of committing war crimes"	"UN"
"2754878"	"en_CHN_mopost_int"	"2014-08-27 21:30:28"	"UN accuses Islamic State, Syrian government of committing war crimes"	"UN"
"2775606"	"en_CHN_mopost_int"	"2014-08-29 12:31:25"	"Syrian rebels, UN face off after kidnappings as number of refugees hits 3 million"	"UN"
"2778628"	"en_CHN_mopost_int"	"2014-08-29 17:31:32"	"Besieged by Syrian rebels, Filipino UN peacekeepers vow to fight"	"UN"
"2786805"	"en_CHN_mopost_int"	"2014-08-30 14:31:59"	"EU, Ukraine debate sanctions against Russia amid euro bloc's leadership shuffle"	"EU"
"2787917"	"en_CHN_mopost_int"	"2014-08-30 17:32:02"	"EU debates more sanctions as Russia 'flattens' Ukrainian town"	"EU"
"2790462"	"en_CHN_mopost_int"	"2014-08-30 23:58:52"	"EU debates more sanctions as Russia 'flattens' Ukrainian town"	"EU"
"2798397"	"en_CHN_mopost_int"	"2014-08-31 22:56:30"	"David Cameron lauds reform stance of new EU chief Donald Tusk"	"EU"
"2819093"	"en_CHN_mopost_int"	"2014-09-02 16:57:37"	"Islamists holding UN peacekeepers hostage set high price for their release"	"UN"
"2819094"	"en_CHN_mopost_int"	"2014-09-02 16:57:37"	"Putin’s ‘two weeks to Kiev’ line quoted ‘out of context’ by EU chief"	"EU"
"2821837"	"en_CHN_mopost_int"	"2014-09-02 20:57:43"	"Iraqi forces fight back as UN agrees to investigate atrocities"	"UN"
"2887047"	"en_CHN_mopost_int"	"2014-09-11 05:34:32"	"Ozone layer showing first signs of recovery, says UN study"	"UN"
"2887587"	"en_CHN_mopost_int"	"2014-09-11 06:34:33"	"Ozone layer showing first signs of recovery, UN study says"	"UN"
"2898685"	"en_CHN_mopost_int"	"2014-09-11 23:38:04"	"Ozone layer showing first signs of recovery, UN study says"	"UN"
"2907324"	"en_CHN_mopost_int"	"2014-09-12 16:35:20"	"EU accused of wrecking push for peace with fresh sanctions on Russia over Ukraine"	"EU"
"2953840"	"en_CHN_mopost_int"	"2014-09-16 23:38:10"	"Kiev lawmakers ratify agreement with EU as Russia pledges to dig in"	"EU"
"2983071"	"en_CHN_mopost_int"	"2014-09-19 05:44:41"	"UN announces Ebola mission, adopts resolution to fight outbreak"	"UN"
"2990927"	"en_CHN_mopost_int"	"2014-09-19 18:39:57"	"UN says world population heading for 11 billion, may not stabilise"	"UN"
"2996691"	"en_CHN_mopost_int"	"2014-09-20 09:40:17"	"G20 set to back OECD plan to tackle global tax avoidance"	"OECD"
"3001412"	"en_CHN_mopost_int"	"2014-09-20 21:40:33"	"Global tax reform plan to crack down on tax avoidance is 'biggest in a century', OECD says"	"OECD"
"3002361"	"en_CHN_mopost_int"	"2014-09-21 00:40:37"	"Time for climate to take centre stage, activists say ahead of UN summit"	"UN"
"3012034"	"en_CHN_mopost_int"	"2014-09-22 05:41:21"	"Large-scale climate change march staged in New York ahead of UN summit"	"UN"
"3017241"	"en_CHN_mopost_int"	"2014-09-22 15:41:35"	"World in an 'era of crises': Ban Ki-moon downbeat ahead of UN summit"	"UN"
"3020943"	"en_CHN_mopost_int"	"2014-09-22 21:47:55"	"World in an 'era of crises': Ban Ki-moon downbeat ahead of UN summit"	"UN"
"3020945"	"en_CHN_mopost_int"	"2014-09-22 21:47:55"	"China's carbon emissions more than US and EU combined, data shows"	"EU"
"3031147"	"en_CHN_mopost_int"	"2014-09-23 18:03:46"	"Don't mention the Bush war; Obama's dilemma as he tries to rally UN"	"UN"
"3031146"	"en_CHN_mopost_int"	"2014-09-23 18:03:46"	"British and Iranian leaders plan talks at UN summit, first since 1979"	"UN"
"3034446"	"en_CHN_mopost_int"	"2014-09-23 23:03:53"	"UN chief Ban Ki-moon calls on world leaders to act now on global warming"	"UN"
"3070642"	"en_CHN_mopost_int"	"2014-09-26 18:37:14"	"UN treaty limiting arms trade will come into force in December"	"UN"
"3082118"	"en_CHN_mopost_int"	"2014-09-28 00:16:39"	"US calls Abbas' speech about 'genocidal war' at UN 'offensive'"	"UN"
"3089826"	"en_CHN_mopost_int"	"2014-09-28 22:17:35"	"North Korean foreign minister labels UN Security Council as a forum of lies"	"UN"
"3220852"	"en_CHN_mopost_int"	"2014-10-09 16:30:15"	"EU narrowly approves plan for new nuclear plant in Britain"	"EU"
"3224640"	"en_CHN_mopost_int"	"2014-10-09 22:30:24"	"EU narrowly approves plan for new nuclear plant in Britain"	"EU"
"3236193"	"en_CHN_mopost_int"	"2014-10-10 19:31:05"	"UN envoy warns thousands could be massacred in Syrian town of Kobani"	"UN"
"3285125"	"en_CHN_mopost_int"	"2014-10-15 07:28:53"	"Australia says forces sent to Iraq standing idle in UAE over legal status"	"AU"
"3290185"	"en_CHN_mopost_int"	"2014-10-15 15:29:06"	"Second Texas Ebola case as UN warns infections could to soar to ‘10,000 a week’"	"UN"
"3290926"	"en_CHN_mopost_int"	"2014-10-15 16:29:07"	"New Zealand, Turkey, Spain vie for places on UN Security Council"	"UN"
"3303943"	"en_CHN_mopost_int"	"2014-10-16 16:19:35"	"Global response to Ebola is falling short, UN and WHO say"	"UN"
"3307438"	"en_CHN_mopost_int"	"2014-10-16 21:19:41"	"Global response to Ebola is falling short, UN and WHO say"	"UN"
"3313705"	"en_CHN_mopost_int"	"2014-10-17 10:21:47"	"UN's anti-Ebola trust fund massively short of its US$1 billion goal"	"UN"
"3315053"	"en_CHN_mopost_int"	"2014-10-17 12:21:49"	"UN’s anti-Ebola trust fund massively short of its US$1 billion goal"	"UN"
"3321214"	"en_CHN_mopost_int"	"2014-10-17 22:22:00"	"Syria crisis and authoritarian slide linked to Turkey's failed UN bid"	"UN"
"3338631"	"en_CHN_mopost_int"	"2014-10-19 23:21:33"	"UN delivers emergency food rations to fight Ebola in Sierra Leone"	"UN"
"3338628"	"en_CHN_mopost_int"	"2014-10-19 23:21:33"	"EU ministers meet over Ebola as Oxfam warns epidemic could become 'disaster of our generation'"	"EU"
"3346933"	"en_CHN_mopost_int"	"2014-10-20 16:21:55"	"EU chief warns Cameron cap on immigration would breach EU law"	"EU"
"3372566"	"en_CHN_mopost_int"	"2014-10-22 15:23:07"	"Attempted murder verdict in London hotel thief's hammer attack on UAE sisters"	"AU"
"3388240"	"en_CHN_mopost_int"	"2014-10-23 17:23:53"	"Domestic helpers in UAE tell Human Rights Watch how they’re abused"	"AU"
"3398611"	"en_CHN_mopost_int"	"2014-10-24 13:24:30"	"Cameron interupts EU summit to call for crisis talks over cash demand"	"EU"
"3400883"	"en_CHN_mopost_int"	"2014-10-24 16:43:33"	"EU nations set new climate change target, with compromises"	"EU"
"3408441"	"en_CHN_mopost_int"	"2014-10-25 09:25:10"	"“We won’t pay,” furious Cameron tells EU over surprise 2.1-billion-euro bill"	"EU"
"3408787"	"en_CHN_mopost_int"	"2014-10-25 10:25:12"	"'We won’t pay,' furious Cameron tells EU over surprise 2.1-billion-euro bill"	"EU"
"3481175"	"en_CHN_mopost_int"	"2014-10-31 12:04:47"	"UN warns of ‘unprecedented’ number of foreign Islamic State jihadists"	"UN"
"3483659"	"en_CHN_mopost_int"	"2014-10-31 16:04:51"	"Foreign flood filling Islamic State ranks, UN and US intelligence say"	"UN"
"3484064"	"en_CHN_mopost_int"	"2014-10-31 16:06:26"	"EU deal sees Russia resume natural gas supplies to Ukraine for winter"	"EU"
"3487075"	"en_CHN_mopost_int"	"2014-10-31 21:06:50"	"EU deal sees Russia resume natural gas supplies to Ukraine for winter"	"EU"
"3512006"	"en_CHN_mopost_int"	"2014-11-03 15:07:37"	"Germany warns Britain over limits on immigration from EU members"	"EU"
"3538501"	"en_CHN_mopost_int"	"2014-11-05 15:08:55"	"US will push for targeted UN sanctions over South Sudan conflict"	"UN"
"3564422"	"en_CHN_mopost_int"	"2014-11-07 15:37:24"	"UN Ebola chief hopes epidemic will be beaten by 2015, as infections slow"	"UN"
"3574178"	"en_CHN_mopost_int"	"2014-11-08 15:37:49"	"EU calls for Palestinian state as tensions with Israel soar in Jerusalem"	"EU"
"3644894"	"en_CHN_mopost_int"	"2014-11-14 15:40:36"	"Special UN meeting urges stricter controls over killer robots"	"UN"
"3648098"	"en_CHN_mopost_int"	"2014-11-14 20:40:41"	"EU claims Dutch authorities and Starbucks brewed up a sweet tax deal"	"EU"
"3686904"	"en_CHN_mopost_int"	"2014-11-18 14:44:28"	"UN mourns sudden death of its new Ebola point man in Guinea"	"UN"
"3711910"	"en_CHN_mopost_int"	"2014-11-20 12:45:37"	"Almost 1,000 killed in Ukraine since September truce, says UN"	"UN"
"3714100"	"en_CHN_mopost_int"	"2014-11-20 15:45:41"	"UN body warns that 2070 is the deadline for ending CO2 emissions"	"UN"
"3718343"	"en_CHN_mopost_int"	"2014-11-20 21:50:48"	"Almost 1,000 killed in Ukraine since September truce, says UN"	"UN"
"3740732"	"en_CHN_mopost_int"	"2014-11-23 01:47:00"	"No time to lose in battle against Ebola, says UN's Ban Ki-moon"	"UN"
"3741518"	"en_CHN_mopost_int"	"2014-11-23 04:47:04"	"EU learns lessons a year after start of Ukraine crisis"	"EU"
"3741758"	"en_CHN_mopost_int"	"2014-11-23 05:47:05"	"EU learns lessons a year after start of Ukraine crisis"	"EU"
"3760416"	"en_CHN_mopost_int"	"2014-11-24 22:48:12"	"Islamic State recruiting children to fight battles, says UN"	"UN"
"3785311"	"en_CHN_mopost_int"	"2014-11-26 20:57:14"	"UN committee backs digital privacy despite qualms of the 'Five Eyes' nations"	"UN"
"3809595"	"en_CHN_mopost_int"	"2014-11-28 20:50:55"	"Restrict migrant benefits or we'll leave EU: British Prime Minister David Cameron"	"EU"
"3809597"	"en_CHN_mopost_int"	"2014-11-28 20:50:55"	"EU gives France extra 3 months to fix budget"	"EU"
"3826249"	"en_CHN_mopost_int"	"2014-11-30 21:52:13"	"Tough-talking Pole Donald Tusk set to take over as EU president"	"EU"
"3826771"	"en_CHN_mopost_int"	"2014-11-30 23:16:40"	"Tough-talking Donald Tusk set to take over as EU president"	"EU"
"3850664"	"en_CHN_mopost_int"	"2014-12-02 21:45:18"	"Saudi woman driver arrested at the UAE border"	"AU"
"3886087"	"en_CHN_mopost_int"	"2014-12-05 16:07:33"	"Migrants want to quit Greece but EU rules mean Athens must make them stay"	"EU"
"3926157"	"en_CHN_mopost_int"	"2014-12-09 14:49:54"	"Negotiators battle over UN pact on global warming"	"UN"
"3938471"	"en_CHN_mopost_int"	"2014-12-10 13:50:30"	"UN chief Ban Ki-moon voices deep concern over pace of climate action"	"UN"
"3973139"	"en_CHN_mopost_int"	"2014-12-13 09:42:08"	"UN climate talks deadlocked over scope of carbon reduction pledges"	"UN"
"3978600"	"en_CHN_mopost_int"	"2014-12-14 00:45:06"	"UN climate talks deadlocked over scope of carbon reduction pledges"	"UN"
"4000366"	"en_CHN_mopost_int"	"2014-12-16 03:43:48"	"UN poised to open new inquiry into 1961 Dag Hammarskjold crash"	"UN"
"4065218"	"en_CHN_mopost_int"	"2014-12-22 00:00:01"	"UN Chief Ban Ki-moon tours Ebola-hit states as toll soars over 7,000"	"UN"
"4115673"	"en_CHN_mopost_int"	"2014-12-27 17:08:00"	"UN officials expelled for 'insulting' Sudan"	"UN"
"4146422"	"en_CHN_mopost_int"	"2014-12-31 00:05:30"	"UN General Assembly votes for probe to solve Dag Hammarskjold's death"	"UN"
"4154757"	"en_CHN_mopost_int"	"2014-12-31 21:07:17"	"UN Security Council rejects Palestinian move to end Israeli occupation"	"UN"
"4157898"	"en_CHN_mopost_int"	"2015-01-01 17:22:55"	"Palestinians join International Criminal Court after UN bid fails"	"UN"
"4209137"	"en_CHN_mopost_int"	"2015-01-07 09:18:06"	"UN chief says Palestine to join International Criminal Court on April 1"	"UN"
"4344085"	"en_CHN_mopost_int"	"2015-01-16 03:59:15"	"Ebola hotspots remain in West Africa, but new cases falling: UN"	"UN"
"4415861"	"en_CHN_mopost_int"	"2015-01-19 19:01:26"	"EU ministers call for alliance with Muslim countries to fight terrorism"	"EU"
"4449906"	"en_CHN_mopost_int"	"2015-01-26 23:03:31"	"Russia blocks UN statement on Ukraine as fighting escalates"	"UN"
"4474461"	"en_CHN_mopost_int"	"2015-01-29 09:08:59"	"Greek PM stuns EU partners, shakes markets with first moves after taking power"	"EU"
"4478653"	"en_CHN_mopost_int"	"2015-01-29 10:09:01"	"Greek PM stuns EU, shakes markets with first moves after taking power"	"EU"
"4510419"	"en_CHN_mopost_int"	"2015-01-30 16:09:57"	"EU fears Athens courting Kremlin, days after shaking European markets"	"EU"
"4528990"	"en_CHN_mopost_int"	"2015-01-31 14:13:39"	"UN chief backs regional African force to fight Boko Haram"	"UN"
"4575433"	"en_CHN_mopost_int"	"2015-02-02 20:31:22"	"Africa loses at least US$50 billion a year to illicit practices, UN study group says"	"UN"
"4589638"	"en_CHN_mopost_int"	"2015-02-03 12:14:12"	"UN court rules Serbia did not commit genocide in Croatia"	"UN"
"4591949"	"en_CHN_mopost_int"	"2015-02-03 14:14:21"	"UN’s highest court absolves Croatia, Serbia of genocide"	"UN"
"4593160"	"en_CHN_mopost_int"	"2015-02-03 15:14:22"	"New Greek leaders seeking ‘menu of debt swaps’ with EU partners"	"EU"
"4594234"	"en_CHN_mopost_int"	"2015-02-03 16:14:24"	"UN slams civilian death toll in eastern Ukraine as violence escalates"	"UN"
"4710685"	"en_CHN_mopost_int"	"2015-02-08 23:48:46"	"UAE says it is sending jets to help Jordan fight Islamic State militants"	"AU"
"4766073"	"en_CHN_mopost_int"	"2015-02-11 11:10:08"	"An estimated ‘300 migrants died at sea’ attempting to reach Italy, says UN agency"	"UN"
"4768448"	"en_CHN_mopost_int"	"2015-02-11 13:10:11"	"At least ‘200 migrants die’ crossing sea from Libya to Europe, says UN agency"	"UN"
"4770841"	"en_CHN_mopost_int"	"2015-02-11 15:10:14"	"More than ‘300 migrants die’ crossing sea from Libya to Europe, says UN agency"	"UN"
"4797852"	"en_CHN_mopost_int"	"2015-02-12 17:10:56"	"Afghanistan’s Taliban increasingly funded by criminal enterprises: UN report"	"UN"
"4828791"	"en_CHN_mopost_int"	"2015-02-14 01:11:45"	"EU announces new measures to combat terrorism"	"EU"
"4890306"	"en_CHN_mopost_int"	"2015-02-17 01:14:09"	"UN passes resolution Shiite Houthi rebels hand over control of Yemen"	"UN"
"4893028"	"en_CHN_mopost_int"	"2015-02-17 04:34:35"	"EU ministers give Greece ultimatum: Ask for bailout extension or face debts alone"	"EU"
"4923664"	"en_CHN_mopost_int"	"2015-02-18 12:15:00"	"Ukraine troops pull out of Debaltseve as EU slams ‘violation’ of ceasefire"	"EU"
"4930817"	"en_CHN_mopost_int"	"2015-02-18 18:36:03"	"UN chief sends New Year greetings to Chinese people"	"UN"
"4945275"	"en_CHN_mopost_int"	"2015-02-19 10:17:04"	"Ukraine calls for EU peacekeepers to save truce deal after deadly fighting in Debaltseve"	"EU"
"4948032"	"en_CHN_mopost_int"	"2015-02-19 13:18:41"	"Greece asks EU for six-month loan extension in bid to avoid default"	"EU"
"4948033"	"en_CHN_mopost_int"	"2015-02-19 13:18:41"	"Ukraine calls for EU to save truce after deadly fighting in Debaltseve"	"EU"
"4952112"	"en_CHN_mopost_int"	"2015-02-19 16:36:47"	"Russia dismisses Kiev’s calls for UN peacekeepers to be deployed in eastern Ukraine"	"UN"
"4970922"	"en_CHN_mopost_int"	"2015-02-20 12:19:28"	"EU, Britain ‘sleepwalked’ into Ukraine crisis: UK lawmakers"	"EU"
"4976077"	"en_CHN_mopost_int"	"2015-02-20 17:19:54"	"Greece seeks stronger ties with China as EU debt stand-off nears deadline"	"EU"
"5075976"	"en_CHN_mopost_int"	"2015-02-25 11:03:20"	"Rights group calls for UN arms embargo on Syria over barrel bombs"	"UN"
"5089053"	"en_CHN_mopost_int"	"2015-02-26 01:31:51"	"EU policymakers unveil plans for free flow of gas and power to entire 28-member bloc"	"EU"
"5095452"	"en_CHN_mopost_int"	"2015-02-26 08:32:00"	"Al-Jazeera journalists arrested for using drones in Paris amid puzzling series of UAV flights"	"AU"
"5178235"	"en_CHN_mopost_int"	"2015-03-02 10:56:12"	"More than 6,000 killed in ‘merciless devastation’ in Ukraine: UN rights chief"	"UN"
"5221239"	"en_CHN_mopost_int"	"2015-03-04 08:39:52"	"Nobel Peace Prize panel unseats chairman whose tenure saw unpopular nods to Obama, EU"	"EU"
"5253272"	"en_CHN_mopost_int"	"2015-03-05 15:40:38"	"UN urged to end Libya arms embargo"	"UN"
"5292701"	"en_CHN_mopost_int"	"2015-03-07 09:41:53"	"EU official among people shot dead in midnight 'terrorist' attack on Mali restaurant"	"EU"
"5323735"	"en_CHN_mopost_int"	"2015-03-09 00:42:48"	"Malian police searching for killers in attack on nightclub as three killed in assault on UN barracks"	"UN"
"5332323"	"en_CHN_mopost_int"	"2015-03-09 10:43:04"	"First round-the-world solar flight takes off from UAE on maiden leg of voyage"	"AU"
"5412212"	"en_CHN_mopost_int"	"2015-03-12 16:44:56"	"Chinese executive becomes first female to head UN aviation body"	"UN"
"5412209"	"en_CHN_mopost_int"	"2015-03-12 16:44:56"	"France wins battle to prevent new EU coin commemorating Napoleon's defeat at Waterloo"	"EU"
"5482860"	"en_CHN_mopost_int"	"2015-03-16 02:34:04"	"Anti-EU party would offer deal to Cameron's Conservatives if they fail to win May election outright"	"EU"
"5594195"	"en_CHN_mopost_int"	"2015-03-20 15:41:44"	"World faces water deficit, UN warns"	"UN"
"5617605"	"en_CHN_mopost_int"	"2015-03-21 18:42:51"	"Popular weed killer declared probable cancer-causing agent by UN body"	"UN"
"5812106"	"en_CHN_mopost_int"	"2015-03-30 16:23:50"	"Political crisis in Macedonia hampers country’s bid to join EU"	"EU"
"5978167"	"en_CHN_mopost_int"	"2015-04-07 11:30:28"	"UN demands aid access to Syria refugee camp besieged by Islamic State"	"UN"
"6097389"	"en_CHN_mopost_int"	"2015-04-13 05:36:24"	"London mayor Boris Johnson says Tony Blair is an ‘epic tosser’ for EU referendum remarks"	"EU"
"6109012"	"en_CHN_mopost_int"	"2015-04-13 17:36:41"	"EU moves forward on nutritional labels for alcoholic drinks"	"EU"
"6143980"	"en_CHN_mopost_int"	"2015-04-15 06:37:44"	"EU poised to accuse Google of antitrust abuses, putting billions and business model at risk"	"EU"
"6157430"	"en_CHN_mopost_int"	"2015-04-15 19:38:04"	"EU faces fury after latest migrant sea tragedy 'claims lives of 400 people'"	"EU"
"6178423"	"en_CHN_mopost_int"	"2015-04-16 17:38:34"	"UN alarm as 400 migrants drown in Mediterranian trying to reach Europe"	"UN"
"6198933"	"en_CHN_mopost_int"	"2015-04-17 15:39:05"	"Chlorine gas attack video of dying children moves UN delegates to tears"	"UN"
"6198934"	"en_CHN_mopost_int"	"2015-04-17 15:39:05"	"UN Secretary General Ban calls for immediate ceasefire in Yemen"	"UN"
"6212994"	"en_CHN_mopost_int"	"2015-04-18 07:39:28"	"UN, neighbour countries sound alarm over South Africa xenophobic attacks that killed six"	"UN"
"6240240"	"en_CHN_mopost_int"	"2015-04-19 18:40:17"	"EU emergency summit called after 700 migrants feared dead in ""worst ever"" Libya boat sinking"	"EU"
"6249978"	"en_CHN_mopost_int"	"2015-04-20 06:40:46"	"EU fury as 700 asylum seekers feared dead in ‘avoidable’ shipwreck"	"EU"
"6259473"	"en_CHN_mopost_int"	"2015-04-20 15:40:58"	"‘No more excuses’ EU warns as two more migrant boats sink in Mediterranean"	"EU"
"6261712"	"en_CHN_mopost_int"	"2015-04-20 17:41:01"	"More Mediterranean migrant boats issue distress calls as EU meets"	"EU"
"6270430"	"en_CHN_mopost_int"	"2015-04-21 02:41:15"	"EU plans to boost migrant-rescue mission as Mediterranean reels from deadliest wreck"	"EU"
"6600386"	"en_CHN_mopost_int"	"2015-05-06 00:46:55"	"Britain can't impose its agenda on EU, Juncker says"	"EU"
"6602932"	"en_CHN_mopost_int"	"2015-05-06 03:46:59"	"‘Disturbing’ video shot by Chinese peacekeeper shows fellow UN officer gun down protester"	"UN"
"6632222"	"en_CHN_mopost_int"	"2015-05-07 09:47:41"	"Britain votes in 'knife-edge' general election as EU, Scotland questions loom"	"EU"
"6633260"	"en_CHN_mopost_int"	"2015-05-07 10:47:43"	"Britain votes in ‘knife-edge’ general election as EU, Scotland questions loom"	"EU"
"6677613"	"en_CHN_mopost_int"	"2015-05-09 08:48:44"	"UN holds crisis meeting as Burundi president runs for third term despite deadly protests"	"UN"
"6964510"	"en_CHN_mopost_int"	"2015-05-22 13:00:19"	"David Cameron uses EU summit to campaign for pre-referendum reforms"	"EU"
"6996972"	"en_CHN_mopost_int"	"2015-05-24 03:01:14"	"Bank of England's secret EU exit study leaked to newspaper"	"EU"
"6999810"	"en_CHN_mopost_int"	"2015-05-24 07:01:19"	"Bank of England's secret EU exit study accidentally emailed to newspaper"	"EU"
"7003827"	"en_CHN_mopost_int"	"2015-05-24 12:01:26"	"Britain’s opposition Labour Party backs David Cameron’s EU referendum plan"	"EU"
"7027801"	"en_CHN_mopost_int"	"2015-05-25 16:17:56"	"Most EU citizens in Britain can’t take part in vote on nation joining bloc"	"EU"
"7076177"	"en_CHN_mopost_int"	"2015-05-27 17:23:55"	"Queen’s speech sets stage for PM David Cameron to pursue EU reforms and referendum by end of 2017"	"EU"
"7161417"	"en_CHN_mopost_int"	"2015-05-31 17:00:59"	"Russia bans 89 EU officials from entering country over sanctions"	"EU"
"7175448"	"en_CHN_mopost_int"	"2015-06-01 10:01:26"	"UN climate change efforts not good enough, says French minister"	"UN"
"7202142"	"en_CHN_mopost_int"	"2015-06-02 13:02:03"	"Greece makes concessions in ‘realistic’ reform plan to EU creditors"	"EU"
"7272249"	"en_CHN_mopost_int"	"2015-06-05 13:03:47"	"EU/IMF creditors stance over cash-for-reforms deal ‘may force Greece into early elections’"	"EU"
"7285016"	"en_CHN_mopost_int"	"2015-06-06 03:56:21"	"Russia and China block proposed UN sanctions against Libyan militia commander, politician"	"UN"
"7286058"	"en_CHN_mopost_int"	"2015-06-06 04:57:26"	"EU, IMF creditors' stance over cash-for-reforms deal ‘may force Greece into early elections’"	"EU"
