"766723"	"es_ARG_nacion_int"	"2014-03-21 17:10:23"	"Debate tenso y a puertas cerradas en la OEA por la crisis en Venezuela"	"OAS"
"770097"	"es_ARG_nacion_int"	"2014-03-22 01:10:28"	"En medio del hermetismo, concluyó la sesión en la OEA por la crisis en Venezuela"	"OAS"
"771724"	"es_ARG_nacion_int"	"2014-03-22 07:10:33"	"La OEA silencia a la oposición venezolana"	"OAS"
"784815"	"es_ARG_nacion_int"	"2014-03-24 06:11:48"	"Advierte la OTAN sobre el avance militar de Rusia en otras regiones"	"NATO"
"800838"	"es_ARG_nacion_int"	"2014-03-25 18:13:16"	"Expulsión de Rusia del G8: ¿el origen de un nuevo orden mundial?"	"G8"
"854413"	"es_ARG_nacion_int"	"2014-03-31 16:18:00"	"El tribunal de la ONU ordenó a Japón detener la caza de ballenas con fines científicos"	"UN"
"868618"	"es_ARG_nacion_int"	"2014-04-01 23:48:16"	"La OTAN reforzará con tanques la frontera de Europa con Rusia"	"NATO"
"982335"	"es_ARG_nacion_int"	"2014-04-12 09:03:14"	"La OTAN le exigió a Rusia que aleje sus tropas"	"NATO"
"1020717"	"es_ARG_nacion_int"	"2014-04-16 08:04:20"	"Las sanciones, factor de divisiones en la UE"	"EU"
"1044219"	"es_ARG_nacion_int"	"2014-04-17 08:04:39"	"Crece la amenaza de una guerra: la OTAN se refuerza en el este de la UE"	"NATO"
"1044219"	"es_ARG_nacion_int"	"2014-04-17 08:04:39"	"Crece la amenaza de una guerra: la OTAN se refuerza en el este de la UE"	"EU"
"1497136"	"es_ARG_nacion_int"	"2014-05-05 16:36:06"	"El Vaticano volvió a presentarse ante el comité de la ONU que investiga los abusos sexuales de menores en la Iglesia"	"UN"
"1504425"	"es_ARG_nacion_int"	"2014-05-06 08:15:03"	"La ONU evalúa al Vaticano por los abusos a menores"	"UN"
"1551176"	"es_ARG_nacion_int"	"2014-05-09 20:20:11"	"La ONU criticó el uso excesivo de la fuerza del gobierno de Venezuela"	"UN"
"1553112"	"es_ARG_nacion_int"	"2014-05-10 00:20:17"	"El papa Francisco pidió a la ONU una ""movilización ética mundial que acabe con las desigualdades"""	"UN"
"1555273"	"es_ARG_nacion_int"	"2014-05-10 07:20:32"	"Francisco reclamó a la ONU una mayor lucha contra la desigualdad"	"UN"
"1563436"	"es_ARG_nacion_int"	"2014-05-11 08:21:21"	"Una eurofobia creciente y la apatía amenazan con derrumbar el proyecto de la UE"	"EU"
"1563440"	"es_ARG_nacion_int"	"2014-05-11 08:21:21"	"La ONU amenaza con actuar por las chicas"	"UN"
"1577707"	"es_ARG_nacion_int"	"2014-05-12 17:22:18"	"Tras el referéndum, la UE impone nuevas sanciones por la crisis de Ucrania"	"EU"
"1598967"	"es_ARG_nacion_int"	"2014-05-14 08:24:17"	"Italia pierde la paciencia con la UE por el drama de los inmigrantes"	"EU"
"1612174"	"es_ARG_nacion_int"	"2014-05-15 08:10:19"	"Las divisiones entre EE.UU. y la UE debilitan a Occidente frente a Rusia"	"EU"
"1666998"	"es_ARG_nacion_int"	"2014-05-20 07:55:23"	"Putin anuncia la retirada de la frontera con Ucrania, pero la OTAN desconfía"	"NATO"
"1720299"	"es_ARG_nacion_int"	"2014-05-24 08:13:39"	"La ONU vuelve a la carga por los abusos de chicos"	"UN"
"1739818"	"es_ARG_nacion_int"	"2014-05-26 08:14:19"	"La UE, en guardia ante un avance arrollador de la ultraderecha"	"EU"
"1752664"	"es_ARG_nacion_int"	"2014-05-27 08:14:38"	"La UE acusa el golpe electoral y piensa en ajustar el modelo"	"EU"
"1766171"	"es_ARG_nacion_int"	"2014-05-28 08:14:56"	"Tras el golpe electoral, la UE empieza a redefinir su rumbo"	"EU"
"1874469"	"es_ARG_nacion_int"	"2014-06-06 08:18:18"	"Crecen las fisuras entre EE.UU. y la UE por Rusia"	"EU"
"2012139"	"es_ARG_nacion_int"	"2014-06-22 00:29:44"	"ONU: desde la II Guerra Mundial nunca hubo tantos refugiados y desplazados como ahora"	"UN"
"2042957"	"es_ARG_nacion_int"	"2014-06-24 15:58:22"	"Irak: más de 1000 personas murieron en 17 días, según la ONU"	"UN"
"2088033"	"es_ARG_nacion_int"	"2014-06-28 08:01:38"	"Gran Bretaña, en la puerta de salida de la UE por una disputa electoral"	"EU"
"2297412"	"es_ARG_nacion_int"	"2014-07-18 14:22:51"	"El Consejo de Seguridad de la ONU se reúne de urgencia por el avión derribado en Ucrania"	"UN"
"2299475"	"es_ARG_nacion_int"	"2014-07-18 17:22:57"	"La ONU pidió una ""investigación internacional independiente y profunda"" por el avión derribado en Ucrania"	"UN"
"2349216"	"es_ARG_nacion_int"	"2014-07-23 07:40:53"	"Blanco de críticas, la UE debate sanciones a Rusia"	"EU"
"2362708"	"es_ARG_nacion_int"	"2014-07-24 08:08:06"	"Un uruguayo, en un puesto clave de la OEA"	"OAS"
"2362706"	"es_ARG_nacion_int"	"2014-07-24 08:08:06"	"Investigará la ONU a Israel por crímenes de guerra"	"UN"
"2372819"	"es_ARG_nacion_int"	"2014-07-24 23:09:30"	"Horror en Gaza: al menos 17 personas muertas al caer una bomba en una escuela de la ONU"	"UN"
"2376586"	"es_ARG_nacion_int"	"2014-07-25 08:10:01"	"Israel atacó una escuela de la ONU en Gaza y dejó por lo menos 17 muertos"	"UN"
"2395832"	"es_ARG_nacion_int"	"2014-07-27 07:11:28"	"Fuerte crítica de Rusia a la UE por las sanciones"	"EU"
"2398511"	"es_ARG_nacion_int"	"2014-07-27 15:11:42"	"Hamas aceptó el alto al fuego de 24 horas que había solicitado la ONU"	"UN"
"2403882"	"es_ARG_nacion_int"	"2014-07-28 05:12:29"	"Reunión de urgencia de la ONU en Nueva York por el conflicto en la Franja de Gaza"	"UN"
"2408536"	"es_ARG_nacion_int"	"2014-07-28 14:12:46"	"Enérgico llamado de la ONU a una tregua “inmediata e incondicional” en Gaza"	"UN"
"2409359"	"es_ARG_nacion_int"	"2014-07-28 15:27:34"	"Para la ONU, el derribo del avión en Ucrania “podría considerarse crimen de guerra”"	"UN"
"2417300"	"es_ARG_nacion_int"	"2014-07-29 08:32:04"	"La ONU, más efectiva para calmar ánimos que para frenar guerras"	"UN"
"2417301"	"es_ARG_nacion_int"	"2014-07-29 08:32:04"	"EE.UU. y la UE anuncian nuevas sanciones a Rusia"	"EU"
"2433596"	"es_ARG_nacion_int"	"2014-07-30 14:33:02"	"Atacan otra escuela de la ONU en Gaza: al menos 19 muertos"	"UN"
"2446893"	"es_ARG_nacion_int"	"2014-07-31 14:33:48"	"Un funcionario de la ONU rompió en llanto al hablar sobre el horror en Gaza"	"UN"
"2452627"	"es_ARG_nacion_int"	"2014-07-31 23:34:02"	"La ONU advierte que la población civil de Gaza está al ""borde del precipicio"""	"UN"
"2478786"	"es_ARG_nacion_int"	"2014-08-03 15:35:53"	"Al menos 10 muertos tras otro ataque de Israel a una escuela de la ONU en Gaza"	"UN"
"2485181"	"es_ARG_nacion_int"	"2014-08-04 08:36:22"	"Indignación por otro ataque israelí a una escuela de la ONU"	"UN"
"2509655"	"es_ARG_nacion_int"	"2014-08-06 07:37:43"	"Putin ordena represalias por las sanciones de EE.UU. y la UE"	"EU"
"2509657"	"es_ARG_nacion_int"	"2014-08-06 07:37:43"	"La OTAN se va, pero Afganistán todavía arde: matan a un general norteamericano"	"NATO"
"2519520"	"es_ARG_nacion_int"	"2014-08-07 00:38:11"	"La OTAN teme la invasión de Rusia a Ucrania"	"NATO"
"2535692"	"es_ARG_nacion_int"	"2014-08-08 08:09:41"	"Mientras Rusia y la UE se pelean, América latina se frota las manos"	"EU"
"2547195"	"es_ARG_nacion_int"	"2014-08-09 08:10:18"	"La reacción de la UE, entre el mutismo y la incapacidad diplomática"	"EU"
"2589093"	"es_ARG_nacion_int"	"2014-08-13 08:13:12"	"La UE envía ayuda, pero se desentiende del drama iraquí"	"EU"
"2589092"	"es_ARG_nacion_int"	"2014-08-13 08:13:12"	"Advierte la ONU que los jihadistas pueden cometer un genocidio en Irak"	"UN"
"2593658"	"es_ARG_nacion_int"	"2014-08-13 16:13:26"	"Fuerte llamado del papa Francisco a la ONU para que ponga fin a la violencia en Irak"	"UN"
"2601955"	"es_ARG_nacion_int"	"2014-08-14 08:13:51"	"La UE rompe el inmovilismo y se decide a armar a los kurdos iraquíes"	"EU"
"2601957"	"es_ARG_nacion_int"	"2014-08-14 08:13:51"	"Antes de Corea, el Papa reclamó a la ONU por las minorías en Irak"	"UN"
"2607226"	"es_ARG_nacion_int"	"2014-08-14 17:14:05"	"Gaza: en medio de la tregua, celebraron un casamiento en una escuela de la ONU"	"UN"
"2607810"	"es_ARG_nacion_int"	"2014-08-14 18:14:07"	"EEUU: un joven acusado de matar a un amigo le preguntó a su celular dónde esconder el cuerpo"	"EU"
"2622163"	"es_ARG_nacion_int"	"2014-08-16 00:15:32"	"La OTAN acusa a Rusia de librar batallas en territorio de Ucrania"	"NATO"
"2624506"	"es_ARG_nacion_int"	"2014-08-16 08:15:48"	"La UE apoyará a quienes envíen armas a los kurdos en Irak"	"EU"
"2641001"	"es_ARG_nacion_int"	"2014-08-18 08:18:16"	"Kilts y gaitas, pero sin dejar la UE"	"EU"
"2733744"	"es_ARG_nacion_int"	"2014-08-26 08:31:56"	"La ONU denuncia crímenes de guerra"	"UN"
"2754366"	"es_ARG_nacion_int"	"2014-08-27 20:33:10"	"Una nena de 9 años mató accidentalmente a su instructor de tiro en EEUU"	"EU"
"2765790"	"es_ARG_nacion_int"	"2014-08-28 17:34:08"	"La ONU denuncia que un grupo armado secuestró a 43 cascos azules en el Golán"	"UN"
"2786840"	"es_ARG_nacion_int"	"2014-08-30 14:35:44"	"François Hollande, antes de la cumbre de Bruselas: ""La UE aumentará, sin duda, las sanciones contra Rusia"""	"EU"
"2792444"	"es_ARG_nacion_int"	"2014-08-31 06:56:50"	"La UE amenaza a Rusia con más sanciones"	"EU"
"2801866"	"es_ARG_nacion_int"	"2014-09-01 07:57:47"	"Putin advierte a la UE que ya no quiere sus alimentos"	"EU"
"2827184"	"es_ARG_nacion_int"	"2014-09-03 07:59:45"	"Rusia advierte que actualizará su doctrina militar para contener los planes de la OTAN"	"NATO"
"2840424"	"es_ARG_nacion_int"	"2014-09-04 08:00:50"	"Rusia y Ucrania dicen que la paz está más cerca, pero la OTAN sospecha"	"NATO"
"2844347"	"es_ARG_nacion_int"	"2014-09-04 15:01:09"	"Comenzó la cumbre de la OTAN con Ucrania de protagonista y el enojo de Rusia"	"NATO"
"2845037"	"es_ARG_nacion_int"	"2014-09-04 16:01:11"	"¿Qué hicieron Barack Obama y David Cameron antes de la cumbre de la OTAN?"	"NATO"
"2853257"	"es_ARG_nacion_int"	"2014-09-05 08:01:51"	"La OTAN no cree en las promesas de Putin y se rearma"	"NATO"
"2862943"	"es_ARG_nacion_int"	"2014-09-06 01:02:29"	"La OTAN tendrá bases militares en países de Europa de Este para disuadir a Rusia de una invasión"	"NATO"
"2863281"	"es_ARG_nacion_int"	"2014-09-06 02:02:30"	"Rusia se burla de las acusaciones de la OTAN por Twitter"	"NATO"
"2865559"	"es_ARG_nacion_int"	"2014-09-06 09:03:15"	"La OTAN alista una gran coalición para derrotar a los jihadistas de EI"	"NATO"
"2914289"	"es_ARG_nacion_int"	"2014-09-13 07:37:41"	"EE.UU. y la UE aplican sanciones a Rusia"	"EU"
"2947768"	"es_ARG_nacion_int"	"2014-09-16 13:56:00"	"Pese al rechazo de Rusia, Ucrania y la UE ratificaron su acuerdo político y comercial"	"EU"
"2948378"	"es_ARG_nacion_int"	"2014-09-16 14:56:02"	"Ucrania ratificó su acuerdo de asociación con la UE pero le envió un guiño a los rebeldes"	"EU"
"3029862"	"es_ARG_nacion_int"	"2014-09-23 16:04:27"	"#ÉlPorElla: el discurso de Emma Watson sobre feminismo que emocionó a la ONU"	"UN"
"3030633"	"es_ARG_nacion_int"	"2014-09-23 17:04:30"	"Líderes de todo el mundo se reúnen en la ONU contra el cambio climático"	"UN"
"3033375"	"es_ARG_nacion_int"	"2014-09-23 21:04:37"	"Líderes de todo el mundo se reunieron en la ONU contra el cambio climático"	"UN"
"3042521"	"es_ARG_nacion_int"	"2014-09-24 15:05:16"	"Líderes mundiales se reúnen en la ONU, en medio de la ofensiva contra Estado Islámico"	"UN"
"3044582"	"es_ARG_nacion_int"	"2014-09-24 18:05:21"	"Barack Obama defendió en la ONU la guerra contra Estado Islámico: ""Sólo entienden el idioma de la fuerza"""	"UN"
"3046521"	"es_ARG_nacion_int"	"2014-09-24 21:05:27"	"""Francia no cederá jamás al chantaje del terrorismo"", dijo el presidente Hollande en la ONU"	"UN"
"3048258"	"es_ARG_nacion_int"	"2014-09-25 00:05:33"	"La ONU exige a los países que persigan a todo el que trate de unirse a grupos terroristas"	"UN"
"3051606"	"es_ARG_nacion_int"	"2014-09-25 08:05:51"	"Dilma trasladó la campaña a la ONU y usó su espacio para dar una arenga electoral"	"UN"
"3058233"	"es_ARG_nacion_int"	"2014-09-25 18:40:46"	"Hassan Rohani, en la ONU: ""Ciertos países ayudaron a crear el extremismo y ahora son incapaces de frenarlo"""	"UN"
"3070872"	"es_ARG_nacion_int"	"2014-09-26 18:38:06"	"En la ONU, Abas acusó a Israel de llevar adelante una ""guerra de genocidio"" en Gaza"	"UN"
"3071497"	"es_ARG_nacion_int"	"2014-09-26 19:38:08"	"En la ONU, Abbas acusó a Israel de llevar adelante una ""guerra de genocidio"" en Gaza"	"UN"
"3073147"	"es_ARG_nacion_int"	"2014-09-26 23:16:34"	"A partir de ahora la ONU monitoreará para que no exista violencia contra gays y trans"	"UN"
"3246263"	"es_ARG_nacion_int"	"2014-10-11 22:42:31"	"Advierten desde la OEA los problemas con el narcotráfico que tiene la Argentina"	"OAS"
"3274510"	"es_ARG_nacion_int"	"2014-10-14 12:44:46"	"Ébola: murió un empleado de la ONU en un hospital de Alemania"	"UN"
"3307040"	"es_ARG_nacion_int"	"2014-10-16 20:20:44"	"Pese a los cuestionamientos, Venezuela ingresó al Consejo de Seguridad de la ONU"	"UN"
"3312027"	"es_ARG_nacion_int"	"2014-10-17 07:21:08"	"Polémica en la ONU: Venezuela logró sentarse en el Consejo de Seguridad"	"UN"
"3447790"	"es_ARG_nacion_int"	"2014-10-28 21:37:08"	"La ONU volvió a pedir el fin del embargo a Cuba"	"UN"
"3470312"	"es_ARG_nacion_int"	"2014-10-30 15:04:51"	"Suecia, el primer país de la UE en reconocer a Palestina como Estado"	"EU"
"3495203"	"es_ARG_nacion_int"	"2014-11-01 20:06:53"	"Son más de 4000 los muertos en el conflicto de Ucrania, según la ONU"	"UN"
"3533444"	"es_ARG_nacion_int"	"2014-11-05 07:10:14"	"La UE sigue sin levantar cabeza"	"EU"
"3613314"	"es_ARG_nacion_int"	"2014-11-12 06:42:54"	"China apela a la cumbre de la APEC para desplegar todo su poder"	"APEC"
"3789456"	"es_ARG_nacion_int"	"2014-11-27 06:55:17"	"Megaplán económico para salvar a la UE"	"EU"
"3789457"	"es_ARG_nacion_int"	"2014-11-27 06:55:17"	"La caída del crudo desvela a la OPEP"	"OPEC"
"3919388"	"es_ARG_nacion_int"	"2014-12-09 00:52:03"	"Alerta por la inminente difusión de un informe sobre tortura en EEUU"	"EU"
"4087078"	"es_ARG_nacion_int"	"2014-12-23 23:03:54"	"Ucrania modifica su ley interna para asociarse con la OTAN"	"NATO"
"4089657"	"es_ARG_nacion_int"	"2014-12-24 07:04:13"	"La vieja división pudo más en la OEA"	"OAS"
"4112710"	"es_ARG_nacion_int"	"2014-12-27 08:07:09"	"Con una nueva doctrina militar, Putin apunta contra la OTAN y EE.UU."	"NATO"
"4127330"	"es_ARG_nacion_int"	"2014-12-29 07:09:45"	"La OTAN pone fin a su misión militar en Afganistán tras una presencia de 13 años"	"NATO"
"4138026"	"es_ARG_nacion_int"	"2014-12-30 07:10:47"	"Grecia vuelve a darle dolores de cabeza a la UE"	"EU"
"4148629"	"es_ARG_nacion_int"	"2014-12-31 07:12:52"	"La ultraizquierda griega amenaza con generar un sismo en la UE"	"EU"
"4190122"	"es_ARG_nacion_int"	"2015-01-05 15:17:55"	"Qué es Syriza, el partido de izquierda radical de Grecia que alarma a la UE"	"EU"
"4197120"	"es_ARG_nacion_int"	"2015-01-06 07:18:26"	"Ser optimista sobre el futuro de la UE es cada vez más difícil"	"EU"
"4197119"	"es_ARG_nacion_int"	"2015-01-06 07:18:26"	"La UE, al rojo vivo por el futuro de Grecia"	"EU"
"4259760"	"es_ARG_nacion_int"	"2015-01-12 05:57:24"	"Por el desafío jihadista, la UE reforzará el control en sus fronteras y en Internet"	"EU"
"4357555"	"es_ARG_nacion_int"	"2015-01-16 17:59:25"	"Bélgica pide a la UE que organice una cumbre para combatir el terrorismo"	"EU"
"4457800"	"es_ARG_nacion_int"	"2015-01-27 07:02:54"	"Una economía colapsada que le quita el sueño a la UE"	"EU"
"4476028"	"es_ARG_nacion_int"	"2015-01-29 09:09:37"	"Más conciliadora, la UE empieza a negociar con Grecia"	"EU"
"4514717"	"es_ARG_nacion_int"	"2015-01-30 20:10:50"	"Mitt Romney bajó su candidatura a la presidencia de EEUU en 2016"	"EU"
"4559742"	"es_ARG_nacion_int"	"2015-02-02 05:13:17"	"Grecia vs. Alemania: la UE se pregunta quién cederá primero"	"EU"
"4624450"	"es_ARG_nacion_int"	"2015-02-04 21:17:41"	"La ONU denunció que Estado Islámico vende, crucifica y entierra niños vivos en Irak"	"UN"
"4678441"	"es_ARG_nacion_int"	"2015-02-07 06:20:19"	"El canciller de Uruguay, favorito para liderar una OEA en apuros"	"OAS"
"4740260"	"es_ARG_nacion_int"	"2015-02-10 06:51:25"	"Grecia y la UE mantienen el diálogo entre bastidores"	"EU"
"4811251"	"es_ARG_nacion_int"	"2015-02-13 07:12:15"	"Grecia y la UE no alcanzan un consenso mínimo"	"EU"
"4895351"	"es_ARG_nacion_int"	"2015-02-17 07:15:02"	"La UE pide una acción urgente en Libia"	"EU"
"4902604"	"es_ARG_nacion_int"	"2015-02-17 14:15:13"	"Egipto reanuda los bombardeos contra Estado Islámico y pide ayuda a la ONU"	"UN"
"4942407"	"es_ARG_nacion_int"	"2015-02-19 07:17:09"	"Grecia reclama a la UE que extienda su salvavidas, pero con menos exigencias"	"EU"
"4942409"	"es_ARG_nacion_int"	"2015-02-19 07:17:09"	"Todos ya ven a Almagro como el nuevo secretario general de la OEA"	"OAS"
"5411024"	"es_ARG_nacion_int"	"2015-03-12 15:45:57"	"La ONU condena a Venezuela por no tomar medidas contra la tortura"	"UN"
"5497965"	"es_ARG_nacion_int"	"2015-03-16 17:35:41"	"Un francés metió a su mujer rusa en una valija para hacerla entrar en la UE"	"EU"
"5535407"	"es_ARG_nacion_int"	"2015-03-18 06:37:42"	"Almagro reemplaza a Insulza en la OEA"	"OAS"
"5547497"	"es_ARG_nacion_int"	"2015-03-18 17:38:11"	"Eligieron al uruguayo Luis Almagro como secretario general de la OEA"	"OAS"
"5561301"	"es_ARG_nacion_int"	"2015-03-19 07:40:39"	"Almagro prometió una ""renovación"" de la OEA"	"OAS"
"5585772"	"es_ARG_nacion_int"	"2015-03-20 07:41:54"	"La UE advierte a Grecia que se acaba el tiempo para negociar"	"EU"
"5607924"	"es_ARG_nacion_int"	"2015-03-21 06:43:19"	"Atenas prometió reformas y la UE le envío fondos"	"EU"
"5647234"	"es_ARG_nacion_int"	"2015-03-23 06:45:27"	"Luis Almagro: ""La OEA tiene que generar más credibilidad"""	"OAS"
"6167811"	"es_ARG_nacion_int"	"2015-04-16 07:37:55"	"La UE dio su respaldo al Papa en la polémica por el genocidio armenio"	"EU"
"6201180"	"es_ARG_nacion_int"	"2015-04-17 17:38:25"	"Por qué lloraron los miembros del Consejo de Seguridad de la ONU"	"UN"
"6212919"	"es_ARG_nacion_int"	"2015-04-18 07:38:37"	"El uso de gas en Siria hace llorar a la ONU"	"UN"
"6250890"	"es_ARG_nacion_int"	"2015-04-20 07:39:22"	"Los riesgos del ""Brexit"" para el futuro de la UE"	"EU"
"6260478"	"es_ARG_nacion_int"	"2015-04-20 16:39:32"	"Al-Shabaab hizo estallar una camioneta de la ONU en Somalia: al menos 6 muertos"	"UN"
"6298496"	"es_ARG_nacion_int"	"2015-04-22 08:06:13"	"La ONU reta a la UE y alerta sobre las fallas de su plan de inmigración"	"UN"
"6298496"	"es_ARG_nacion_int"	"2015-04-22 08:06:13"	"La ONU reta a la UE y alerta sobre las fallas de su plan de inmigración"	"EU"
"6305004"	"es_ARG_nacion_int"	"2015-04-22 14:06:21"	"La UE abre un proceso antimonopolio contra la petrolera rusa Gazprom"	"EU"
"6345783"	"es_ARG_nacion_int"	"2015-04-24 08:07:21"	"El nuevo orden del petróleo: EE.UU. roba a la OPEP todo su poder"	"OPEC"
"6345785"	"es_ARG_nacion_int"	"2015-04-24 08:07:21"	"La UE triplica su presupuesto para enfrentar la crisis de la migración"	"EU"
"6715277"	"es_ARG_nacion_int"	"2015-05-11 07:47:46"	"La UE combatirá a las mafias en Libia con una misión militar"	"EU"
"6731826"	"es_ARG_nacion_int"	"2015-05-11 23:47:58"	"El gobierno de EEUU desmiente un artículo sobre papel de Paquistán en muerte de Ben Laden"	"EU"
"6738618"	"es_ARG_nacion_int"	"2015-05-12 07:48:05"	"Grecia cumple con sus pagos, pero la UE presiona para que acelere las reformas"	"EU"
"6787811"	"es_ARG_nacion_int"	"2015-05-14 07:48:50"	"Acuerda la UE una cuota de refugiados por países"	"EU"
"6895750"	"es_ARG_nacion_int"	"2015-05-19 07:50:15"	"La UE lanza una misión militar por el drama de los inmigrantes"	"EU"
"7041586"	"es_ARG_nacion_int"	"2015-05-26 07:18:34"	"Almagro asume la conducción de la OEAcon el desafío de recuperar la credibilidad"	"OAS"
"7065068"	"es_ARG_nacion_int"	"2015-05-27 07:23:41"	"Almagro lidera una nueva etapa en la OEA"	"OAS"
"7099160"	"es_ARG_nacion_int"	"2015-05-28 16:24:09"	"Referéndum en marcha: los británicos votarán si siguen perteneciendo a la UE"	"EU"
"7114011"	"es_ARG_nacion_int"	"2015-05-29 08:24:28"	"Cameron pide a la UE que sea ""flexible e imaginativa"""	"EU"
"7243972"	"es_ARG_nacion_int"	"2015-06-04 08:02:29"	"Grecia busca sellar con la UE metas y reformas"	"EU"
"7277373"	"es_ARG_nacion_int"	"2015-06-05 18:02:57"	"La ONU exige cumplir el alto el fuego en Ucrania tras los últimos combates"	"UN"
"7397027"	"es_ARG_nacion_int"	"2015-06-11 07:58:49"	"La crisis política de Venezuela trabala cumbre entre la UE y la Celac"	"EU"
"7490539"	"es_ARG_nacion_int"	"2015-06-15 17:34:57"	"Luis Almagro inicia una nueva era de la OEA y pide el fin de los ""dobles discursos"""	"OAS"
"7503592"	"es_ARG_nacion_int"	"2015-06-16 07:35:08"	"La UE se acerca a un ""estado de emergencia"" por la crisis griega"	"EU"
"7534317"	"es_ARG_nacion_int"	"2015-06-17 14:35:31"	"El Banco de Grecia advierte que sin acuerdo con el FMI, el país dejará la UE"	"EU"
"7643961"	"es_ARG_nacion_int"	"2015-06-22 17:37:05"	"La ONU acusa a Israel y a palestinos por ""posibles crímenes de guerra"" en Gaza"	"UN"
"7655874"	"es_ARG_nacion_int"	"2015-06-23 06:37:15"	"Grecia y la UE, más cerca de un acuerdo sobre el pago de la deuda"	"EU"
"7680222"	"es_ARG_nacion_int"	"2015-06-24 07:37:42"	"La OTAN se refuerza para hacer frente a su enemigo de siempre"	"NATO"
"7749087"	"es_ARG_nacion_int"	"2015-06-27 06:38:36"	"Tras un tenso debate, la UE logra un acuerdo sobre la inmigración"	"EU"
"7768717"	"es_ARG_nacion_int"	"2015-06-28 08:38:57"	"La UE ya se alista para el default griego"	"EU"
"7820098"	"es_ARG_nacion_int"	"2015-06-30 16:39:38"	"En las negociaciones de último momento, Grecia pidió a la UE un nuevo rescate"	"EU"
"7821310"	"es_ARG_nacion_int"	"2015-06-30 17:39:39"	"Expectativa en las bolsas del mundo por las negociaciones de Grecia con la UE"	"EU"
