"en_USA_nytime_int"	"2017-05-02 17:28:20"	"Trump and Putin to Talk Amid Tension Over Syria"	"The American and Russian presidents will have their first conversation since the rupture over the Syrian chemical attack and the American retaliation."	"USA"
"en_USA_nytime_int"	"2017-05-02 17:59:58"	"Berlin Journal: Saved From Demolition, Rosa Parks’s House Gets a Second Life"	"When no one in Detroit stepped up to save the civil rights pioneer’s home, an artist disassembled it and shipped it to his garden in Berlin."	"DEU"
"en_USA_nytime_int"	"2017-05-02 17:59:58"	"Berlin Journal: Saved From Demolition, Rosa Parks’s House Gets a Second Life"	"When no one in Detroit stepped up to save the civil rights pioneer’s home, an artist disassembled it and shipped it to his garden in Berlin."	"USA"
"en_USA_nytime_int"	"2017-05-02 15:02:40"	"Marine Le Pen, French Presidential Candidate, Is Accused of Plagiarism"	"Supporters of the National Front contender, who used words similar to those of her conservative ex-opponent François Fillon, said they were a “small loan.”"	"FRA"
"en_USA_nytime_int"	"2017-05-02 11:00:04"	"The Money Issue: Is China the World’s New Colonial Power?"	"The rising superpower has built up enormous holdings in poor, resource-rich African countries — but its business partners there aren’t always thrilled."	"CHN"
"en_USA_nytime_int"	"2017-05-02 07:59:37"	"Europe Edition: Marine Le Pen, Hamas, Greece: Your Tuesday Briefing"	"Here’s what you need to know to start your day."	"GRC"
"en_USA_nytime_int"	"2017-05-02 07:59:37"	"Europe Edition: Marine Le Pen, Hamas, Greece: Your Tuesday Briefing"	"Here’s what you need to know to start your day."	"PSE"
"en_USA_nytime_int"	"2017-05-02 03:57:59"	"Nicolás Maduro, Venezuela President, Calls for a Rewrite of the Constitution"	"Mr. Maduro said his plan would quell mounting protests against him, but his opponents called it an attempt to avoid elections."	"VEN"
"en_USA_nytime_int"	"2017-05-02 03:02:08"	"Trump Follows Instincts, Not Establishment, With Overtures to Kim and Duterte"	"President Trump‘s willingness to meet with the North Korean and Philippine leaders illustrated his confidence in his own deal making but alarmed critics."	"PHL"
"en_USA_nytime_int"	"2017-05-02 03:02:08"	"Trump Follows Instincts, Not Establishment, With Overtures to Kim and Duterte"	"President Trump‘s willingness to meet with the North Korean and Philippine leaders illustrated his confidence in his own deal making but alarmed critics."	"PRK"
"en_USA_nytime_int"	"2017-05-02 02:12:45"	"Russians Protesting Abuse of Gay Men in Chechnya Are Detained"	"About 20 protesters were detained Monday on the sidelines of a May Day parade in St. Petersburg, among them the leader of a group helping gay men escape Chechnya."	"RUS"
"en_USA_nytime_int"	"2017-05-02 01:09:49"	"Indonesians Seek to Export a Modernized Vision of Islam"	"The youth wing of Nahdlatul Ulama, an Indonesian Islamic group, is pressing governments around the world to bring Islamic law into line with 21st-century norms."	"IDN"
"en_USA_nytime_int"	"2017-05-02 00:36:57"	"Iran and U.S. Discuss Issue of Americans Imprisoned by Tehran"	"A Foreign Ministry spokesman confirmed that the subject of U.S. citizens of Iranian descent being held in Iran came up at a meeting last week in Vienna."	"AUT"
"en_USA_nytime_int"	"2017-05-02 00:36:57"	"Iran and U.S. Discuss Issue of Americans Imprisoned by Tehran"	"A Foreign Ministry spokesman confirmed that the subject of U.S. citizens of Iranian descent being held in Iran came up at a meeting last week in Vienna."	"IRN"
"en_USA_nytime_int"	"2017-05-02 00:36:57"	"Iran and U.S. Discuss Issue of Americans Imprisoned by Tehran"	"A Foreign Ministry spokesman confirmed that the subject of U.S. citizens of Iranian descent being held in Iran came up at a meeting last week in Vienna."	"USA"
"en_USA_nytime_int"	"2017-05-02 04:21:09"	"Asia and Australia Edition: Japan, Rodrigo Duterte, Israel: Your Morning Briefing"	"Here’s what you need to know to start your day."	"AUS"
"en_USA_nytime_int"	"2017-05-02 04:21:09"	"Asia and Australia Edition: Japan, Rodrigo Duterte, Israel: Your Morning Briefing"	"Here’s what you need to know to start your day."	"ISR"
"en_USA_nytime_int"	"2017-05-02 04:21:09"	"Asia and Australia Edition: Japan, Rodrigo Duterte, Israel: Your Morning Briefing"	"Here’s what you need to know to start your day."	"JPN"
"en_USA_nytime_int"	"2017-05-02 17:43:54"	"Malcolm Toon Made Waves as a Diplomat, but His Death Went Largely Unreported"	"The news of his death in 2009 circulated in and around his North Carolina hometown, but did not make headlines the way he himself had during his Foreign Service career."	"USA"
"en_USA_nytime_int"	"2017-05-01 21:03:56"	"April Nerve Gas Attack in Syria Appears to Be One in a Series"	"On three other occasions, witnesses, doctors and human rights investigators say, Syria used nerve agents, killing at least 64 people in two attacks in December."	"SYR"
"en_USA_nytime_int"	"2017-05-01 19:19:39"	"Australia’s Coastline: ‘A National Church’"	"In Sydney, an ad hoc club has a ritual: gathering at 7 a.m. daily to don pink caps and swim almost a mile in the ocean. Watch the first 360 video in our series on the country’s beaches."	"AUS"
"en_USA_nytime_int"	"2017-05-01 22:50:15"	"As Le Pen and Macron Fight for Presidency in France, Unions Are Split"	"May Day demonstrations reflected a divide between those who have endorsed Mr. Macron, and those who have only called for votes against Marine Le Pen, his far-right opponent."	"FRA"
"en_USA_nytime_int"	"2017-05-04 11:00:20"	"St. Pierre Journal: Far From France, Island Outpost Is Never Far From French Politics"	"Proudly self-governing yet still tethered to the homeland’s bureaucracy, these islands off the Canadian coast have a stake in Sunday’s Le Pen-Macron contest."	"CAN"
"en_USA_nytime_int"	"2017-05-04 11:00:20"	"St. Pierre Journal: Far From France, Island Outpost Is Never Far From French Politics"	"Proudly self-governing yet still tethered to the homeland’s bureaucracy, these islands off the Canadian coast have a stake in Sunday’s Le Pen-Macron contest."	"FRA"
"en_USA_nytime_int"	"2017-05-04 10:22:23"	"Iraqi Forces Open a Front in West Mosul, Trying to Squeeze ISIS"	"The new offensive from the north, adding to a southern push that had slowed to a crawl, aims to force the Islamic State to fight in multiple directions."	"IRQ"
"en_USA_nytime_int"	"2017-05-04 14:16:59"	"Prince Philip to Step Away From Public Duties"	"The announcement followed a meeting at Buckingham Palace that touched off alarms about the health of Queen Elizabeth II and her husband, who is 95."	"GBR"
"en_USA_nytime_int"	"2017-05-04 11:53:22"	"North Korean Media, in Rare Critique of China, Says Nuclear Program Will Continue"	"A commentary carried by the North’s official news agency said the country would not halt its nuclear program, even if it risked its friendly relationship with China."	"CHN"
"en_USA_nytime_int"	"2017-05-04 11:53:22"	"North Korean Media, in Rare Critique of China, Says Nuclear Program Will Continue"	"A commentary carried by the North’s official news agency said the country would not halt its nuclear program, even if it risked its friendly relationship with China."	"PRK"
"en_USA_nytime_int"	"2017-05-04 14:33:26"	"Marine Le Pen and Emmanuel Macron: Where the French Candidates Stand"	"Voters will choose between two politicians with radically different views on core issues in the final round of a presidential election that will define the future of France — and of Europe."	"FRA"
"en_USA_nytime_int"	"2017-05-04 10:09:43"	"What to Watch For: Turnbull’s First Meeting With President Trump"	"Prime Minister Malcolm Turnbull of Australia is in New York preparing to meet President Trump. The visit offers opportunities and risks for the prime minister."	"AUS"
"en_USA_nytime_int"	"2017-05-04 11:46:17"	"Europe Edition: France, Juventus, ‘Brexit’: Your Thursday Briefing"	"Here’s what you need to know to start your day."	"FRA"
"en_USA_nytime_int"	"2017-05-04 06:01:19"	"In French Elections, Alt-Right Messages and Memes Don’t Translate"	"While the American far right has undertaken a digital assault in support of Marine Le Pen, it hasn’t resonated with the French electorate."	"FRA"
"en_USA_nytime_int"	"2017-05-04 06:01:19"	"In French Elections, Alt-Right Messages and Memes Don’t Translate"	"While the American far right has undertaken a digital assault in support of Marine Le Pen, it hasn’t resonated with the French electorate."	"USA"
"en_USA_nytime_int"	"2017-05-04 01:18:16"	"Trump and Turnbull in New York: A Chance to Make U.S.-Australia Ties Shipshape"	"President Trump and Prime Minister Malcolm Turnbull, who clashed over refugees, will be at a commemoration on the Intrepid of their nations’ 1942 battle against Japan."	"AUS"
"en_USA_nytime_int"	"2017-05-04 01:18:16"	"Trump and Turnbull in New York: A Chance to Make U.S.-Australia Ties Shipshape"	"President Trump and Prime Minister Malcolm Turnbull, who clashed over refugees, will be at a commemoration on the Intrepid of their nations’ 1942 battle against Japan."	"JPN"
"en_USA_nytime_int"	"2017-05-04 01:13:59"	"Issue 8: Two Very Different Australias?"	"In this week’s newsletter, John Howard, South Sudanese basketball stars, Darwin essays, and what Australia’s favorite chef wants you to hear."	"AUS"
"en_USA_nytime_int"	"2017-05-04 01:13:59"	"Issue 8: Two Very Different Australias?"	"In this week’s newsletter, John Howard, South Sudanese basketball stars, Darwin essays, and what Australia’s favorite chef wants you to hear."	"SDN"
"en_USA_nytime_int"	"2017-05-04 01:13:59"	"Issue 8: Two Very Different Australias?"	"In this week’s newsletter, John Howard, South Sudanese basketball stars, Darwin essays, and what Australia’s favorite chef wants you to hear."	"SSD"
"en_USA_nytime_int"	"2017-05-04 00:41:11"	"What Does Darwin Mean to You?"	"Readers of the NYT Australia newsletter shared their personal stories about Australia’s “top end.”"	"AUS"
"en_USA_nytime_int"	"2017-05-04 00:31:11"	"License of Bol TV, Pakistani Network Dogged by Scandal, Is Revoked"	"The license was canceled by a regulatory agency as the network’s parent company, Axact, has been embroiled in a scandal involving the sale of fake online degrees."	"PAK"
"en_USA_nytime_int"	"2017-05-04 00:14:05"	"To Freeze Syria War, Russia Proposes Setting Up ‘De-escalation Zones’"	"The proposal, shared by participants at cease-fire talks in Astana, Kazakhstan, is one of the most detailed suggestions in efforts to halt the war."	"KAZ"
"en_USA_nytime_int"	"2017-05-04 00:14:05"	"To Freeze Syria War, Russia Proposes Setting Up ‘De-escalation Zones’"	"The proposal, shared by participants at cease-fire talks in Astana, Kazakhstan, is one of the most detailed suggestions in efforts to halt the war."	"RUS"
"en_USA_nytime_int"	"2017-05-04 00:14:05"	"To Freeze Syria War, Russia Proposes Setting Up ‘De-escalation Zones’"	"The proposal, shared by participants at cease-fire talks in Astana, Kazakhstan, is one of the most detailed suggestions in efforts to halt the war."	"SYR"
"en_USA_nytime_int"	"2017-05-03 23:36:18"	"Immigration Experts Question Tale of Australian Man’s U.S. Border Detention"	"According to a GoFundMe campaign set up by his girlfriend, Baxter Reid was arrested when he overstayed his visa 90 minutes."	"AUS"
"en_USA_nytime_int"	"2017-05-03 23:26:21"	"Critic's Notebook: The Look of the French Election"	"Marine Le Pen used costume to cast herself as the mother of France, and Emmanuel Macron’s sober suit was modified as his poll numbers shifted."	"FRA"
"en_USA_nytime_int"	"2017-05-03 23:10:41"	"‘Monsoon Wedding’ Lifted Moods Onscreen. How About Onstage?"	"A musical based on the popular 2002 film will debut at Berkeley Repertory Theater in California. It has Broadway ambitions."	"USA"
"en_USA_nytime_int"	"2017-05-04 01:08:22"	"Asia and Australia Edition: Trump, Turnbull, Marine Le Pen: Your Morning Briefing"	"Here’s what you need to know to start your day."	"AUS"
"en_USA_nytime_int"	"2017-05-03 21:27:45"	"Theresa May Accuses E.U. Officials of ‘Brexit’ Threats Before British Vote"	"“Britain’s negotiating position in Europe has been misrepresented in the Continental press” and “threats against Britain have been issued by European politicians and officials,” Mrs. May said."	"GBR"
"en_USA_nytime_int"	"2017-05-04 01:33:42"	"Le Pen and Macron Clash in Vicious Presidential Debate in France"	"The country’s only presidential debate was more like an angry American-style television shoutfest than the reasoned discussion the French are used to."	"FRA"
"en_USA_nytime_int"	"2017-05-04 01:33:42"	"Le Pen and Macron Clash in Vicious Presidential Debate in France"	"The country’s only presidential debate was more like an angry American-style television shoutfest than the reasoned discussion the French are used to."	"USA"
"en_USA_nytime_int"	"2017-05-03 21:09:26"	"South Sudanese, Seeking to Fit In, Stand Out in Australian Basketball"	"A program meant for fun now has to protect its young players from something it never expected: the interest of American recruiters."	"AUS"
"en_USA_nytime_int"	"2017-05-03 21:09:26"	"South Sudanese, Seeking to Fit In, Stand Out in Australian Basketball"	"A program meant for fun now has to protect its young players from something it never expected: the interest of American recruiters."	"SDN"
"en_USA_nytime_int"	"2017-05-03 21:09:26"	"South Sudanese, Seeking to Fit In, Stand Out in Australian Basketball"	"A program meant for fun now has to protect its young players from something it never expected: the interest of American recruiters."	"SSD"
"en_USA_nytime_int"	"2017-05-03 21:09:26"	"South Sudanese, Seeking to Fit In, Stand Out in Australian Basketball"	"A program meant for fun now has to protect its young players from something it never expected: the interest of American recruiters."	"USA"
"en_USA_nytime_int"	"2017-05-03 20:56:42"	"Tillerson: It’s Time to Restore ‘Balance’ With Other Countries"	"In his first address laying out his vision as secretary of state, Rex W. Tillerson said that the United States had done too much for allies and emerging nations."	"USA"
"en_USA_nytime_int"	"2017-05-03 20:51:59"	"Russia, Feeling Slighted by Trump, Seeks a Reset"	"The Kremlin cannot understand why President Trump has met a string of world leaders but afforded President Putin just three measly phone calls."	"RUS"
"en_USA_nytime_int"	"2017-05-04 02:57:38"	"News Analysis: Trump, Bullish on Mideast Peace, Will Need More Than Confidence"	"Meeting with the Palestinian leader, Mahmoud Abbas, President Trump said, “We will get this done,” a bold promise given the complexity of any peace deal."	"PSE"
"en_USA_nytime_int"	"2017-05-03 17:22:34"	"IHT Retrospective Blog: 1892: Berlin’s Prefect of Police on the Socialist Movement"	"Berlin’s prefect of police, Baron Von Richthoffen, was interviewed on the German Socialist Movement."	"DEU"
"en_USA_nytime_int"	"2017-05-03 21:01:38"	"After Trump’s Phone Call to Philippines Leader, China’s President Calls Him"	"President Xi Jinping of China praised President Rodrigo Duterte, part of an effort to woo an American ally and strengthen China’s claims in the South China Sea."	"CHN"
"en_USA_nytime_int"	"2017-05-03 21:01:38"	"After Trump’s Phone Call to Philippines Leader, China’s President Calls Him"	"President Xi Jinping of China praised President Rodrigo Duterte, part of an effort to woo an American ally and strengthen China’s claims in the South China Sea."	"PHL"
"en_USA_nytime_int"	"2017-05-03 21:01:38"	"After Trump’s Phone Call to Philippines Leader, China’s President Calls Him"	"President Xi Jinping of China praised President Rodrigo Duterte, part of an effort to woo an American ally and strengthen China’s claims in the South China Sea."	"USA"
"en_USA_nytime_int"	"2017-05-03 23:49:12"	"American Is Charged in Tokyo After Fistfight on Los Angeles-Bound Flight"	"A widely shared video showed the man, who was not identified by the authorities, in a violent altercation before takeoff."	"JPN"
"en_USA_nytime_int"	"2017-05-03 23:49:12"	"American Is Charged in Tokyo After Fistfight on Los Angeles-Bound Flight"	"A widely shared video showed the man, who was not identified by the authorities, in a violent altercation before takeoff."	"USA"
"en_USA_nytime_int"	"2017-05-03 15:35:56"	"Trees or Shrubs? Study Disputes Success of China’s $100 Billion Forest Effort"	"A new study suggests that some official estimates of a nationwide campaign to plant new forests overstated its successes, and mistook shrubs for forests."	"CHN"
"en_USA_nytime_int"	"2017-05-03 15:32:52"	"Memo From Beijing: Why Trump’s Budding Bromance With Xi Is Doomed"	"Beneath the bonhomie, experts say, are differences of strategic interest that may keep President Trump from getting the results he wants on North Korea."	"CHN"
"en_USA_nytime_int"	"2017-05-03 15:32:52"	"Memo From Beijing: Why Trump’s Budding Bromance With Xi Is Doomed"	"Beneath the bonhomie, experts say, are differences of strategic interest that may keep President Trump from getting the results he wants on North Korea."	"PRK"
"en_USA_nytime_int"	"2017-05-05 10:05:02"	"8 of Our Best Articles on the French Presidential Election"	"The final votes will be cast on Sunday for Marine Le Pen and Emmanuel Macron. Here’s how we covered the issues and the candidates."	"FRA"
"en_USA_nytime_int"	"2017-05-04 11:00:20"	"St. Pierre Journal: Far From France, Island Outpost Is Never Far From French Politics"	"Proudly self-governing yet still tethered to the homeland’s bureaucracy, these islands off the Canadian coast have a stake in Sunday’s Le Pen-Macron contest."	"CAN"
"en_USA_nytime_int"	"2017-05-04 11:00:20"	"St. Pierre Journal: Far From France, Island Outpost Is Never Far From French Politics"	"Proudly self-governing yet still tethered to the homeland’s bureaucracy, these islands off the Canadian coast have a stake in Sunday’s Le Pen-Macron contest."	"FRA"
"en_USA_nytime_int"	"2017-05-04 23:00:13"	"Marine Le Pen’s Canny Use of Gender in Her Campaign"	"Ms. Le Pen’s election strategy makes a shift toward drawing more female voters and softening the image of her party, long treated as a pariah in France."	"FRA"
"en_USA_nytime_int"	"2017-05-04 10:22:23"	"Iraqi Forces Open a Front in West Mosul, Trying to Squeeze ISIS"	"The new offensive from the north, adding to a southern push that had slowed to a crawl, aims to force the Islamic State to fight in multiple directions."	"IRQ"
"en_USA_nytime_int"	"2017-05-05 15:04:23"	"Navy SEAL Killed in Raid Against Islamic Militants in Somalia"	"Defense Department officials said the service member was in Somalia as part of an advise-and-assist mission alongside members of the Somali National Army."	"SOM"
"en_USA_nytime_int"	"2017-05-05 14:27:37"	"The Trump-Turnbull Handshake"	"Donald Trump’s handshakes are often revealing moments. We see what can be gleaned from his meeting with Malcolm Turnbull, Australia’s prime minister."	"AUS"
"en_USA_nytime_int"	"2017-05-05 14:02:01"	"Cartoonists Earn a Prime Minister’s Ire — and His Subscription"	"Prass Press, a new satirical paper, is testing the limits of press freedom in Bulgaria."	"BGR"
"en_USA_nytime_int"	"2017-05-05 13:59:34"	"North Korea Accuses U.S. and South Korea of Plotting to Kill Kim Jong-un"	"The North said that the South had hired a man to infiltrate the North to kill Mr. Kim. The South’s spy agency denied the accusations."	"KOR"
"en_USA_nytime_int"	"2017-05-05 13:59:34"	"North Korea Accuses U.S. and South Korea of Plotting to Kill Kim Jong-un"	"The North said that the South had hired a man to infiltrate the North to kill Mr. Kim. The South’s spy agency denied the accusations."	"PRK"
"en_USA_nytime_int"	"2017-05-05 13:46:27"	"U.N. Rights Expert, on Visit to Philippines, Denounces ‘War on Drugs’ Approach"	"Agnès Callamard did not mention President Rodrigo Duterte by name, but she made it plain that she viewed his policies as dangerously out of step."	"PHL"
"en_USA_nytime_int"	"2017-05-05 10:43:03"	"Trump and Turnbull Meet in New York"	"In a meeting aboard the aircraft carrier Intrepid, President Trump and Prime Minister Malcolm Turnbull of Australia played down a testy phone exchange that began their working relationship."	"AUS"
"en_USA_nytime_int"	"2017-05-05 09:09:30"	"Dust Storms Blanket Beijing and Northern China"	"The storms reduced visibility in cities like Beijing and threatened the health of millions of people."	"CHN"
"en_USA_nytime_int"	"2017-05-05 13:29:07"	"Europe Edition: France, Syria, Prince Philip: Your Friday Briefing"	"Here’s what you need to know to start your day."	"FRA"
"en_USA_nytime_int"	"2017-05-05 13:29:07"	"Europe Edition: France, Syria, Prince Philip: Your Friday Briefing"	"Here’s what you need to know to start your day."	"SYR"
"en_USA_nytime_int"	"2017-05-04 22:21:15"	"Hungary Indicts 11 in Truck Suffocation of 71 Refugees"	"The deaths of the refugees found in a locked truck parked on an Austrian highway two summers ago cast a spotlight on Europe’s response to the migrant crisis."	"AUT"
"en_USA_nytime_int"	"2017-05-04 22:21:15"	"Hungary Indicts 11 in Truck Suffocation of 71 Refugees"	"The deaths of the refugees found in a locked truck parked on an Austrian highway two summers ago cast a spotlight on Europe’s response to the migrant crisis."	"HUN"
"en_USA_nytime_int"	"2017-05-04 22:12:53"	"Gulbuddin Hekmatyar, Afghan Warlord, Returns to City He Left in Ruins"	"Mr. Hekmatyar, an ex-prime minister who once helped destroy Kabul, has returned with immunity in hopes it will lead to talks with the Taliban."	"AFG"
"en_USA_nytime_int"	"2017-05-05 13:24:07"	"Asia and Australia Edition: Trump, Turnbull, Prince Philip: Your Morning Briefing"	"Here’s what you need to know to start your day."	"AUS"
"en_USA_nytime_int"	"2017-05-04 21:28:25"	"Marine Le Pen’s Verbal ‘Violence’ in French Debate Shocks Observers"	"The presidential candidate’s tone in confronting her opponent, Emmanuel Macron, contradicted her effort to soften her National Front party’s image."	"FRA"
"en_USA_nytime_int"	"2017-05-04 21:25:00"	"Romania Drops Measure to Pardon Corrupt Officials"	"Romanians had taken to the streets of the capital to oppose amendments to a bill that would have pardoned officials imprisoned for bribery."	"ITA"
"en_USA_nytime_int"	"2017-05-04 21:25:00"	"Romania Drops Measure to Pardon Corrupt Officials"	"Romanians had taken to the streets of the capital to oppose amendments to a bill that would have pardoned officials imprisoned for bribery."	"ROU"
"en_USA_nytime_int"	"2017-05-04 21:16:02"	"Somali Public Works Minister Seen as ‘Rising Star’ Is Shot to Death"	"Two soldiers were arrested in the shooting of Abbas Abdullahi Sheikh Siraji, but the motivations were not clear, including whether it was an accident."	"SOM"
"en_USA_nytime_int"	"2017-05-04 20:53:40"	"‘Neutral Sex’ Designation Is Struck Down in France"	"The country’s top court ruled against allowing an intersex person born with a genital malformation to obtain civil status as being neither male nor female."	"FRA"
"en_USA_nytime_int"	"2017-05-05 00:33:14"	"Russia Reaches Deal for Syria Safe Zones, but Some Rebels Scoff"	"The top United Nations envoy for Syria said the deal was a “positive step.” But some rebels said it left too many loopholes for the government."	"RUS"
"en_USA_nytime_int"	"2017-05-05 00:33:14"	"Russia Reaches Deal for Syria Safe Zones, but Some Rebels Scoff"	"The top United Nations envoy for Syria said the deal was a “positive step.” But some rebels said it left too many loopholes for the government."	"SYR"
"en_USA_nytime_int"	"2017-05-05 02:32:58"	"Saudi Arabia and Israel Will Be on Itinerary of Trump’s First Foreign Trip"	"The president will also visit Rome this month before attending major international summit meetings in Europe."	"ISR"
"en_USA_nytime_int"	"2017-05-05 02:32:58"	"Saudi Arabia and Israel Will Be on Itinerary of Trump’s First Foreign Trip"	"The president will also visit Rome this month before attending major international summit meetings in Europe."	"ITA"
"en_USA_nytime_int"	"2017-05-05 02:32:58"	"Saudi Arabia and Israel Will Be on Itinerary of Trump’s First Foreign Trip"	"The president will also visit Rome this month before attending major international summit meetings in Europe."	"SAU"
"en_USA_nytime_int"	"2017-05-05 02:32:58"	"Saudi Arabia and Israel Will Be on Itinerary of Trump’s First Foreign Trip"	"The president will also visit Rome this month before attending major international summit meetings in Europe."	"STP"
"en_USA_nytime_int"	"2017-05-04 16:39:50"	"Google Agrees to Pay Italy $334 Million in Back Taxes"	"The move follows a similar deal that Apple struck with Rome in late 2015, and comes as Europe wrestles with how much tax Silicon Valley companies should pay overseas."	"ITA"
"en_USA_nytime_int"	"2017-05-04 16:39:50"	"Google Agrees to Pay Italy $334 Million in Back Taxes"	"The move follows a similar deal that Apple struck with Rome in late 2015, and comes as Europe wrestles with how much tax Silicon Valley companies should pay overseas."	"USA"
"en_USA_nytime_int"	"2017-05-04 15:55:40"	"As ‘Brexit’ Tensions Rise, E.U. Proposal Targets London Finance"	"Proposed technical changes hint that the European Commission may seek more centralized regulation, or location requirements, on a key financial product."	"GBR"
"en_USA_nytime_int"	"2017-05-06 02:56:19"	"Macron Campaign Says It Was Target of ‘Massive’ Hacking Attack"	"A trove of internal campaign documents was posted online, campaign staff for the French presidential candidate said."	"FRA"
