"en_USA_nytime_int"	"2017-05-16 08:56:17"	"Australian Refugee Camp on Manus Island Is Closing, Detainees Say"	"Asylum seekers said that immigration officials in Papua New Guinea told them that they would need to leave the center."	"GIN"
"en_USA_nytime_int"	"2017-05-16 08:56:17"	"Australian Refugee Camp on Manus Island Is Closing, Detainees Say"	"Asylum seekers said that immigration officials in Papua New Guinea told them that they would need to leave the center."	"PNG"
"en_USA_nytime_int"	"2017-05-16 04:56:31"	"Global Cyberattack? They Made It Possible"	"A National Security Agency hacking tool leaked in April by an elite group called the Shadow Brokers has now been used in a cyberattack on computers in more than 150 countries. Intelligence officials say North Korean-linked hackers are likely suspects."	"PRK"
"en_USA_nytime_int"	"2017-05-16 03:36:04"	"Gunmen Kill Prominent Mexican Journalist Who Covered Drug Cartels"	"The journalist, Javier Valdez Cárdenas, 50, had chronicled bloody conflicts among rival drug cartels and the culture of violence they inflicted on the broader society."	"MEX"
"en_USA_nytime_int"	"2017-05-16 03:32:07"	"Before Trump’s Visit to Israel, Small Issues Prove Thorniest"	"The White House ran into static with Israel on Monday on a series issues ranging from the status of the Western Wall to President Trump’s promise to move the American Embassy."	"ISR"
"en_USA_nytime_int"	"2017-05-16 03:32:07"	"Before Trump’s Visit to Israel, Small Issues Prove Thorniest"	"The White House ran into static with Israel on Monday on a series issues ranging from the status of the Western Wall to President Trump’s promise to move the American Embassy."	"USA"
"en_USA_nytime_int"	"2017-05-16 00:56:25"	"Beheadings and Vengeance: A Cycle of Killing on a Border in Kashmir"	"Acts of extreme brutality occur with some regularity along the Line of Control, the disputed military frontier that divides Kashmir into Indian and Pakistani territory."	"IND"
"en_USA_nytime_int"	"2017-05-16 00:56:25"	"Beheadings and Vengeance: A Cycle of Killing on a Border in Kashmir"	"Acts of extreme brutality occur with some regularity along the Line of Control, the disputed military frontier that divides Kashmir into Indian and Pakistani territory."	"PAK"
"en_USA_nytime_int"	"2017-05-16 03:07:55"	"Trump Revealed Highly Classified Intelligence to Russia, in Break With Ally, Officials Say"	"The intelligence disclosed was about an Islamic State plot, according to officials."	"RUS"
"en_USA_nytime_int"	"2017-05-16 00:19:09"	"Trump, About to Visit Saudi Arabia, Is Urged to Help Yemen"	"Humanitarian agencies want the Trump administration to help end the conflict between a Saudi-led coalition and Houthi rebels in Yemen, which is nearing catastrophe."	"SAU"
"en_USA_nytime_int"	"2017-05-16 00:19:09"	"Trump, About to Visit Saudi Arabia, Is Urged to Help Yemen"	"Humanitarian agencies want the Trump administration to help end the conflict between a Saudi-led coalition and Houthi rebels in Yemen, which is nearing catastrophe."	"STP"
"en_USA_nytime_int"	"2017-05-16 00:19:09"	"Trump, About to Visit Saudi Arabia, Is Urged to Help Yemen"	"Humanitarian agencies want the Trump administration to help end the conflict between a Saudi-led coalition and Houthi rebels in Yemen, which is nearing catastrophe."	"YEM"
"en_USA_nytime_int"	"2017-05-16 03:38:35"	"Trump, North Korea, Ransomware: Your Monday Evening Briefing"	"Here’s what you need to know at the end of the day."	"PRK"
"en_USA_nytime_int"	"2017-05-15 22:57:16"	"Shaky Coalition in Austria May Give Far-Right Party an Opening"	"New elections are being scheduled as the governing coalition teeters on collapse, possibly clearing a path for the far-right Freedom Party to enter into power."	"AUT"
"en_USA_nytime_int"	"2017-05-16 09:34:45"	"Asia and Australia Edition: North Korea, Cyberattack, China: Your Morning Briefing"	"Here’s what you need to know to start your day."	"AUS"
"en_USA_nytime_int"	"2017-05-16 09:34:45"	"Asia and Australia Edition: North Korea, Cyberattack, China: Your Morning Briefing"	"Here’s what you need to know to start your day."	"CHN"
"en_USA_nytime_int"	"2017-05-16 09:34:45"	"Asia and Australia Edition: North Korea, Cyberattack, China: Your Morning Briefing"	"Here’s what you need to know to start your day."	"PRK"
"en_USA_nytime_int"	"2017-05-16 03:28:30"	"A Mission to Capture or Kill Joseph Kony Ends, Without Capturing or Killing"	"A small group of Ugandan and American military officials will hold a ceremony to celebrate the end of the mission to capture Mr. Kony, the head of the Lord’s Resistance Army."	"UGA"
"en_USA_nytime_int"	"2017-05-16 03:28:30"	"A Mission to Capture or Kill Joseph Kony Ends, Without Capturing or Killing"	"A small group of Ugandan and American military officials will hold a ceremony to celebrate the end of the mission to capture Mr. Kony, the head of the Lord’s Resistance Army."	"USA"
"en_USA_nytime_int"	"2017-05-15 21:24:58"	"Theresa May, Borrowing from Labour, Vows to Extend Protections for Workers"	"The Conservative leader, seeking to increase her majority in a national election June 8, is reaching out to British voters who traditionally support the Labour Party."	"GBR"
"en_USA_nytime_int"	"2017-05-15 21:18:08"	"Dutch Fertility Doctor Swapped Donors’ Sperm With His, Lawsuit Claims"	"Dr. Jan Karbaat, who died last month at 89, ran a fertility clinic near Rotterdam from 1980 to 2009."	"NLD"
"en_USA_nytime_int"	"2017-05-16 02:49:12"	"Syrian Crematory Is Hiding Mass Killings of Prisoners, U.S. Says"	"The State Department released satellite images showing a building thought to be a crematory, which would enable bodies to be disposed of without leaving evidence behind."	"SYR"
"en_USA_nytime_int"	"2017-05-15 19:13:01"	"Czech Leader’s Call to ‘Liquidate’ Journalists Was a Joke, His Office Says"	"Czech officials reacted with outrage at a comment by President Milos Zeman, who was speaking with Russia’s president in Beijing."	"CHN"
"en_USA_nytime_int"	"2017-05-15 19:13:01"	"Czech Leader’s Call to ‘Liquidate’ Journalists Was a Joke, His Office Says"	"Czech officials reacted with outrage at a comment by President Milos Zeman, who was speaking with Russia’s president in Beijing."	"CZE"
"en_USA_nytime_int"	"2017-05-15 19:13:01"	"Czech Leader’s Call to ‘Liquidate’ Journalists Was a Joke, His Office Says"	"Czech officials reacted with outrage at a comment by President Milos Zeman, who was speaking with Russia’s president in Beijing."	"RUS"
"en_USA_nytime_int"	"2017-05-15 16:14:26"	"Buscalan Journal: At 100 or So, She Keeps a Philippine Tattoo Tradition Alive"	"Thanks to a very elder master of her craft, a mountaintop village in the north of the country has become a mecca for tourists seeking tribal tattoos."	"PHL"
"en_USA_nytime_int"	"2017-05-15 16:06:54"	"Tehran Mayor Quits Race for Iran Presidency"	"Mohammad Baqer Qalibaf, a leading candidate, threw his support behind Ebrahim Raisi in a move aimed at consolidating the conservative vote."	"IRN"
"en_USA_nytime_int"	"2017-05-15 16:03:16"	"Horst Mahler, German Holocaust Denier, Is Arrested in Hungary"	"Mr. Mahler, 81, is a former Marxist urban guerrilla who became an activist on the extreme right."	"DEU"
"en_USA_nytime_int"	"2017-05-15 16:03:16"	"Horst Mahler, German Holocaust Denier, Is Arrested in Hungary"	"Mr. Mahler, 81, is a former Marxist urban guerrilla who became an activist on the extreme right."	"HUN"
"en_USA_nytime_int"	"2017-05-15 22:00:15"	"Macron and Merkel Meet, Pledging to Save European Unity"	"Angela Merkel, Germany’s chancellor, greeted Emmanuel Macron, France’s new president, with pomp that reflected a rare moment of hope for the E.U., but much work remained."	"DEU"
"en_USA_nytime_int"	"2017-05-15 22:00:15"	"Macron and Merkel Meet, Pledging to Save European Unity"	"Angela Merkel, Germany’s chancellor, greeted Emmanuel Macron, France’s new president, with pomp that reflected a rare moment of hope for the E.U., but much work remained."	"FRA"
"en_USA_nytime_int"	"2017-05-15 13:57:19"	"Philippines Kills Impeachment Complaint Against Rodrigo Duterte"	"The complaint, which accuses the president of mass murder, was declared insufficient by the Justice Committee of the House of Representatives, which is controlled by Duterte backers."	"PHL"
"en_USA_nytime_int"	"2017-05-15 21:01:32"	"As Their Clout Wanes, Saudi Arabia and Russia Extend Oil Production Cuts"	"The announcement by the world’s two biggest oil exporters means the Organization of the Petroleum Exporting Countries is likely to follow suit next week."	"RUS"
"en_USA_nytime_int"	"2017-05-15 21:01:32"	"As Their Clout Wanes, Saudi Arabia and Russia Extend Oil Production Cuts"	"The announcement by the world’s two biggest oil exporters means the Organization of the Petroleum Exporting Countries is likely to follow suit next week."	"SAU"
"en_USA_nytime_int"	"2017-05-15 21:01:32"	"As Their Clout Wanes, Saudi Arabia and Russia Extend Oil Production Cuts"	"The announcement by the world’s two biggest oil exporters means the Organization of the Petroleum Exporting Countries is likely to follow suit next week."	"STP"
"en_USA_nytime_int"	"2017-05-15 13:19:43"	"Chasing After the Kushners in China"	"“As journalists in China, we are accustomed to dealing with harassment. But we don’t typically encounter bullying at events where American companies hold court.”"	"CHN"
"en_USA_nytime_int"	"2017-05-15 13:19:43"	"Chasing After the Kushners in China"	"“As journalists in China, we are accustomed to dealing with harassment. But we don’t typically encounter bullying at events where American companies hold court.”"	"USA"
"en_USA_nytime_int"	"2017-05-17 19:28:59"	"Putin Offers to Provide a ‘Record’ of Trump’s Disclosures to Russian Envoys"	"As with many of Mr. Putin’s maneuvers, his offer to release a record of a recent White House meeting involving top Russian diplomats seemed designed to unnerve and confuse."	"RUS"
"en_USA_nytime_int"	"2017-05-17 19:28:59"	"Putin Offers to Provide a ‘Record’ of Trump’s Disclosures to Russian Envoys"	"As with many of Mr. Putin’s maneuvers, his offer to release a record of a recent White House meeting involving top Russian diplomats seemed designed to unnerve and confuse."	"USA"
"en_USA_nytime_int"	"2017-05-18 09:00:25"	"Iran Has Its Own Hard-Line Populist, and He’s on the Rise"	"Ebrahim Raisi, the darling of the country’s conservative clerics, might one day become the supreme leader. But can he win the presidency?"	"IRN"
"en_USA_nytime_int"	"2017-05-17 06:30:23"	"Villaggio Coppola Journal: Forsaken Village on Italy’s Coast Tells Tale of a Paradise Lost"	"Villaggio Coppola was built in the 1960s with utopian ambitions, but it has instead become a vivid concentration of southern Italy’s abiding troubles."	"ITA"
"en_USA_nytime_int"	"2017-05-18 16:45:20"	"Swedish Town Rejects Proposal to Grant Sex Leave to Workers"	"The plan suggested by Per-Erik Muskos, a politician in the northern town of Overtornea, had drawn a mixture of astonishment, glee and derision."	"SWE"
"en_USA_nytime_int"	"2017-05-18 18:51:43"	"IHT Retrospective Blog: 1892: Venezuelan Insurgents Occupy Bolívar State"	"Unrest in Venezuela leads to insurgents occupying the state of Bolivar, a mutiny and the killing of General Rodil."	"VEN"
"en_USA_nytime_int"	"2017-05-18 15:01:03"	"Suspected Cases of Ebola Rise to 18 in Democratic Republic of Congo"	"Aid workers are trying to reach a remote part of the country, where there have been three deaths from the virus and about 400 possible contacts."	"COG"
"en_USA_nytime_int"	"2017-05-18 14:38:23"	"Saudi Arabia, Ignoring Trump’s Slights, to Give Him a Royal Welcome"	"The Middle Eastern kingdom seeks a reset in relations after the Obama years, hoping to emphasize common goals in business, counterterrorism and confronting Iran."	"IRN"
"en_USA_nytime_int"	"2017-05-18 14:38:23"	"Saudi Arabia, Ignoring Trump’s Slights, to Give Him a Royal Welcome"	"The Middle Eastern kingdom seeks a reset in relations after the Obama years, hoping to emphasize common goals in business, counterterrorism and confronting Iran."	"SAU"
"en_USA_nytime_int"	"2017-05-18 14:38:23"	"Saudi Arabia, Ignoring Trump’s Slights, to Give Him a Royal Welcome"	"The Middle Eastern kingdom seeks a reset in relations after the Obama years, hoping to emphasize common goals in business, counterterrorism and confronting Iran."	"STP"
"en_USA_nytime_int"	"2017-05-18 14:38:23"	"Saudi Arabia, Ignoring Trump’s Slights, to Give Him a Royal Welcome"	"The Middle Eastern kingdom seeks a reset in relations after the Obama years, hoping to emphasize common goals in business, counterterrorism and confronting Iran."	"USA"
"en_USA_nytime_int"	"2017-05-18 14:06:58"	"China’s Dog Meat Festival May Have to Cancel the Dog, Activists Say"	"Animal rights advocates say the city of Yulin agreed to ban sales of dog meat in the week before the event, although no officials contacted could confirm the reports."	"CHN"
"en_USA_nytime_int"	"2017-05-18 16:01:55"	"Berlin Truck Attacker Had Been Flagged as a High-Level Drug Dealer"	"The city’s police are accused of missing a chance to arrest Anis Amri weeks before he killed 12 people at a Christmas market, and of a cover-up."	"DEU"
"en_USA_nytime_int"	"2017-05-18 05:02:38"	"Brazil President Endorsed Businessman’s Bribes in Secret Tape, Newspaper Says"	"O Globo, a Brazilian paper, reported that President Michel Temer also directed the businessman to pay a lawmaker to help resolve a company problem."	"BRA"
"en_USA_nytime_int"	"2017-05-18 01:45:57"	"Issue 10: ‘Australia? Yes, I Know; Off the Coast of New Zealand’"	"In this week’s newsletter, we take a trip through the New York Times archives and invite subscribers to an event with beer and literary discussion."	"AUS"
"en_USA_nytime_int"	"2017-05-18 01:45:57"	"Issue 10: ‘Australia? Yes, I Know; Off the Coast of New Zealand’"	"In this week’s newsletter, we take a trip through the New York Times archives and invite subscribers to an event with beer and literary discussion."	"NZL"
"en_USA_nytime_int"	"2017-05-18 01:22:58"	"Macron’s Cabinet Gives Glimpse of How He Plans to Govern France"	"By appointing equal numbers of men and women, the new French president made a statement. But whether he will be able to enact much change depends on legislative elections."	"FRA"
"en_USA_nytime_int"	"2017-05-18 02:26:52"	"Asia and Australia Edition: Chelsea Manning, Russia, North Korea: Your Morning Briefing"	"Here’s what you need to know to start your day."	"AUS"
"en_USA_nytime_int"	"2017-05-18 02:26:52"	"Asia and Australia Edition: Chelsea Manning, Russia, North Korea: Your Morning Briefing"	"Here’s what you need to know to start your day."	"PRK"
"en_USA_nytime_int"	"2017-05-18 02:26:52"	"Asia and Australia Edition: Chelsea Manning, Russia, North Korea: Your Morning Briefing"	"Here’s what you need to know to start your day."	"RUS"
"en_USA_nytime_int"	"2017-05-17 21:47:02"	"Who’s at the Controls on KLM? Sometimes, the Dutch King"	"King Willem-Alexander told a Dutch newspaper that he has flown twice a month for the last 21 years as a co-pilot for a KLM subsidiary, but that passengers rarely recognized him."	"NLD"
"en_USA_nytime_int"	"2017-05-18 05:45:30"	"Iran Nuclear Deal Will Remain for Now, White House Signals"	"A statement on Iran came two days before Iranian elections, and just before President Trump’s first overseas trip as president."	"IRN"
"en_USA_nytime_int"	"2017-05-18 05:45:30"	"Iran Nuclear Deal Will Remain for Now, White House Signals"	"A statement on Iran came two days before Iranian elections, and just before President Trump’s first overseas trip as president."	"USA"
"en_USA_nytime_int"	"2017-05-17 19:31:21"	"Police and Protesters in Venezuela Share Common Grievances"	"Police officers in Caracas say they feel caught between a government they no longer believe in and a protest movement that has labeled them the enemy."	"VEN"
"en_USA_nytime_int"	"2017-05-17 19:30:17"	"Warm Start With Israel Cools as Trump Prepares Visit. What Happened?"	"When President Trump was elected, the Israeli prime minister said his country had “no greater friend,” but the relationship has since become much more complicated."	"ISR"
"en_USA_nytime_int"	"2017-05-17 19:03:57"	"Austrian Parliament Bans Full Facial Veils in Public"	"Anyone who wears a full-face veil, such as a burqa or a niqab, in a public place faces a fine of 150 euros, or about $167."	"AUT"
"en_USA_nytime_int"	"2017-05-21 14:05:46"	"Trump Urges Muslim Leaders to Purge Their Societies of ‘Foot Soldiers of Evil’"	"In centerpiece speech in Saudi Arabia, President Trump called for renewed international campaign against terrorism in “battle between good and evil.”"	"SAU"
"en_USA_nytime_int"	"2017-05-21 14:05:46"	"Trump Urges Muslim Leaders to Purge Their Societies of ‘Foot Soldiers of Evil’"	"In centerpiece speech in Saudi Arabia, President Trump called for renewed international campaign against terrorism in “battle between good and evil.”"	"STP"
"en_USA_nytime_int"	"2017-05-20 18:13:08"	"Killing C.I.A. Informants, China Crippled U.S. Spying Operations"	"At least 18 C.I.A. sources were killed or imprisoned in China between 2010 and 2012, one of the worst intelligence breaches in decades. Investigators still disagree about how it happened."	"CHN"
"en_USA_nytime_int"	"2017-05-21 12:37:44"	"North Korea Fires Medium-Range Ballistic Missile"	"The missile took off from a location near Pukchang, northeast of Pyongyang and fell into the Sea of Japan."	"JPN"
"en_USA_nytime_int"	"2017-05-21 12:37:44"	"North Korea Fires Medium-Range Ballistic Missile"	"The missile took off from a location near Pukchang, northeast of Pyongyang and fell into the Sea of Japan."	"PRK"
"en_USA_nytime_int"	"2017-05-20 11:53:03"	"Rouhani Wins Re-election in Iran by a Wide Margin"	"President Hassan Rouhani defeated his closest rival, Ebrahim Raisi, 57 percent to 38.5 percent, giving him a mandate to continue his quest to open Iran’s ailing economy to global investors."	"IRN"
"en_USA_nytime_int"	"2017-05-21 15:27:41"	"Taliban Launch Rocket Attack and Kill at Least 20 Afghan Police Officers"	"The attacks capped another bloody week in Afghanistan, during which a German woman and an Afghan guard were killed, and a Finnish national was kidnapped in Kabul on Saturday."	"AFG"
"en_USA_nytime_int"	"2017-05-21 15:27:41"	"Taliban Launch Rocket Attack and Kill at Least 20 Afghan Police Officers"	"The attacks capped another bloody week in Afghanistan, during which a German woman and an Afghan guard were killed, and a Finnish national was kidnapped in Kabul on Saturday."	"DEU"
"en_USA_nytime_int"	"2017-05-21 15:27:41"	"Taliban Launch Rocket Attack and Kill at Least 20 Afghan Police Officers"	"The attacks capped another bloody week in Afghanistan, during which a German woman and an Afghan guard were killed, and a Finnish national was kidnapped in Kabul on Saturday."	"FIN"
"en_USA_nytime_int"	"2017-05-21 04:59:49"	"To Trump, Human Rights Concerns Are Often a Barrier to Trade"	"President Trump’s visit to Saudi Arabia underscored a calculation by his administration that such concerns too often impede the flow of commerce."	"SAU"
"en_USA_nytime_int"	"2017-05-21 04:59:49"	"To Trump, Human Rights Concerns Are Often a Barrier to Trade"	"President Trump’s visit to Saudi Arabia underscored a calculation by his administration that such concerns too often impede the flow of commerce."	"STP"
"en_USA_nytime_int"	"2017-05-21 06:54:41"	"Pain of Deportation Swells When Children Are Left Behind"	"Migrants who return to Mexico must remake their lives. For some, it means a struggle to reunite with their children."	"MEX"
"en_USA_nytime_int"	"2017-05-21 00:48:00"	"Angola’s ‘Omnipresent’ Leader Won’t Run Again. But Will He Relinquish Power?"	"President José Eduardo dos Santos has ruled the country for nearly 38 years. Many wonder if he, and his family, are really ready to give up control."	"AGO"
"en_USA_nytime_int"	"2017-05-21 00:41:43"	"Brazil’s President Assails His Accuser as Corruption Scandal Intensifies"	"Michel Temer leveled explosive charges against the billionaire Joesley Batista, whose secret recording of a conversation has fueled calls for Mr. Temer’s resignation."	"BRA"
"en_USA_nytime_int"	"2017-05-20 21:17:01"	"For 2 Experts Killed in Congo, U.N. Provided Little Training and No Protection"	"With little training and no safety equipment — or even health insurance — the pair headed into a remote area teeming with militia fighters to find the culprits behind a massacre."	"COG"
"en_USA_nytime_int"	"2017-05-20 21:15:03"	"The 5 ‘Handsome Girls’ Trying to Be China’s Biggest Boy Band"	"Meet the young women from China providing the soundtrack (and the dance moves) for the country’s androgynous urban trendsetters who reject traditional gender norms."	"CHN"
"en_USA_nytime_int"	"2017-05-20 19:39:42"	"Nigerian Schoolgirls Kidnapped by Boko Haram Rejoin Families"	"Anxious parents of the 82 Chibok girls looked for signs of how deeply their daughters might have changed in the hands of the extremists."	"NER"
"en_USA_nytime_int"	"2017-05-20 19:39:42"	"Nigerian Schoolgirls Kidnapped by Boko Haram Rejoin Families"	"Anxious parents of the 82 Chibok girls looked for signs of how deeply their daughters might have changed in the hands of the extremists."	"NGA"
"en_USA_nytime_int"	"2017-05-21 01:25:24"	"N.B.A. Player Enes Kanter Released After Being Held in Romania"	"Kanter, a Turk, posted a video on Twitter from an airport saying his passport was canceled because he opposes President Recep Tayyip Erdogan, whom he called “the Hitler of our century.”"	"ITA"
"en_USA_nytime_int"	"2017-05-21 01:25:24"	"N.B.A. Player Enes Kanter Released After Being Held in Romania"	"Kanter, a Turk, posted a video on Twitter from an airport saying his passport was canceled because he opposes President Recep Tayyip Erdogan, whom he called “the Hitler of our century.”"	"ROU"
"en_USA_nytime_int"	"2017-05-21 01:25:24"	"N.B.A. Player Enes Kanter Released After Being Held in Romania"	"Kanter, a Turk, posted a video on Twitter from an airport saying his passport was canceled because he opposes President Recep Tayyip Erdogan, whom he called “the Hitler of our century.”"	"TUR"
"en_USA_nytime_int"	"2017-05-20 18:04:36"	"Pippa Middleton Marries James Matthews in England"	"The wedding was attended by members of the next generation of Britain’s royal family."	"GBR"
"en_USA_nytime_int"	"2017-05-20 18:04:31"	"58,000 Haitians in U.S. May Lose Post-Earthquake Protections"	"American officials are weighing whether to extend a special residency status that was granted after a 2010 disaster but could expire in July."	"HTI"
"en_USA_nytime_int"	"2017-05-20 18:04:31"	"58,000 Haitians in U.S. May Lose Post-Earthquake Protections"	"American officials are weighing whether to extend a special residency status that was granted after a 2010 disaster but could expire in July."	"USA"
"en_USA_nytime_int"	"2017-05-20 17:49:35"	"With Harleys and Hamburgers, Saudis Salute U.S. on Trump’s Visit"	"As Saudi Arabia seeks to renew ties between the two nations, signs of America’s cultural influence on the kingdom are also to the fore."	"SAU"
"en_USA_nytime_int"	"2017-05-20 17:49:35"	"With Harleys and Hamburgers, Saudis Salute U.S. on Trump’s Visit"	"As Saudi Arabia seeks to renew ties between the two nations, signs of America’s cultural influence on the kingdom are also to the fore."	"STP"
"en_USA_nytime_int"	"2017-05-22 03:00:57"	"News Analysis: In Saudi Arabia, Trump Reaches Out to Sunni Nations, at Iran’s Expense"	"President Trump used a speech in the kingdom to declare his commitment to Sunni Arab nations, signaling a return to a policy his predecessor rejected."	"IRN"
"en_USA_nytime_int"	"2017-05-22 03:00:57"	"News Analysis: In Saudi Arabia, Trump Reaches Out to Sunni Nations, at Iran’s Expense"	"President Trump used a speech in the kingdom to declare his commitment to Sunni Arab nations, signaling a return to a policy his predecessor rejected."	"SAU"
"en_USA_nytime_int"	"2017-05-22 03:00:57"	"News Analysis: In Saudi Arabia, Trump Reaches Out to Sunni Nations, at Iran’s Expense"	"President Trump used a speech in the kingdom to declare his commitment to Sunni Arab nations, signaling a return to a policy his predecessor rejected."	"STP"
"en_USA_nytime_int"	"2017-05-21 21:44:53"	"No, Google’s Not a Bird: Bringing the Internet to Rural India"	"A recent convert to the wonders of the web is trying to persuade his neighbors in a remote village that “the whole world rests inside the mobile.”"	"IND"
"en_USA_nytime_int"	"2017-05-22 06:01:28"	"Anarchists Fill Services Void Left by Faltering Greek Governance"	"Anarchist groups are taking matters into their own hands after years of austerity policies and a refugee crisis have undermined the Greek government."	"GRC"
"en_USA_nytime_int"	"2017-05-22 00:45:51"	"Trump Softens Tone on Islam but Calls for Purge of ‘Foot Soldiers of Evil’"	"In a speech in Saudi Arabia, President Trump spoke in measured tones far from his incendiary language last year and called for a renewed fight against terrorism."	"SAU"
"en_USA_nytime_int"	"2017-05-22 00:45:51"	"Trump Softens Tone on Islam but Calls for Purge of ‘Foot Soldiers of Evil’"	"In a speech in Saudi Arabia, President Trump spoke in measured tones far from his incendiary language last year and called for a renewed fight against terrorism."	"STP"
"en_USA_nytime_int"	"2017-05-22 09:11:54"	"Europe Edition: Saudi Arabia, Hassan Rouhani, Real Madrid: Your Monday Briefing"	"Here’s what you need to know to start your day."	"ESP"
"en_USA_nytime_int"	"2017-05-22 09:11:54"	"Europe Edition: Saudi Arabia, Hassan Rouhani, Real Madrid: Your Monday Briefing"	"Here’s what you need to know to start your day."	"IRN"
