"pl_POL_interia_int" "2017-05-29 10:07:49" "RMF FM: Ucieczka więźnia ze szpitala. Były przecieki?" "<p><a href=""http://fakty.interia.pl/polska/news-rmf-fm-ucieczka-wieznia-ze-szpitala-byly-przecieki,nId,2399252""><img src=""http://i.iplsc.com/rmf-fm-ucieczka-wieznia-ze-szpitala-byly-przecieki/0006LY79UW1F20VD-C307.jpg"" alt=""RMF FM: Ucieczka więźnia ze szpitala. Były przecieki?"" align=""left"" /></a>Prokuratura sprawdza źródło ewentualnego przecieku informacji w sprawie działań funkcjonariuszy wobec więźnia, który w spektakularny sposób uciekł policjantom z jednego z warszawskich szpitali - dowiedział się reporter RMF FM. Chodzi o skazanego, który w prokuraturze słabo się poczuł i trafił do szpitala na Banacha. Tam nieznany mężczyzna sterroryzował bronią konwojenta, po czym skazany wraz z napastnikiem zniknęli.</p><br clear=""all"" />"
"pl_POL_interia_int" "2017-05-30 20:00:09" "Podejrzany. Moskiewskie tropy w Białym Domu" "<p><a href=""http://fakty.interia.pl/autor/michal-michalak/news-podejrzany-moskiewskie-tropy-w-bialym-domu,nId,2399822""><img src=""http://i.iplsc.com/podejrzany-moskiewskie-tropy-w-bialym-domu/0006M23SR7LIQ5H3-C307.jpg"" alt=""Podejrzany. Moskiewskie tropy w Białym Domu"" align=""left"" /></a>Zwolnienie szefa FBI Jamesa Comeya nie zatrzymało, a wręcz zintensyfikowało dochodzenia w sprawie rosyjskich powiązań prezydenta USA i jego otoczenia. O impeachmencie Donalda Trumpa mówią już nawet niektórzy republikańscy kongresmeni.</p><br clear=""all"" />"
"pl_POL_interia_int" "2017-05-30 20:10:05" "Wielka Brytania: Polacy skazani za handel ludźmi" "<p><a href=""http://fakty.interia.pl/swiat/news-wielka-brytania-polacy-skazani-za-handel-ludzmi,nId,2399927""><img src=""http://i.iplsc.com/wielka-brytania-polacy-skazani-za-handel-ludzmi/0006M29G0JOT41VD-C307.jpg"" alt=""Wielka Brytania: Polacy skazani za handel ludźmi"" align=""left"" /></a>Czterech Polaków zostało skazanych we wtorek przez sąd w Newcastle na kary więzienia za handel ludźmi i współczesne niewolnictwo. Zmuszali oni innych Polaków do niskopłatnych prac, pozbawiając ich jednocześnie zarobionych pieniędzy - poinformowała prokuratura.</p><br clear=""all"" />"
"pl_POL_interia_int" "2017-05-30 19:38:42" "Kto przejmie śledztwo ws. wypadku premier Szydło?" "<p><a href=""http://fakty.interia.pl/polska/news-kto-przejmie-sledztwo-ws-wypadku-premier-szydlo,nId,2399920""><img src=""http://i.iplsc.com/kto-przejmie-sledztwo-ws-wypadku-premier-szydlo/0006LYJQXPPIDDOD-C307.jpg"" alt=""Kto przejmie śledztwo ws. wypadku premier Szydło? "" align=""left"" /></a>Prokuratura Regionalna w Krakowie wystąpiła do Prokuratora Krajowego, by poza okręg krakowski przenieść śledztwo w spr. niedopełnienia obowiązków i przekroczenia uprawnień przez policjantów i prokuratorów, którzy wykonywali czynności po wypadku z udziałem premier Beaty Szydło.</p><br clear=""all"" />"
"pl_POL_interia_int" "2017-05-30 19:35:09" "Media kwestionują uczciwość ministrów Macrona" "<p><a href=""http://fakty.interia.pl/swiat/news-media-kwestionuja-uczciwosc-ministrow-macrona,nId,2399918""><img src=""http://i.iplsc.com/media-kwestionuja-uczciwosc-ministrow-macrona/0006M26ZTFN00295-C307.jpg"" alt=""Media kwestionują uczciwość ministrów Macrona"" align=""left"" /></a>Minister ds. europejskich Francji Marielle de Sarnez, objęta śledztwem w sprawie fikcyjnego zatrudniania asystentów europarlamentarnych, odrzuciła we wtorek wszystkie oskarżenia. To już drugi członek obecnego rządu, w którego uczciwość wątpią media i opozycja.</p><br clear=""all"" />"
"pl_POL_interia_int" "2017-05-30 19:17:05" "Islamiści przetrzymują 200 zakładników na Filipinach" "<p><a href=""http://fakty.interia.pl/swiat/news-islamisci-przetrzymuja-200-zakladnikow-na-filipinach,nId,2399916""><img src=""http://i.iplsc.com/islamisci-przetrzymuja-200-zakladnikow-na-filipinach/0006M26OHFO5NVGN-C307.jpg"" alt=""Islamiści przetrzymują 200 zakładników na Filipinach"" align=""left"" /></a>O około 200 zakładnikach przetrzymywanych przez islamistów na Filipinach - informuje w nagraniu upublicznionym we wtorek za pośrednictwem stron powiązanych z Państwem Islamskim ksiądz Teresito Suganob. Porywacze żądają wycofania rządowych wojsk z Marawi na południu kraju.</p><br clear=""all"" />"
"pl_POL_interia_int" "2017-05-30 19:07:53" """Dowody w sprawie Smoleńska także w polskiej ziemi""" "<p><a href=""http://fakty.interia.pl/raporty/raport-lech-kaczynski-nie-zyje/aktualnosci/news-dowody-w-sprawie-smolenska-takze-w-polskiej-ziemi,nId,2399911""><img src=""http://i.iplsc.com/dowody-w-sprawie-smolenska-takze-w-polskiej-ziemi/0006M25YSSKIUP13-C307.jpg"" alt=""&" "34;Dowody w sprawie Smoleńska także w polskiej ziemi&" "34;"" align=""left"" /></a>Kolejne ekshumacje ciał ofiar katastrofy smoleńskiej są wskazane, bo wiele wskazuje na to, że dowody są pochowane także w polskiej ziemi – uważa mecenas Stefan Hambura. Jego zdaniem na poprzednim rządzie spoczywa polityczna odpowiedzialność za błędy popełnione po katastrofie.</p><br clear=""all"" />"
"pl_POL_interia_int" "2017-05-30 18:36:14" "30 maja 2017: Fakty dnia" "<p>Prezentujemy podsumowanie najważniejszych wydarzeń dnia z kraju i świata.</p><br clear=""all"" />"
"pl_POL_interia_int" "2017-05-30 18:23:05" "Juncker stanął przed komisją śledczą" "<p><a href=""http://fakty.interia.pl/swiat/news-juncker-stanal-przed-komisja-sledcza,nId,2399900""><img src=""http://i.iplsc.com/juncker-stanal-przed-komisja-sledcza/0006M22QCCQO9657-C307.jpg"" alt=""Juncker stanął przed komisją śledczą"" align=""left"" /></a>Firmy powinny płacić podatki tam, gdzie wypracowywane są przez nie zyski - mówił we wtorek Jean-Claude Juncker przed komisją PE. Przekonywał, że w UE powinna powstać szersza lista rajów podatkowych, i zapewniał, że KE pracuje na rozwiązaniem afery LuxLeaks.</p><br clear=""all"" />"
"pl_POL_interia_int" "2017-05-30 18:05:34" "Poroszenko: Putin próbuje kraść naszą historię na oczach Europy" "<p><a href=""http://fakty.interia.pl/swiat/news-poroszenko-putin-probuje-krasc-nasza-historie-na-oczach-euro,nId,2399895""><img src=""http://i.iplsc.com/poroszenko-putin-probuje-krasc-nasza-historie-na-oczach-euro/0006KGHQ2OAGELTC-C307.jpg"" alt=""Poroszenko: Putin próbuje kraść naszą historię na oczach Europy"" align=""left"" /></a>Prezydent Rosji Władimir Putin &" "34;na oczach całej Europy spróbował wykraść dla rosyjskiej historii&" "34; pamięć o kijowskiej księżniczce, a następnie królowej Francji, Annie Jarosławównie - oświadczył we wtorek prezydent Ukrainy Petro Poroszenko.</p><br clear=""all"" />"
"pl_POL_interia_int" "2017-05-30 17:55:34" "Włochy wspierają Merkel w konflikcie z USA" "<p><a href=""http://fakty.interia.pl/swiat/news-wlochy-wspieraja-merkel-w-konflikcie-z-usa,nId,2399892""><img src=""http://i.iplsc.com/wlochy-wspieraja-merkel-w-konflikcie-z-usa/00064V2MYS6FLR2X-C307.jpg"" alt=""Włochy wspierają Merkel w konflikcie z USA"" align=""left"" /></a>Włochy popierają opinię kanclerz Merkel, że Unia Europejska wobec konfliktu ze Stanami Zjednoczonymi na tle wolnego handlu i umowy klimatycznej powinna wziąć sprawy w swoje ręce. </p><br clear=""all"" />"
"pl_POL_interia_int" "2017-06-02 09:34:32" "​Macierewicz: Odpowiedzialność Tuska w związku z katastrofą jest oczywista" "<p><a href=""http://fakty.interia.pl/raporty/raport-lech-kaczynski-nie-zyje/komentarze/news-macierewicz-odpowiedzialnosc-tuska-w-zwiazku-z-katastrofa-je,nId,2400919""><img src=""http://i.iplsc.com/macierewicz-odpowiedzialnosc-tuska-w-zwiazku-z-katastrofa-je/0006M8WFBCRTW2KQ-C307.jpg"" alt=""​Macierewicz: Odpowiedzialność Tuska w związku z katastrofą jest oczywista"" align=""left"" /></a>Odpowiedzialność moralna, polityczna oraz prawna b. premiera Donalda Tuska w związku z katastrofą smoleńską jest oczywista - powiedział w piątek szef MON Antoni Macierewicz </p><br clear=""all"" />"
"pl_POL_interia_int" "2017-06-02 09:42:01" "44 osoby zmarły z pragnienia na Saharze" "<p><a href=""http://fakty.interia.pl/raporty/raport-imigranci-z-afryki/informacje/news-44-osoby-zmarly-z-pragnienia-na-saharze,nId,2400939""><img src=""http://i.iplsc.com/44-osoby-zmarly-z-pragnienia-na-saharze/0006M8YPFBAGH0M7-C307.jpg"" alt=""44 osoby zmarły z pragnienia na Saharze"" align=""left"" /></a>44 osoby zmarły z pragnienia na Saharze po tym, jak ciężarówka wioząca ludzi do Libii się zepsuła. Ocalało sześć kobiet.</p><br clear=""all"" />"
"pl_POL_interia_int" "2017-06-02 09:29:24" "Niemcy: Bundestag zwiększa presję na rodziców przeciwnych szczepieniom" "<p><a href=""http://fakty.interia.pl/swiat/news-niemcy-bundestag-zwieksza-presje-na-rodzicow-przeciwnych-szc,nId,2400916""><img src=""http://i.iplsc.com/niemcy-bundestag-zwieksza-presje-na-rodzicow-przeciwnych-szc/0006M8W37X3MVJ1M-C307.jpg"" alt=""Niemcy: Bundestag zwiększa presję na rodziców przeciwnych szczepieniom"" align=""left"" /></a> Niemiecki parlament zwiększył presję na rodziców przeciwnych szczepieniu dzieci. Przyjęta w nocy z czwartku na piątek ustawa zobowiązuje przedszkola do przekazywania informacji władzom o przypadkach odmowy przez rodziców udziału w spotkaniu informacyjnym z lekarzem.

 </p><br clear=""all"" />"
"pl_POL_interia_int" "2017-06-02 09:23:23" """Rz"": Miliony dla zwalnianych nauczycieli" "<p><a href=""http://fakty.interia.pl/polska/news-rz-miliony-dla-zwalnianych-nauczycieli,nId,2400918""><img src=""http://i.iplsc.com/rz-miliony-dla-zwalnianych-nauczycieli/0006DN8X72PCM60I-C307.jpg"" alt=""&" "34;Rz&" "34;: Miliony dla zwalnianych nauczycieli"" align=""left"" /></a>Rząd przeprowadza reformę edukacji, a samorządy martwią się, że to na nich spocznie obowiązek wypłacania rekompensat zwalnianym nauczycielom. Jak ustaliła &" "34;Rzeczpospolita&" "34;, gra idzie o miliony złotych.</p><br clear=""all"" />"
"pl_POL_interia_int" "2017-06-02 09:08:47" "Sondaż ""SE"": Szydło lepszym premierem, PO-PSL lepszym rządem" "<p><a href=""http://fakty.interia.pl/prasa/news-sondaz-se-szydlo-lepszym-premierem-po-psl-lepszym-rzadem,nId,2400899""><img src=""http://i.iplsc.com/sondaz-se-szydlo-lepszym-premierem-po-psl-lepszym-rzadem/0006M8TJ37Q4DKPT-C307.jpg"" alt=""Sondaż &" "34;SE&" "34;: Szydło lepszym premierem, PO-PSL lepszym rządem"" align=""left"" /></a>Premier Beata Szydło po 19 miesiącach pracy jest lepszym premierem od Donalda Tuska, ale rząd Prawa i Sprawiedliwości jest słabszy od rządu PO-PSL. Tak wynika z porównawczych sondaży przygotowanych dla „Super Expressu”.</p><br clear=""all"" />"
"pl_POL_interia_int" "2017-06-02 09:05:34" "RMF24: Zawieszono śledztwo ws. śmierci 30-latki po ""ceremonii Kambo""" "<p>Prokuratura zawiesiła śledztwo w sprawie tragicznego finału warsztatów medycyny naturalnej z wykorzystaniem substancji Kambo w Grodzisku Mazowieckim - dowiedział się dziennikarz RMF FM Michał Dobrołowicz. 30-letnia kobieta, która uczestniczyła w zabiegu oczyszczania organizmu za pomocą wydzieliny żaby z Puszczy Amazońskiej, zmarła w listopadzie. </p><br clear=""all"" />"
"pl_POL_interia_int" "2017-06-02 08:38:33" "Uczestnik identyfikacji w Smoleńsku: To Rosjanie rządzili przy zwłokach" "<p><a href=""http://fakty.interia.pl/raporty/raport-lech-kaczynski-nie-zyje/aktualnosci/news-uczestnik-identyfikacji-w-smolensku-to-rosjanie-rzadzili-prz,nId,2400892""><img src=""http://i.iplsc.com/uczestnik-identyfikacji-w-smolensku-to-rosjanie-rzadzili-prz/0006M8SMNDVC3GYJ-C307.jpg"" alt=""Uczestnik identyfikacji w Smoleńsku: To Rosjanie rządzili przy zwłokach"" align=""left"" /></a>&" "34;Polscy patomorfolodzy z początku nie byli dopuszczeni do identyfikacji ciał ofiar katastrofy smoleńskiej&" "34; - mówi w wywiadzie dla piątkowego &" "34;Super Expressu&" "34; dr Dymitr Książek, uczestnik identyfikacji ofiar katastrofy. Rosjanie o wszystkim decydowali - dodaje. </p><br clear=""all"" />"
"pl_POL_interia_int" "2017-06-02 08:26:06" "Prof. Zybertowicz: Sąd Najwyższy świadomie wybrał konfrontację" "<p><a href=""http://fakty.interia.pl/polska/news-prof-zybertowicz-sad-najwyzszy-swiadomie-wybral-konfrontacje,nId,2400882""><img src=""http://i.iplsc.com/prof-zybertowicz-sad-najwyzszy-swiadomie-wybral-konfrontacje/0006M8RSBPOCM4O3-C307.jpg"" alt=""Prof. Zybertowicz: Sąd Najwyższy świadomie wybrał konfrontację"" align=""left"" /></a>&" "34;Prezydent uważa, że Sąd Najwyższy przekroczył swoje uprawnienia&" "34; - powiedział doradca prezydenta, prof. Andrzej Zybertowicz. Chodzi o sprawę aktu łaski, m.in. dla Mariusza Kamińskiego, wobec której sąd najwyższy wydał w środę decyzję.</p><br clear=""all"" />"
"pl_POL_interia_int" "2017-06-02 08:26:03" "Kraków: 134 nauczycieli otrzyma wypowiedzenia" "<p>Z szacunkowych danych - zebranych pod koniec maja od dyrektorów placówek - wynika, że 134 nauczycieli z ponad 10 tys.  zatrudnionych w szkołach samorządowych w Krakowie otrzyma wypowiedzenia.</p><br clear=""all"" />"
"pl_POL_interia_int" "2017-06-02 07:32:38" "Waszczykowski: Jesteśmy postrzegani jako wiarygodny partner" "<p><a href=""http://fakty.interia.pl/polska/news-waszczykowski-jestesmy-postrzegani-jako-wiarygodny-partner,nId,2400865""><img src=""http://i.iplsc.com/waszczykowski-jestesmy-postrzegani-jako-wiarygodny-partner/0006M8OK06W09ANG-C307.jpg"" alt=""Waszczykowski: Jesteśmy postrzegani jako wiarygodny partner"" align=""left"" /></a>Jak uważa szef polskiej dyplomacji Witold Waszczykowski, nNiezależnie od wyniku głosowania nad kandydaturą Polski do Rady Bezpieczeństwa ONZ, kampania już jest sukcesem, bo zaczęliśmy działać globalnie i jesteśmy postrzegani jako wiarygodny partner.</p><br clear=""all"" />"
"pl_POL_interia_int" "2017-06-05 10:56:17" "Polecenie Kim Dzong Una dla sił lotniczych" "<p><a href=""http://fakty.interia.pl/swiat/news-polecenie-kim-dzong-una-dla-sil-lotniczych,nId,2402236""><img src=""http://i.iplsc.com/polecenie-kim-dzong-una-dla-sil-lotniczych/0006MFUBJ0CQRMR1-C307.jpg"" alt=""Polecenie Kim Dzong Una dla sił lotniczych"" align=""left"" /></a>Północnokoreańskie media poinformowały w poniedziałek, że przywódca kraju Kim Dzong Un wezwał lotnictwo, by było gotowe do uderzenia na lotniskowce.  W pobliżu Półwyspu Koreańskiego manewry prowadziły ostatnio lotniskowce USA.</p><br clear=""all"" />"
"pl_POL_interia_int" "2017-06-05 10:46:55" "Gdańsk: Ruszył proces ws. pobicia gimnazjalistki" "<p><a href=""http://fakty.interia.pl/polska/news-gdansk-ruszyl-proces-ws-pobicia-gimnazjalistki,nId,2402230""><img src=""http://i.iplsc.com/gdansk-ruszyl-proces-ws-pobicia-gimnazjalistki/0006GQM3F1WIUOXK-C307.jpg"" alt=""Gdańsk: Ruszył proces ws. pobicia gimnazjalistki"" align=""left"" /></a>Przed Wydziałem Rodzinnym Sądu Rejonowego Gdańsk Południe rozpoczął się w poniedziałek proces siedmiorga nieletnich podejrzewanych o udział w pobiciu 14-letniej gimnazjalistki lub podżegania do bójki. Sprawa toczy się za zamkniętymi drzwiami.</p><br clear=""all"" />"
"pl_POL_interia_int" "2017-06-05 10:36:49" "Ataki terrorystyczne w Wielkiej Brytanii. Głos szefowej policji" "<p><a href=""http://fakty.interia.pl/swiat/news-ataki-terrorystyczne-w-wielkiej-brytanii-glos-szefowej-polic,nId,2402221""><img src=""http://i.iplsc.com/ataki-terrorystyczne-w-wielkiej-brytanii-glos-szefowej-polic/0006MFRSI8IW4SO2-C307.jpg"" alt=""Ataki terrorystyczne w Wielkiej Brytanii. Głos szefowej policji"" align=""left"" /></a>Zdaniem szefowej londyńskiej policji metropolitalnej Cressidy Dick trzy ataki terrorystyczne, których w minionych trzech miesiącach islamiści dokonali w Wielkiej Brytanii, były w znacznej mierze &" "34;krajowymi spiskami&" "34;.</p><br clear=""all"" />"
"pl_POL_interia_int" "2017-06-05 10:25:47" "PO zapowiada wniosek o dymisję Mariusza Błaszczaka" "<p><a href=""http://fakty.interia.pl/polska/news-po-zapowiada-wniosek-o-dymisje-mariusza-blaszczaka,nId,2402212""><img src=""http://i.iplsc.com/po-zapowiada-wniosek-o-dymisje-mariusza-blaszczaka/0006I1A06AWQ1T45-C307.jpg"" alt=""PO zapowiada wniosek o dymisję Mariusza Błaszczaka"" align=""left"" /></a>W ciągu kilku najbliższych dni powstanie wniosek o dymisję ministra spraw wewnętrznych i administracji Mariusza Błaszczaka - zapowiedział w poniedziałek poseł PO Marcin Kierwiński.</p><br clear=""all"" />"
"pl_POL_interia_int" "2017-06-05 10:11:10" "RMF24: Zatrzymano więźnia, który uciekł ze szpitala" "<p><a href=""http://fakty.interia.pl/polska/news-rmf24-zatrzymano-wieznia-ktory-uciekl-ze-szpitala,nId,2402207""><img src=""http://i.iplsc.com/rmf24-zatrzymano-wieznia-ktory-uciekl-ze-szpitala/0006LY67Y5RGYJTH-C307.jpg"" alt=""RMF24: Zatrzymano więźnia, który uciekł ze szpitala"" align=""left"" /></a>Stołeczni policjanci zatrzymali Piotra Ruzickiego - mężczyznę, który w spektakularny sposób uciekł funkcjonariuszom, gdy z prokuratury pod ich eskortą trafił do stołecznego szpitala na Banacha - dowiedzieli się reporterzy śledczy RMF FM. Wraz z Piotrem Ruzickim wpadli jego wspólnicy. Ruzicki, który na koncie ma oszustwa i wyłudzenia, był ścigany w całej Polsce, także przez &" "34;łowców cieni&" "34; - specjalny wydział CBŚP.</p><br clear=""all"" />"
"pl_POL_interia_int" "2017-06-05 10:03:30" "Grupa państw zerwała stosunki z Katarem. Reakcja sekretarza stanu USA" "<p><a href=""http://fakty.interia.pl/swiat/news-grupa-panstw-zerwala-stosunki-z-katarem-reakcja-sekretarza-s,nId,2402206""><img src=""http://i.iplsc.com/grupa-panstw-zerwala-stosunki-z-katarem-reakcja-sekretarza-s/0006MFMH2EWFDKPY-C307.jpg"" alt=""Grupa państw zerwała stosunki z Katarem. Reakcja sekretarza stanu USA"" align=""left"" /></a>Sekretarz stanu USA Rex Tillerson i szef Pentagonu James Mattis oświadczyli w poniedziałek, że nie uważają, by decyzje niektórych państw Zatoki Perskiej o zerwaniu stosunków z Katarem uderzyły w walkę z terroryzmem. Wezwali te państwa do jedności.</p><br clear=""all"" />"
"pl_POL_interia_int" "2017-06-05 09:59:53" "Niezbyt mądre rady Jarosława" "<p>Po zamachu w Londynie pojawiły się recepty na przerwanie serii zamachów. Dosyć podobne. W tę poetykę, jak zauważyła to jedna z gazet, wpisało się m.in. dwóch polityków - Donald Trump i Jarosław Kaczyński. Obaj proponując Europie &" "34;powstanie z kolan i koniec politycznej poprawności&" "34;. Bliższy nam Jarosław, więc przytoczę jego słowa: &" "34;albo Europa, tu zacytuję panią premier, wstanie z kolan i zacznie rozważać przeciwdziałanie, ale to oznacza odrzucenie przede wszystkim poprawności politycznej, albo tego rodzaju wydarzenia będą się powtarzać. To...</p><br clear=""all"" />"
"pl_POL_interia_int" "2017-06-05 09:42:18" "Beata Szydło: Nie będę marszałkiem sejmu" "<p><a href=""http://fakty.interia.pl/polska/news-beata-szydlo-nie-bede-marszalkiem-sejmu,nId,2402192""><img src=""http://i.iplsc.com/beata-szydlo-nie-bede-marszalkiem-sejmu/0006MB1Y5UTKFFV4-C307.jpg"" alt=""Beata Szydło: Nie będę marszałkiem sejmu"" align=""left"" /></a>Premier Beata Szydło zdementowała na Twitterze doniesienia dzisiejszej &" "34;Rzeczpospolitej&" "34;, która podała, że w razie rekonstrukcji Rady Ministrów obecna szefowa rządu miałaby zostać marszałkiem sejmu.</p><br clear=""all"" />"
"pl_POL_interia_int" "2017-06-05 09:40:33" "Katar wyraził ubolewanie po decyzji czterech krajów o zerwaniu stosunków dyplomatycznych" "<p>Władze Kataru wyraziły ubolewanie z powodu decyzji Arabii Saudyjskiej, Zjednoczonych Emiratów Arabskich, Bahrajnu, Jemenu i Egiptu, dotyczącej zerwania stosunków dyplomatycznych. Telewizja Al Dżazira cytowała katarskie ministerstwo spraw zagranicznych, które oświadczyło, że zarzuty pod adresem władz w Dosze są niesprawiedliwe. Państwa Zatoki Perskiej zarzucają swojemu dawnemu sojusznikowi związki z terroryzmem i wspieranie między innymi Bractwa Muzułmańskiego.</p><br clear=""all"" />"
"pl_POL_interia_int" "2017-06-05 09:23:11" "Wałęsa: Terroryzm to narzędzie polityczne" "<p><a href=""http://fakty.interia.pl/polska/news-walesa-terroryzm-to-narzedzie-polityczne,nId,2402180""><img src=""http://i.iplsc.com/walesa-terroryzm-to-narzedzie-polityczne/0006MF6299JVUNRU-C307.jpg"" alt=""Wałęsa: Terroryzm to narzędzie polityczne"" align=""left"" /></a>Takie wydarzenia będę miały miejsce - mówił, odnosząc się do zamachu w Londynie, europoseł PO Jarosław Wałęsa. Jak argumentował, w dzisiejszych czasach &" "34;terroryzm to narzędzie polityczne&" "34; i jak twierdzi, &" "34;terroryzm wygrywa&" "34;.</p><br clear=""all"" />"
