"pl_POL_interia_int" "2017-05-22 06:48:05" """Super Express"": Afera w Wojskowych Zakładach Kartograficznych" "<p><a href=""http://fakty.interia.pl/polska/news-super-express-afera-w-wojskowych-zakladach-kartograficznych,nId,2396446""><img src=""http://i.iplsc.com/super-express-afera-w-wojskowych-zakladach-kartograficznych/0006LDHX5VX2HB5S-C307.jpg"" alt=""&" "34;Super Express&" "34;: Afera w Wojskowych Zakładach Kartograficznych"" align=""left"" /></a>&" "34;Super Express&" "34; informuje, że trwa śledztwo ws. nadużyć w Wojskowych Zakładach Kartograficznych. Chodzi o ogromne pieniądze.</p><br clear=""all"" />"
"pl_POL_interia_int" "2017-05-22 10:39:20" "Zginął w polowaniu. Przygniótł go słoń" "<p><a href=""http://fakty.interia.pl/ciekawostki/news-zginal-w-polowaniu-przygniotl-go-slon,nId,2396548""><img src=""http://i.iplsc.com/zginal-w-polowaniu-przygniotl-go-slon/0006LE0VPSUVX1DR-C307.jpg"" alt=""Zginął w polowaniu. Przygniótł go słoń"" align=""left"" /></a>Theunis Botha był doświadczonym myśliwym i zginął podczas polowania w Zimbabwe. Słoń, którego zastrzelił jeden z towarzyszy Australijczyka, przygniótł 51-letniego mężczyznę.</p><br clear=""all"" />"
"pl_POL_interia_int" "2017-05-22 10:20:06" "Łódź: Informatyk podejrzany o kradzież danych" "<p>Zarzuty ws. kradzieży danych osobowych z bazy wartej ponad 110 mln zł zostały postawione 28-letniemu informatykowi w Łodzi. Mężczyzna został zatrzymany. Grozi mu kara do 8 lat więzienia. Śledztwo nadzoruje warszawska prokuratura okręgowa.
</p><br clear=""all"" />"
"pl_POL_interia_int" "2017-05-22 10:06:16" "Piękna katastrofa, czyli politycy kontra artyści" "<p>Są rzeczy, których i diabeł by nie wymyślił. Jacek Kurski, prezes TVP, zaczął selekcjonować artystów, którzy mieli wystąpić na festiwalu w Opolu. Jeśli ktoś miał niesłuszne poglądy - to won. </p><br clear=""all"" />"
"pl_POL_interia_int" "2017-05-22 09:39:58" "Marcin Warchoł: Operowałem faktami. Nie żałuję" "<p><a href=""http://fakty.interia.pl/polska/news-marcin-warchol-operowalem-faktami-nie-zaluje,nId,2396511""><img src=""http://i.iplsc.com/marcin-warchol-operowalem-faktami-nie-zaluje/0006LDX05P28WXXV-C307.jpg"" alt=""Marcin Warchoł: Operowałem faktami. Nie żałuję"" align=""left"" /></a>&" "34;Operowałem faktami, nie użyłem żadnych epitetów. Absolutnie nie żałuję&" "34; - tak wiceminister sprawiedliwości Marcin Warchoł odniósł się do swojego przemówienia podczas Kongresu Prawników Polskich, po którym większość sędziów opuściła salę.</p><br clear=""all"" />"
"pl_POL_interia_int" "2017-05-22 09:10:39" "Meksyk: 17 ofiar wypadku autobusu w górach" "<p><a href=""http://fakty.interia.pl/swiat/news-meksyk-17-ofiar-wypadku-autobusu-w-gorach,nId,2396500""><img src=""http://i.iplsc.com/meksyk-17-ofiar-wypadku-autobusu-w-gorach/0006LDQ54WANHFO5-C307.jpg"" alt=""Meksyk: 17 ofiar wypadku autobusu w górach"" align=""left"" /></a>Co najmniej 17 osób zginęło, a 31 zostało rannych, gdy autobus wiozący uczestników rekolekcji spadł w 90-metrową przepaść na południu Meksyku - podały w niedzielę służby ratunkowe. Ze wstępnych ustaleń wynika, że wypadek był spowodowany usterką pojazdu.</p><br clear=""all"" />"
"pl_POL_interia_int" "2017-05-22 08:44:46" "Waszczykowski w ""Rz"": Azja i Pacyfik to ważne kierunki polskiej polityki" "<p><a href=""http://fakty.interia.pl/polska/news-waszczykowski-w-rz-azja-i-pacyfik-to-wazne-kierunki-polskiej,nId,2396491""><img src=""http://i.iplsc.com/waszczykowski-w-rz-azja-i-pacyfik-to-wazne-kierunki-polskiej/0006LDNQHH0JOSYI-C307.jpg"" alt=""Waszczykowski w &" "34;Rz&" "34;: Azja i Pacyfik to ważne kierunki polskiej polityki"" align=""left"" /></a>&" "34;Azja i Pacyfik są obecnie ważnym kierunkiem polskiej polityki zagranicznej w wymiarze globalnym&" "34; – pisze w poniedziałkowej &" "34;Rzeczpospolitej&" "34; minister spraw zagranicznych Witold Waszczykowski.</p><br clear=""all"" />"
"pl_POL_interia_int" "2017-05-22 08:36:24" "Liroy-Marzec w ""Do Rzeczy"": Kukiz nie jest nieomylnym despotą" "<p><a href=""http://fakty.interia.pl/polska/news-liroy-marzec-w-do-rzeczy-kukiz-nie-jest-nieomylnym-despota,nId,2396497""><img src=""http://i.iplsc.com/liroy-marzec-w-do-rzeczy-kukiz-nie-jest-nieomylnym-despota/0006LDPFME6NS0OE-C307.jpg"" alt=""Liroy-Marzec w &" "34;Do Rzeczy&" "34;: Kukiz nie jest nieomylnym despotą"" align=""left"" /></a>&" "34;Skłamałbym mówiąc, że się nie kłócę z Pawłem (Kukizem - red.). Dziwne by było, gdybym kiwał głową jak leming na wszystko, co Paweł mówi&" "34; - przyznaje w rozmowie z &" "34;Do Rzeczy&" "34; Piotr Liroy-Marzec, poseł Kukiz'15.</p><br clear=""all"" />"
"pl_POL_interia_int" "2017-05-22 08:35:27" "Marcin Warchoł o sprawie Igora S.: To nie policjanci, a bandyci w mundurach" "<p><a href=""http://fakty.interia.pl/polska/news-marcin-warchol-o-sprawie-igora-s-to-nie-policjanci-a-bandyci,nId,2396485""><img src=""http://i.iplsc.com/marcin-warchol-o-sprawie-igora-s-to-nie-policjanci-a-bandyci/0006LDN5YUFKLCWK-C307.jpg"" alt=""Marcin Warchoł o sprawie Igora S.: To nie policjanci, a bandyci w mundurach"" align=""left"" /></a>&" "34;To zasługuje na potępienie. Trudno mówić, że to byli policjanci, to byli bandyci w mundurach - tak wiceminister sprawiedliwości Marcin Warchoł odniósł się w poniedziałek do upublicznionych nagrań ws. śmierci Igora Stachowiaka na wrocławskim komisariacie.</p><br clear=""all"" />"
"pl_POL_interia_int" "2017-05-22 08:18:57" """Kommiersant"": Nowa inicjatywa Trumpa nie po myśli Putina" "<p><a href=""http://fakty.interia.pl/swiat/news-kommiersant-nowa-inicjatywa-trumpa-nie-po-mysli-putina,nId,2396478""><img src=""http://i.iplsc.com/kommiersant-nowa-inicjatywa-trumpa-nie-po-mysli-putina/0006LB61VFFU2QHB-C307.jpg"" alt=""&" "34;Kommiersant&" "34;: Nowa inicjatywa Trumpa nie po myśli Putina"" align=""left"" /></a>Według dziennika &" "34;Kommiersant&" "34;, Moskwa ma problem z nową inicjatywą Waszyngtonu. Gazeta sugeruje, że amerykański prezydent konstruuje &" "34;islamski pakt&" "34; wymierzony w sojuszników Rosji - Syrię i Iran. Zdaniem &" "34;Kommiersanta&" "34;, ma o tym świadczyć fakt, iż z pierwszą zagraniczną wizytą Donald Trump udał się do Arabii Saudyjskiej, gdzie podpisał kontrakty na prognozowaną kwotę 350 miliardów dolarów. </p><br clear=""all"" />"
"pl_POL_interia_int" "2017-05-23 17:30:54" "Kantar Public: PiS wyprzedza PO" "<p><a href=""http://fakty.interia.pl/polska/news-kantar-public-pis-wyprzedza-po,nId,2397114""><img src=""http://i.iplsc.com/kantar-public-pis-wyprzedza-po/0006LI5KO0WNJQ24-C307.jpg"" alt=""Kantar Public: PiS wyprzedza PO"" align=""left"" /></a>Z sondażu Kantar Public wynika, że 35 proc. osób deklarujących w maju gotowość wzięcia udziału w głosowaniu w wyborach do Sejmu zamierza poprzeć PiS. Na drugim miejscu znalazła się PO z 21 proc. poparciem. Kolejne miejsca zajęły: Kukiz'15 - na to ugrupowanie chce głosować 10 proc. i Nowoczesna - 6 proc.</p><br clear=""all"" />"
"pl_POL_interia_int" "2017-05-23 18:28:49" "Prezydent złożył kwiaty przed ambasadą Wielkiej Brytanii" "<p><a href=""http://fakty.interia.pl/galerie/kraj/zdjecie,iId,2317769,iAId,252102""><img src=""http://i.iplsc.com/prezydent-zlozyl-kwiaty-przed-ambasada-wielkiej-brytanii/0006LIC8WXWS9VOQ-C307.jpg"" alt=""Prezydent złożył kwiaty przed ambasadą Wielkiej Brytanii "" align=""left"" /></a>Prezydent Andrzej Duda złożył we wtorek po południu kwiaty przed ambasadą Wielkiej Brytanii w Warszawie. Prezydent złożył też kondolencje na ręce brytyjskiego ambasadora Jonathana Knotta i wpisał się do księgi kondolencyjnej.

Prezydent przesłał wcześniej we wtorek depeszę kondolencyjną brytyjskiej królowej Elżbiecie II. &" "34;Proszę przyjąć wyrazy głębokiego współczucia z powodu ataku terrorystycznego w Manchester Arena, wśród którego niewinnych ofiar są również dzieci&" "34; - napisał prezydent. &" "34;Ten akt przemocy budzi w nas wszystkich jednoznaczny...</p><br clear=""all"" />"
"pl_POL_interia_int" "2017-05-23 18:04:15" "​Kołobrzeg: Wyrok w głośnej sprawie spowodowania wypadku" "<p><a href=""http://fakty.interia.pl/zachodniopomorskie/news-kolobrzeg-wyrok-w-glosnej-sprawie-spowodowania-wypadku,nId,2397228""><img src=""http://i.iplsc.com/kolobrzeg-wyrok-w-glosnej-sprawie-spowodowania-wypadku/0006FW321YS32239-C307.jpg"" alt=""​Kołobrzeg: Wyrok w głośnej sprawie spowodowania wypadku"" align=""left"" /></a>Sąd Rejonowy w Kołobrzegu skazał Ryszarda W. na 8 lat za spowodowanie wypadku pod Gościnem (zachodniopomorskie), w którym zginął jego syn oraz teść. Choć był pasażerem, to on naruszył zasady bezpieczeństwa w ruchu lądowym - mówił we wtorek sędzia.</p><br clear=""all"" />"
"pl_POL_interia_int" "2017-05-23 17:51:48" "Pogrzeb Magdaleny Żuk" "<p><a href=""http://fakty.interia.pl/polska/news-pogrzeb-magdaleny-zuk,nId,2397218""><img src=""http://i.iplsc.com/pogrzeb-magdaleny-zuk/0006LI9Y0DVBXR1V-C307.jpg"" alt=""Pogrzeb Magdaleny Żuk"" align=""left"" /></a>Kilkaset osób uczestniczyło w pogrzebie Magdaleny Żuk, który odbył się we wtorek, na cmentarzu komunalnym w Bogatyni (woj. dolnośląskie). Żuk zmarła pod koniec kwietnia w Egipcie. Niejasne okoliczności śmierci Polki bada prokuratura.</p><br clear=""all"" />"
"pl_POL_interia_int" "2017-05-23 17:50:54" "​Wotum nieufności dla szefa MON? W środę głosowanie" "<p><a href=""http://fakty.interia.pl/polska/news-wotum-nieufnosci-dla-szefa-mon-w-srode-glosowanie,nId,2397220""><img src=""http://i.iplsc.com/wotum-nieufnosci-dla-szefa-mon-w-srode-glosowanie/0006LIA5QETW5YE3-C307.jpg"" alt=""​Wotum nieufności dla szefa MON? W środę głosowanie"" align=""left"" /></a>Sejm w środę zajmie się wnioskiem o wotum nieufności dla ministra obrony narodowej Antoniego Macierewicza. Wniosek złożyła Platforma Obywatelska.</p><br clear=""all"" />"
"pl_POL_interia_int" "2017-05-23 17:15:16" "​Hiszpania: Policja zatrzymała potencjalnych zamachowców samobójców" "<p><a href=""http://fakty.interia.pl/swiat/news-hiszpania-policja-zatrzymala-potencjalnych-zamachowcow-samob,nId,2397210""><img src=""http://i.iplsc.com/hiszpania-policja-zatrzymala-potencjalnych-zamachowcow-samob/0006LI6NFFXHJ8MF-C307.jpg"" alt=""​Hiszpania: Policja zatrzymała potencjalnych zamachowców samobójców"" align=""left"" /></a>Jak poinformowało ministerstwo spraw wewnętrznych Hiszpanii, policja zatrzymała we wtorek w Madrycie dwóch domniemanych dżihadystów powiązanych z tzw. Państwem Islamskim. Aresztowani to obywatele Maroka. Mają po 43 i 22 lata. Według hiszpańskich organów ścigania obaj mężczyźni to potencjalni zamachowcy samobójcy.</p><br clear=""all"" />"
"pl_POL_interia_int" "2017-05-23 17:14:55" "​Małopolska: Zakonnik oskarżony o molestowanie 22 dzieci" "<p><a href=""http://fakty.interia.pl/malopolskie/news-malopolska-zakonnik-oskarzony-o-molestowanie-22-dzieci,nId,2397208""><img src=""http://i.iplsc.com/malopolska-zakonnik-oskarzony-o-molestowanie-22-dzieci/0006JF0F6P0YRXGG-C307.jpg"" alt=""​Małopolska: Zakonnik oskarżony o molestowanie 22 dzieci"" align=""left"" /></a>Do Sądu Rejonowego w Nowym Targu trafił akt oskarżenia w sprawie wykorzystania seksualnego 22 dzieci przez karmelitę bosego. Zakonnik przyznał się do winy, grozi mu do 12 lat więzienia.</p><br clear=""all"" />"
"pl_POL_interia_int" "2017-05-23 16:59:55" "PO chce wyjaśnień ministerstwa i powołania komisji śledczej ws. Igora Stachowiaka" "<p><a href=""http://fakty.interia.pl/polska/news-po-chce-wyjasnien-ministerstwa-i-powolania-komisji-sledczej-,nId,2397197""><img src=""http://i.iplsc.com/po-chce-wyjasnien-ministerstwa-i-powolania-komisji-sledczej/0006LI3UJGO13CHF-C307.jpg"" alt=""PO chce wyjaśnień ministerstwa i powołania komisji śledczej ws. Igora Stachowiaka "" align=""left"" /></a>Platforma Obywatelska złożyła dzisiaj wniosek o powołanie w Sejmie komisji śledczej, która miałaby zbadać okoliczności zatrzymania i późniejszej śmierci Igora Stachowiaka. Platforma chce przy okazji zbadać powiązania niektórych wrocławskich policjantów z politykami PiS, m.in. z Beatą Kempą. </p><br clear=""all"" />"
"pl_POL_interia_int" "2017-05-23 16:55:36" "Trump: Osiągnięcie pokoju nie będzie łatwe" "<p><a href=""http://fakty.interia.pl/swiat/news-trump-osiagniecie-pokoju-nie-bedzie-latwe,nId,2397202""><img src=""http://i.iplsc.com/trump-osiagniecie-pokoju-nie-bedzie-latwe/0006LI52BM73W9ME-C307.jpg"" alt=""Trump: Osiągnięcie pokoju nie będzie łatwe"" align=""left"" /></a>&" "34;Prezydent Abbas zapewnił mnie, że jest gotów pracować w dobrej wierze dla osiągnięcia tego celu, i premier Netanjahu przyrzeka to samo. Oczekuję współpracy z obydwoma liderami w celu osiągnięcia trwałego pokoju&" "34; - powiedział wcześniej Prezydent USA Donald Trump po wizycie w Betlejem. Trump wezwał we wtorek Izraelczyków i Palestyńczyków do trudnych decyzji na rzecz pokoju, nie wspominając jakie kroki zamierza podjąć, by uzyskać to, co określił jako &" "34;ostateczne porozumienie&" "34; na Bliskim Wschodzie.
</p><br clear=""all"" />"
"pl_POL_interia_int" "2017-05-23 16:45:05" "Prezydent: Cieszę się, że PiS chce zrezygnować z wprowadzenia dwukadencyjności" "<p><a href=""http://fakty.interia.pl/polska/news-prezydent-ciesze-sie-ze-pis-chce-zrezygnowac-z-wprowadzenia-,nId,2397199""><img src=""http://i.iplsc.com/prezydent-ciesze-sie-ze-pis-chce-zrezygnowac-z-wprowadzenia/0006LI3XMYWPU3YJ-C307.jpg"" alt=""Prezydent: Cieszę się, że PiS chce zrezygnować z wprowadzenia dwukadencyjności "" align=""left"" /></a>- Byłem zdecydowanym przeciwnikiem wprowadzania dwukadencyjności w tych wyborach samorządowych; cieszę się, że rezygnacja z takiej propozycji została zasygnalizowana - podkreślił we wtorek prezydent Andrzej Duda. Zapowiedział też powstanie zespołu, który dokona przeglądu regulacji dot. samorządu.</p><br clear=""all"" />"
"pl_POL_interia_int" "2017-05-27 10:56:51" "Odwołano konferencje prasowe Trumpa i Merkel na szczycie G7" "<p><a href=""http://fakty.interia.pl/swiat/news-odwolano-konferencje-prasowe-trumpa-i-merkel-na-szczycie-g7,nId,2398884""><img src=""http://i.iplsc.com/odwolano-konferencje-prasowe-trumpa-i-merkel-na-szczycie-g7/0006LUOB8VUKBT8P-C307.jpg"" alt=""Odwołano konferencje prasowe Trumpa i Merkel na szczycie G7"" align=""left"" /></a>Prezydent USA Donald Trump i kanclerz Niemiec Angela Merkel nie spotkają się na konferencjach prasowych po zakończeniu szczytu G7 w Taorminie w sobotę po południu - poinformowano dziennikarzy relacjonujących obrady.</p><br clear=""all"" />"
"pl_POL_interia_int" "2017-05-27 13:59:57" "Sri Lanka: Ponad sto ofiar śmiertelnych powodzi" "<p><a href=""http://fakty.interia.pl/swiat/news-sri-lanka-ponad-sto-ofiar-smiertelnych-powodzi,nId,2398916""><img src=""http://i.iplsc.com/sri-lanka-ponad-sto-ofiar-smiertelnych-powodzi/0006LUXIJNQSO3FV-C307.jpg"" alt=""Sri Lanka: Ponad sto ofiar śmiertelnych powodzi"" align=""left"" /></a>Do 103 wzrosła w sobotę liczba ofiar śmiertelnych powodzi i osuwisk na Sri Lance, 113 osób zaginęło - podały lankijskie służby zarządzania kryzysowego. Ulewne deszcze monsunowe nawiedziły wyspę w czwartek, zmuszając 2900 mieszkańców do opuszczenia domów.</p><br clear=""all"" />"
"pl_POL_interia_int" "2017-05-27 13:47:28" "Wlk. Brytania: Obniżono poziom zagrożenia atakiem" "<p><a href=""http://fakty.interia.pl/swiat/news-wlk-brytania-obnizono-poziom-zagrozenia-atakiem,nId,2398915""><img src=""http://i.iplsc.com/wlk-brytania-obnizono-poziom-zagrozenia-atakiem/0006LUWP2LVK7C5O-C307.jpg"" alt=""Wlk. Brytania: Obniżono poziom zagrożenia atakiem"" align=""left"" /></a>Brytyjska premier Theresa May poinformowała dzisiaj o obniżeniu poziomu zagrożenia terrorystycznego z najwyższego, piątego, &" "34;krytycznego&" "34; - do czwartego, &" "34;poważnego&" "34;. W poniedziałek w nocy rozpocznie się wycofywanie z ulic żołnierzy wspierających policję.</p><br clear=""all"" />"
"pl_POL_interia_int" "2017-05-27 13:28:44" "TVN24: 22-latek śmiertelnie ugodzony nożem" "<p><a href=""http://fakty.interia.pl/polska/news-tvn24-22-latek-smiertelnie-ugodzony-nozem,nId,2398912""><img src=""http://i.iplsc.com/tvn24-22-latek-smiertelnie-ugodzony-nozem/0006LR4AH9TCCN8A-C307.jpg"" alt=""TVN24: 22-latek śmiertelnie ugodzony nożem"" align=""left"" /></a>W nocy z piątku na sobotę, w Starogardzie Gdańskim (woj. pomorskie) doszło do zabójstwa 22-letniego mężczyzny - podaje TVN24. Zatrzymano podejrzanego.</p><br clear=""all"" />"
"pl_POL_interia_int" "2017-05-27 13:26:25" """Dziennik Zachodni"": Syn premier Szydło został księdzem" "<p>W katedrze w Bielsku-Białej odbyły się dziś święcenia kapłańskie Tymoteusza Szydło, syna premier Beaty Szydło - podaje &" "34;Dziennik Zachodni&" "34;. </p><br clear=""all"" />"
"pl_POL_interia_int" "2017-05-27 12:30:17" "Szwecja: Bulwersująca sprawa sympatyka IS" "<p>30-letni Syryjczyk, którego szwedzkie służby chciały wydalić ze względu na zagrożenie bezpieczeństwa państwa, został zwolniony z aresztu. Powód: mężczyzna sympatyzuje z tzw. Państwem Islamskim i w kraju powrotu groziłoby mu więzienie.</p><br clear=""all"" />"
"pl_POL_interia_int" "2017-05-27 12:17:36" """Rzeczpospolita"": Mateusz Kijowski nie wykonał usług z faktur" "<p><a href=""http://fakty.interia.pl/polska/news-rzeczpospolita-mateusz-kijowski-nie-wykonal-uslug-z-faktur,nId,2398900""><img src=""http://i.iplsc.com/rzeczpospolita-mateusz-kijowski-nie-wykonal-uslug-z-faktur/0006LUTI72MY03H6-C307.jpg"" alt=""&" "34;Rzeczpospolita&" "34;: Mateusz Kijowski nie wykonał usług z faktur"" align=""left"" /></a>Należąca do Mateusza Kijowskiego i jego żony firma nie wykonała żadnej usługi, za które wystawiła sześć faktur ujawnionych na początku stycznia - podaje &" "34;Rzeczpospolita&" "34;. Gazeta dotarła do raportu Komisji Rewizyjnej KOD na ten temat.</p><br clear=""all"" />"
"pl_POL_interia_int" "2017-05-27 12:17:19" "Policja poszukuje Piotra Ruzickiego" "<p><a href=""http://fakty.interia.pl/polska/news-policja-poszukuje-piotra-ruzickiego,nId,2398899""><img src=""http://i.iplsc.com/policja-poszukuje-piotra-ruzickiego/0006LUTCOM1AF7R9-C307.jpg"" alt=""Policja poszukuje Piotra Ruzickiego"" align=""left"" /></a>Stołeczni policjanci poszukują Piotra Ruzickiego, który wczoraj po południu uciekł policjantom ze szpitala przy ulicy Banacha, gdzie został przewieziony na badania.</p><br clear=""all"" />"
"pl_POL_interia_int" "2017-05-27 11:38:10" "Incydent w Berlinie: Auto zjechało schodami na stację metra" "<p><a href=""http://fakty.interia.pl/swiat/news-incydent-w-berlinie-auto-zjechalo-schodami-na-stacje-metra,nId,2398896""><img src=""http://i.iplsc.com/incydent-w-berlinie-auto-zjechalo-schodami-na-stacje-metra/0006LURZ5GTRDMY0-C307.jpg"" alt=""Incydent w Berlinie: Auto zjechało schodami na stację metra "" align=""left"" /></a>Kilka osób zostało rannych w wypadku, do którego doszło w Berlinie. Chcący ominąć rowerzystę kierowca stracił panowanie nad samochodem, który po schodach zjechał na stację metra.</p><br clear=""all"" />"
"pl_POL_interia_int" "2017-05-27 11:37:11" "Dziś sekcja zwłok polskiej ofiary zamachu w Manchesterze" "<p><a href=""http://fakty.interia.pl/raporty/raport-zamach-w-manchesterze/aktualnosci/news-dzis-sekcja-zwlok-polskiej-ofiary-zamachu-w-manchesterze,nId,2398893""><img src=""http://i.iplsc.com/dzis-sekcja-zwlok-polskiej-ofiary-zamachu-w-manchesterze/0006LUR7X5YD100X-C307.jpg"" alt=""Dziś sekcja zwłok polskiej ofiary zamachu w Manchesterze "" align=""left"" /></a>W sobotę, w Wielkiej Brytanii zostanie przeprowadzona sekcja zwłok pierwszej polskiej ofiary zamachu terrorystycznego w Manchesterze. Wezmą w niej udział polski prokurator i biegły medycyny sądowej.</p><br clear=""all"" />"
"pl_POL_interia_int" "2017-05-29 09:50:19" "Wielka Brytania: Nic nie jest jeszcze rozstrzygnięte" "<p><a href=""http://fakty.interia.pl/swiat/news-wielka-brytania-nic-nie-jest-jeszcze-rozstrzygniete,nId,2399227""><img src=""http://i.iplsc.com/wielka-brytania-nic-nie-jest-jeszcze-rozstrzygniete/0006LY5QQFXFBBNE-C307.jpg"" alt=""Wielka Brytania: Nic nie jest jeszcze rozstrzygnięte"" align=""left"" /></a>Premier Jeremy Corbyn? Coś co wydawało się niemożliwe na początku kampanii wyborczej w Wielkiej Brytanii, już takie nie jest. 8 czerwca na Wyspach odbędą się wybory parlamentarne.
</p><br clear=""all"" />"
"pl_POL_interia_int" "2017-05-29 11:20:09" "RMF: CBA na tropie nieświeżych ryb" "<p><a href=""http://fakty.interia.pl/polska/news-rmf-cba-na-tropie-nieswiezych-ryb,nId,2399289""><img src=""http://i.iplsc.com/rmf-cba-na-tropie-nieswiezych-ryb/0006LYEI4KJ0DWFF-C307.jpg"" alt=""RMF: CBA na tropie nieświeżych ryb"" align=""left"" /></a>Szczecińscy agenci CBA na tropie nieświeżych ryb. Funkcjonariusze sprawdzają, czy do supermarketów w całym kraju trafiały produkty rybne niespełniające norm jakości. CBA podejrzewa, że mogło dochodzić do fałszowania dokumentacji. </p><br clear=""all"" />"
"pl_POL_interia_int" "2017-05-29 11:15:48" """Gazeta Krakowska"": Spór o park Jalu Kurka" "<p><a href=""http://fakty.interia.pl/polska/news-gazeta-krakowska-spor-o-park-jalu-kurka,nId,2399290""><img src=""http://i.iplsc.com/gazeta-krakowska-spor-o-park-jalu-kurka/0006LYDD9L78LCVE-C307.jpg"" alt=""&" "34;Gazeta Krakowska&" "34;: Spór o park Jalu Kurka"" align=""left"" /></a>Księża salwatorianie podnieśli stawkę za wykup terenu, na którym znajduje się park Jalu Kurka - podaje dzisiejsza &" "34;Gazeta Krakowska&" "34;. Pojawiły się jednak głosy, że park powinien zostać przekazany w ręce Skarbu Państwa.  </p><br clear=""all"" />"
"pl_POL_interia_int" "2017-05-29 11:15:03" "Rosja: Odpowiemy na estońską prowokację" "<p><a href=""http://fakty.interia.pl/swiat/news-rosja-odpowiemy-na-estonska-prowokacje,nId,2399286""><img src=""http://i.iplsc.com/rosja-odpowiemy-na-estonska-prowokacje/0006LYCZLVLC0002-C307.jpg"" alt=""Rosja: Odpowiemy na estońską prowokację"" align=""left"" /></a>W odpowiedzi na wydalenie w piątek przez estońskie władze dwóch rosyjskich dyplomatów Moskwa będzie kierować się zasadą wzajemności - poinformował w poniedziałek rosyjski wiceminister spraw zagranicznych Władimir Titow.</p><br clear=""all"" />"
"pl_POL_interia_int" "2017-05-29 11:08:55" "Zabrze: Zginął 4-latek wieziony przez ojca motocyklem" "<p><a href=""http://fakty.interia.pl/slaskie/news-zabrze-zginal-4-latek-wieziony-przez-ojca-motocyklem,nId,2399281""><img src=""http://i.iplsc.com/zabrze-zginal-4-latek-wieziony-przez-ojca-motocyklem/0006LYCQDLUK9J0E-C307.jpg"" alt=""Zabrze: Zginął 4-latek wieziony przez ojca motocyklem"" align=""left"" /></a>4-letni chłopiec wieziony przez ojca motocyklem zginął w wypadku, do którego doszło w Zabrzu. Jednoślad zderzył się z samochodem wyjeżdżającym z podporządkowanej ulicy. Policjanci zaznaczają, że jeszcze nie wiadomo, kto ponosi winę za tę tragedię.</p><br clear=""all"" />"
"pl_POL_interia_int" "2017-05-29 10:55:00" "Unijny komisarz chwali kujawsko-pomorskie" "<p>Województwo kujawsko-pomorskie bardzo dobrze współpracuje z Komisją Europejską, jest jednym z liderów w tym zakresie w Polsce - podkreślił w Toruniu komisarz Unii Europejskiej ds. zdrowia i bezpieczeństwa żywności Vytenis Andriukaitis.</p><br clear=""all"" />"
"pl_POL_interia_int" "2017-05-29 10:34:30" "Łosie spacerowały po Lublinie" "<p><a href=""http://fakty.interia.pl/polska/news-losie-spacerowaly-po-lublinie,nId,2399265""><img src=""http://i.iplsc.com/losie-spacerowaly-po-lublinie/0006LY9LCJPXK3RK-C307.jpg"" alt=""Łosie spacerowały po Lublinie"" align=""left"" /></a>Aż trzy łosie spacerowały dzisiaj po Lublinie – podaje &" "34;Kurier Lubelski&" "34; na swojej stronie internetowej. Zwierzęta widziano w Ogrodzie Saskim, a także w okolicy ulicy Probostwo i Czwartek. </p><br clear=""all"" />"
"pl_POL_interia_int" "2017-05-29 10:31:12" "Kwiatkowski wiceszefem europejskiej izby kontroli: ""Nie tylko prestiż""" "<p><a href=""http://fakty.interia.pl/polska/news-kwiatkowski-wiceszefem-europejskiej-izby-kontroli-nie-tylko-,nId,2399264""><img src=""http://i.iplsc.com/kwiatkowski-wiceszefem-europejskiej-izby-kontroli-nie-tylko/0006LY9GA9ISFRMS-C307.jpg"" alt=""Kwiatkowski wiceszefem europejskiej izby kontroli: &" "34;Nie tylko prestiż&" "34;"" align=""left"" /></a>Prezes Najwyższej Izby Kontroli Krzysztof Kwiatkowski został wiceprzewodniczącym Europejskiej Organizacji Najwyższych Organów Kontroli (EUROSAI) - poinformowała NIK w nadesłanym PAP komunikacie.</p><br clear=""all"" />"
"pl_POL_interia_int" "2017-05-29 10:23:00" "Premier do weteranów: Wasza służba to przykład patriotyzmu" "<p><a href=""http://fakty.interia.pl/polska/news-premier-do-weteranow-wasza-sluzba-to-przyklad-patriotyzmu,nId,2399259""><img src=""http://i.iplsc.com/premier-do-weteranow-wasza-sluzba-to-przyklad-patriotyzmu/0006LY90RV3RLOM6-C307.jpg"" alt=""Premier do weteranów: Wasza służba to przykład patriotyzmu"" align=""left"" /></a>Jesteście bohaterami naszych czasów, wasza służba to przykład patriotyzmu, oddania ojczyźnie; jesteście gwarantem solidności polskiej armii - powiedziała premier Beata Szydło w nagraniu opublikowanym w poniedziałek z okazji Dnia Weterana.</p><br clear=""all"" />"
