"993382"	"fr_BEL_derheu_int"	"2014-04-13 22:44:18"	"Ukraine: le conseil de sécurité de l'ONU se réunit en urgence"	"UN"
"1014217"	"fr_BEL_derheu_int"	"2014-04-15 20:45:33"	"Poutine veut que l'ONU condamne les actions de Kiev dans l'est de l'Ukraine"	"UN"
"1403226"	"fr_BEL_derheu_int"	"2014-04-28 07:18:20"	"Les Etats-Unis et UE renforcent leurs sanctions contre Moscou"	"EU"
"1408908"	"fr_BEL_derheu_int"	"2014-04-28 16:18:23"	"Ukraine: UE et USA imposent de nouvelles sanctions à la Russie"	"EU"
"1524988"	"fr_BEL_derheu_int"	"2014-05-07 19:15:04"	"Poutine annonce retirer ses troupes de la frontière ukrainienne, l'OTAN ne confirme rien"	"NATO"
"1598301"	"fr_BEL_derheu_int"	"2014-05-14 07:18:30"	"La Moldavie signera avec l'UE un accord d'association le 27 juin"	"EU"
"1807831"	"fr_BEL_derheu_int"	"2014-05-31 20:56:14"	"Si Juncker devient président de la Commission, la Grande-Bretagne quitte l'UE"	"EU"
"1914610"	"fr_BEL_derheu_int"	"2014-06-10 07:17:50"	"La comptabilité de l'OTAN est opaque"	"NATO"
"2054117"	"fr_BEL_derheu_int"	"2014-06-25 13:55:46"	"Ukraine: l'OTAN réaffirme son soutien à Kiev et exhorte Moscou à respecter ses engagements"	"NATO"
"2077977"	"fr_BEL_derheu_int"	"2014-06-27 10:55:58"	"L'UE signe l'accord d'association avec l'Ukraine, la Géorgie et la Moldavie"	"EU"
"2217688"	"fr_BEL_derheu_int"	"2014-07-09 23:57:24"	"La Corée du Nord proteste auprès de l'ONU à propos d'un film américain"	"UN"
"2249251"	"fr_BEL_derheu_int"	"2014-07-15 02:19:56"	"Abbas demande à l'ONU de placer la ""Palestine sous protection internationale"""	"UN"
"2324106"	"fr_BEL_derheu_int"	"2014-07-21 09:18:51"	"Gaza: pas de soldat israélien enlevé, selon l'ambassadeur israélien à l'ONU"	"UN"
"2327513"	"fr_BEL_derheu_int"	"2014-07-21 15:18:53"	"Crash MH17: l'UE va-t-elle durcir les sanctions"	"EU"
"2328143"	"fr_BEL_derheu_int"	"2014-07-21 16:18:53"	"Crash MH17: l'UE va-t-elle durcir les sanctions?"	"EU"
"2357344"	"fr_BEL_derheu_int"	"2014-07-23 21:06:22"	"L'ONU lance une enquête sur l'offensive israélienne à Gaza"	"UN"
"2388731"	"fr_BEL_derheu_int"	"2014-07-26 11:06:59"	"Ukraine: l'UE sanctionne les chefs des services de renseignement russes"	"EU"
"2389798"	"fr_BEL_derheu_int"	"2014-07-26 14:07:00"	"Ukraine: l'UE durcit le ton, Moscou réplique"	"EU"
"2424922"	"fr_BEL_derheu_int"	"2014-07-29 21:31:27"	"L'UE adopte les premières sanctions économiques contre la Russie"	"EU"
"2429494"	"fr_BEL_derheu_int"	"2014-07-30 07:31:30"	"Une école de l'ONU bombardée par Israël"	"UN"
"2448030"	"fr_BEL_derheu_int"	"2014-07-31 16:31:39"	"L'ONU dénonce le projet de Washington d'expulser les enfants"	"UN"
"2448756"	"fr_BEL_derheu_int"	"2014-07-31 17:31:39"	"Gaza: Israël veut ""finir le travail"" malgré les critiques de l'ONU"	"UN"
"2478996"	"fr_BEL_derheu_int"	"2014-08-03 16:31:56"	"Gaza: L'UE appelle Palestiniens et Israéliens à cesser le bain de sang"	"EU"
"2481464"	"fr_BEL_derheu_int"	"2014-08-03 22:31:58"	"L'armée israélienne reconnaît avoir tiré près de l' école de l'ONU à Rafah"	"UN"
"2537647"	"fr_BEL_derheu_int"	"2014-08-08 12:08:31"	"Ebola: Le risque est""extrêmement faible"" de toucher l'UE"	"EU"
"2595374"	"fr_BEL_derheu_int"	"2014-08-13 19:09:25"	"L'ONU complice des terroristes du Hamas?"	"UN"
"2604972"	"fr_BEL_derheu_int"	"2014-08-14 14:09:30"	"Irak: selon l'ONU, il ne reste qu'un millier de Yazidis dans les monts Sinjar"	"UN"
"2618308"	"fr_BEL_derheu_int"	"2014-08-15 17:09:39"	"L'UE aussi va fournir des armes aux Kurdes"	"EU"
"2618943"	"fr_BEL_derheu_int"	"2014-08-15 18:09:40"	"L'UE aussi va fournir des armes aux Kurdes irakiens"	"EU"
"2624337"	"fr_BEL_derheu_int"	"2014-08-16 08:09:44"	"Irak: l'ONU adopte des mesures contre les jihadistes"	"UN"
"2792919"	"fr_BEL_derheu_int"	"2014-08-31 08:55:45"	"Ukraine: l'UE donne une semaine à Moscou avant de nouvelles sanctions"	"EU"
"2819656"	"fr_BEL_derheu_int"	"2014-09-02 17:56:04"	"Les Palestiniens demandent à l'ONU la fin de l'occupation israélienne d'ici 3 ans"	"UN"
"2875342"	"fr_BEL_derheu_int"	"2014-09-08 22:11:45"	"L'UE adopte de nouvelles sanctions contre la Russie"	"EU"
"2903101"	"fr_BEL_derheu_int"	"2014-09-12 09:36:26"	"Le parlement ukrainien ratifiera mardi l'accord d'association avec l'UE"	"EU"
"2944625"	"fr_BEL_derheu_int"	"2014-09-16 08:37:14"	"Quatre soldats de l'OTAN tués dans un attentat à Kaboul"	"NATO"
"2945455"	"fr_BEL_derheu_int"	"2014-09-16 09:54:04"	"Trois soldats de l'OTAN tués dans un attentat à Kaboul"	"NATO"
"3043572"	"fr_BEL_derheu_int"	"2014-09-24 17:03:25"	"Mobilisation générale contre les jihadistes à l'ONU"	"UN"
"3073559"	"fr_BEL_derheu_int"	"2014-09-27 00:15:53"	"Di Rupo vante les mérites belges à l'ONU et promet un combat contre les ""terroristes"""	"UN"
"3076247"	"fr_BEL_derheu_int"	"2014-09-27 08:17:12"	"A la tribune de l'ONU, Di Rupo dénonce l'héritage des années Bush"	"UN"
"3076375"	"fr_BEL_derheu_int"	"2014-09-27 09:15:56"	"Di Rupo vante les mérites belges à l'ONU et promet un combat contre les ""terroristes"""	"UN"
"3238077"	"fr_BEL_derheu_int"	"2014-10-10 23:17:36"	"L'Etat islamique prend le QG kurde à Kobané, l'ONU craint un ""massacre"""	"UN"
"3261315"	"fr_BEL_derheu_int"	"2014-10-13 13:17:49"	"Ebola: les ministres de l'UE vont discuter des contrôles aux aéroports"	"EU"
"3367657"	"fr_BEL_derheu_int"	"2014-10-22 07:19:37"	"Un responsable de l'ONU accuse le groupe Etat islamique de ""tentative de génocide"""	"UN"
"3373942"	"fr_BEL_derheu_int"	"2014-10-22 17:22:08"	"En 2016, la Suisse n'acceptera que les strip-teaseuses de l'UE"	"EU"
"3563928"	"fr_BEL_derheu_int"	"2014-11-07 14:38:12"	"Cameron: ""gros problème"" si pas d'accord sur la rallonge budgétaire britannique à l'UE"	"EU"
"3765944"	"fr_BEL_derheu_int"	"2014-11-25 11:43:50"	"UE : Les lobbies chrétiens reprennent vigueur"	"EU"
"4019911"	"fr_BEL_derheu_int"	"2014-12-17 16:41:16"	"Erdogan ne supporte pas les ""leçons de démocratie"" de l'UE"	"EU"
"5415778"	"fr_BEL_derheu_int"	"2015-03-12 20:39:57"	"L'Islande annonce le retrait de sa candidature à l'UE"	"EU"
"6252516"	"fr_BEL_derheu_int"	"2015-04-20 09:38:16"	"Naufrage en Méditerranée : l'UE réunit en urgence ses ministres de l'Intérieur et des ..."	"EU"
"6336427"	"fr_BEL_derheu_int"	"2015-04-23 22:05:46"	"Migrants: l'UE va tripler le budget de son opération de sauvetage en Méditerranée"	"EU"
"7088927"	"fr_BEL_derheu_int"	"2015-05-28 07:17:37"	"Référendum en G-B: ""Le Royaume-Uni doit-il rester membre de l'UE?"" sera la question ..."	"EU"
"7287819"	"fr_BEL_derheu_int"	"2015-06-06 07:56:08"	"Pour Valéry Giscard d'Estaing, beaucoup de demandes britanniques sur l'UE sont légitimes"	"EU"
"7735369"	"fr_BEL_derheu_int"	"2015-06-26 16:33:51"	"Alexis Tsipras refuse ""ultimatums et chantage"" dans l'UE"	"EU"
